@prefix : <http://www.example.com/ontology/warship#> .
@prefix owl: <http://www.w3.org/2002/07/owl#> .
@prefix crm: <http://www.cidoc-crm.org/cidoc-crm/> .
@prefix rdf: <http://www.w3.org/1999/02/22-rdf-syntax-ns#> .
@prefix sealit: <http://www.sealitproject.eu/ontology/> .
@prefix xml: <http://www.w3.org/XML/1998/namespace> .
@prefix xsd: <http://www.w3.org/2001/XMLSchema#> .
@prefix rdfs: <http://www.w3.org/2000/01/rdf-schema#> .
@prefix dcterms: <http://purl.org/dc/terms/> .
@prefix myData: <http://www.example.com/myData/> .



# --- Data from file: ACD_0001.ttl ---


### Places
myData:place_portsmouth a crm:E53_Place ;
  rdfs:label "Portsmouth"@en .

### Ship
myData:ACD_0001 a sealit:Ship ;
  rdfs:label "HMS Royal Sovereign"@en ;
  :has_propulsion_type :ScrewPropeller ;
  :has_ship_type :ArmouredCoastalDefenceShip ;
  dcterms:source "Winfield, Rif. British Warships in the Age of Sail, 1817-1863. Seaforth Publishing, 2014."@en .

### Career Events and Presences

# Production (Anchor Event: Start of Career)
myData:event_ACD_0001_01 a crm:E12_Production ;
  rdfs:label "Construction and conversion (Ord: 29.6.1848, K: 17.12.1849, L: 25.4.1857, Re-ord: 3.4.1862, C: 20.8.1864)"@en ;
  rdfs:comment "The completion date (C) is after the first commissioning date. For temporal consistency, the production event is modeled to end just before the commissioning."@en ;
  crm:P7_took_place_at myData:place_portsmouth ;
  crm:P4_has_time-span [
    a crm:E52_Time-Span ;
    crm:P79_beginning_is_qualified_by "1848-06-29"^^xsd:date ;
    crm:P80_end_is_qualified_by "1864-07-07"^^xsd:date
  ] ;
  :incurred_cost [
    a crm:E97_Monetary_Amount ;
    rdfs:comment "First cost: £180,572"@en ;
    crm:P90_has_value "180572.0"^^xsd:decimal
  ] ;
  crm:P21_had_general_purpose :CombatCapabilityInvestment .

# First Service Period
myData:event_ACD_0001_02 a :Commissioning ;
  rdfs:label "Commissioned 7.7.1864 for the Channel Squadron"@en ;
  crm:P4_has_time-span [
    a crm:E52_Time-Span ;
    crm:P82_at_some_time_within "1864-07-07"^^xsd:date
  ] .

myData:event_ACD_0001_03 a :Decommissioning ;
  rdfs:label "Paid off 15.10.1864 as tender to Excellent"@en ;
  crm:P4_has_time-span [
    a crm:E52_Time-Span ;
    crm:P82_at_some_time_within "1864-10-15"^^xsd:date
  ] .

myData:presence_ACD_0001_01 a crm:E93_Presence ;
  rdfs:label "In commission in the Channel Squadron"@en ;
  crm:P195i_had_presence myData:ACD_0001 ;
  :has_operational_status :InCommission ;
  crm:P164_is_temporally_specified_by [
    a crm:E52_Time-Span ;
    crm:P182i_starts_after_or_with_the_end_of myData:event_ACD_0001_02 ;
    crm:P182_ends_before_or_with_the_start_of myData:event_ACD_0001_03
  ] .

# Second Service Period
myData:event_ACD_0001_04 a :Commissioning ;
  rdfs:label "Commissioned 1.7.1865 for the Channel squadron"@en ;
  crm:P4_has_time-span [
    a crm:E52_Time-Span ;
    crm:P82_at_some_time_within "1865-07-01"^^xsd:date
  ] .

myData:presence_ACD_0001_02 a crm:E93_Presence ;
  rdfs:label "As tender to Excellent"@en ;
  crm:P195i_had_presence myData:ACD_0001 ;
  :has_operational_status :InNonCombatDuty ;
  :has_ship_role :Tender ;
  crm:P164_is_temporally_specified_by [
    a crm:E52_Time-Span ;
    crm:P182i_starts_after_or_with_the_end_of myData:event_ACD_0001_03 ;
    crm:P182_ends_before_or_with_the_start_of myData:event_ACD_0001_04
  ] .

myData:event_ACD_0001_05 a :Decommissioning ;
  rdfs:label "Paid off 9.10.1865 as tender to Excellent again"@en ;
  crm:P4_has_time-span [
    a crm:E52_Time-Span ;
    crm:P82_at_some_time_within "1865-10-09"^^xsd:date
  ] .

myData:presence_ACD_0001_03 a crm:E93_Presence ;
  rdfs:label "In commission in the Channel squadron"@en ;
  crm:P195i_had_presence myData:ACD_0001 ;
  :has_operational_status :InCommission ;
  crm:P164_is_temporally_specified_by [
    a crm:E52_Time-Span ;
    crm:P182i_starts_after_or_with_the_end_of myData:event_ACD_0001_04 ;
    crm:P182_ends_before_or_with_the_start_of myData:event_ACD_0001_05
  ] .

# Third Service Period
myData:event_ACD_0001_06 a :Recommissioning ;
  rdfs:label "Recommissioned 7.1867 for the 17.6.1867 Naval Review"@en ;
  crm:P4_has_time-span [
    a crm:E52_Time-Span ;
    crm:P82_at_some_time_within "1867-07"^^xsd:gYearMonth
  ] .

myData:presence_ACD_0001_04 a crm:E93_Presence ;
  rdfs:label "As tender to Excellent"@en ;
  crm:P195i_had_presence myData:ACD_0001 ;
  :has_operational_status :InNonCombatDuty ;
  :has_ship_role :Tender ;
  crm:P164_is_temporally_specified_by [
    a crm:E52_Time-Span ;
    crm:P182i_starts_after_or_with_the_end_of myData:event_ACD_0001_05 ;
    crm:P182_ends_before_or_with_the_start_of myData:event_ACD_0001_06
  ] .

myData:event_ACD_0001_07 a :Decommissioning ;
  rdfs:label "Paid off 3.9.1869"@en ;
  crm:P4_has_time-span [
    a crm:E52_Time-Span ;
    crm:P82_at_some_time_within "1869-09-03"^^xsd:date
  ] .

myData:presence_ACD_0001_05 a crm:E93_Presence ;
  rdfs:label "In commission for the Naval Review"@en ;
  crm:P195i_had_presence myData:ACD_0001 ;
  :has_operational_status :InCommission ;
  crm:P164_is_temporally_specified_by [
    a crm:E52_Time-Span ;
    crm:P182i_starts_after_or_with_the_end_of myData:event_ACD_0001_06 ;
    crm:P182_ends_before_or_with_the_start_of myData:event_ACD_0001_07
  ] .

# Final Period and Destruction (Anchor Event: End of Career)
myData:event_ACD_0001_08 a crm:E6_Destruction ;
  rdfs:label "Sold to be broken up (BU) 5.1885"@en ;
  crm:P13_destroyed myData:ACD_0001 ;
  crm:P4_has_time-span [
    a crm:E52_Time-Span ;
    crm:P82_at_some_time_within "1885-05"^^xsd:gYearMonth
  ] .

myData:presence_ACD_0001_06 a crm:E93_Presence ;
  rdfs:label "In reserve after last decommissioning"@en ;
  rdfs:comment "[Assumption] Ship was in ordinary/reserve between being paid off and being sold."@en ;
  crm:P195i_had_presence myData:ACD_0001 ;
  :has_operational_status :InOrdinary ;
  crm:P164_is_temporally_specified_by [
    a crm:E52_Time-Span ;
    crm:P182i_starts_after_or_with_the_end_of myData:event_ACD_0001_07 ;
    crm:P182_ends_before_or_with_the_start_of myData:event_ACD_0001_08
  ] .

# --- Data from file: ACD_0002.ttl ---


### Places
myData:place_poplar a crm:E53_Place ; rdfs:label "Poplar"@en .
myData:place_woolwich a crm:E53_Place ; rdfs:label "Woolwich"@en .
myData:place_devenport a crm:E53_Place ; rdfs:label "Devenport"@en .
myData:place_preston a crm:E53_Place ; rdfs:label "Preston"@en .

### Ship
myData:ACD_0002 a sealit:Ship ;
  rdfs:label "HMS Prince Albert"@en ;
  :has_propulsion_type :ScrewPropeller ;
  :has_ship_type :ArmouredCoastalDefenceShip ;
  dcterms:source "Winfield, Rif. British Warships in the Age of Sail, 1817-1863. Seaforth Publishing, 2014."@en .

### Events
# Career Start: Construction
myData:event_ACD_0002_01 a crm:E12_Production ;
  rdfs:label "Built by Samuda Bros, Poplar/Humphrys & Tennant"@en ;
  crm:P7_took_place_at myData:place_poplar ;
  crm:P4_has_time-span [
    a crm:E52_Time-Span ;
    rdfs:comment "Ordered: 8.4.1862, Keel laid: 29.4.1862, Launched: 23.5.1864, Completed: 23.2.1866"@en ;
    crm:P79_beginning_is_qualified_by "1862-04-08"^^xsd:date ; # Ord
    crm:P80_end_is_qualified_by "1864-05-23"^^xsd:date   # L
  ] ;
  :incurred_cost [
    a crm:E97_Monetary_Amount ;
    rdfs:comment "First cost: £208,345"@en ;
    crm:P90_has_value "208345.0"^^xsd:decimal
  ] ;
  crm:P21_had_general_purpose :CombatCapabilityInvestment .

# First Commissioning
myData:event_ACD_0002_02 a :Commissioning ;
  rdfs:label "Commissioned for trials at Woolwich"@en ;
  crm:P7_took_place_at myData:place_woolwich ;
  crm:P4_has_time-span [
    a crm:E52_Time-Span ;
    crm:P82_at_some_time_within "1866-01-30"^^xsd:date
  ] .

# First Decommissioning
myData:event_ACD_0002_03 a :Decommissioning ;
  rdfs:label "Paid off"@en ;
  crm:P4_has_time-span [
    a crm:E52_Time-Span ;
    crm:P82_at_some_time_within "1866-06"^^xsd:gYearMonth
  ] .

# Recommissioning
myData:event_ACD_0002_04 a :Recommissioning ;
  rdfs:label "Recommissioned for Jubilee Review"@en ;
  crm:P4_has_time-span [
    a crm:E52_Time-Span ;
    crm:P82_at_some_time_within "1887"^^xsd:gYear
  ] .

# To Reserve
myData:event_ACD_0002_05 a :Decommissioning ;
  rdfs:label "To Dockyard Reserve"@en ;
  crm:P4_has_time-span [
    a crm:E52_Time-Span ;
    crm:P82_at_some_time_within "1898"^^xsd:gYear
  ] .

# Career End: Sale and Breaking Up
myData:event_ACD_0002_06 a crm:E6_Destruction ;
  rdfs:label "Sold to Ward, Preston for BU"@en ;
  crm:P13_destroyed myData:ACD_0002 ;
  crm:P7_took_place_at myData:place_preston ;
  crm:P4_has_time-span [
    a crm:E52_Time-Span ;
    crm:P82_at_some_time_within "1899-03-16"^^xsd:date
  ] .

### Presences (States)
# Under fitting after launch
myData:presence_ACD_0002_01 a crm:E93_Presence ;
  rdfs:label "Fitting out after launch"@en ;
  crm:P195i_had_presence myData:ACD_0002 ;
  :has_operational_status :UnderFitting ;
  :has_propulsion_type :ScrewPropeller ;
  :has_ship_type :ArmouredCoastalDefenceShip ;
  crm:P164_is_temporally_specified_by [
    a crm:E52_Time-Span ;
    crm:P182i_starts_after_or_with_the_end_of myData:event_ACD_0002_01 ;
    crm:P182_ends_before_or_with_the_start_of myData:event_ACD_0002_02
  ] .

# In commission for trials
myData:presence_ACD_0002_02 a crm:E93_Presence ;
  rdfs:label "In commission for trials"@en ;
  crm:P195i_had_presence myData:ACD_0002 ;
  :has_operational_status :InCommission ;
  :has_propulsion_type :ScrewPropeller ;
  :has_ship_type :ArmouredCoastalDefenceShip ;
  crm:P167_was_within myData:place_woolwich ;
  crm:P164_is_temporally_specified_by [
    a crm:E52_Time-Span ;
    crm:P182i_starts_after_or_with_the_end_of myData:event_ACD_0002_02 ;
    crm:P182_ends_before_or_with_the_start_of myData:event_ACD_0002_03
  ] .

# Gunnery tender (uncommissioned)
myData:presence_ACD_0002_03 a crm:E93_Presence ;
  rdfs:label "Gunnery tender (uncommissioned) at Devenport; in Spithead Review 1867; in Particular Reserve Squadron 1878"@en ;
  crm:P195i_had_presence myData:ACD_0002 ;
  :has_operational_status :InNonCombatDuty ;
  :has_propulsion_type :ScrewPropeller ;
  :has_ship_role :GunneryTender ;
  crm:P167_was_within myData:place_devenport ;
  crm:P164_is_temporally_specified_by [
    a crm:E52_Time-Span ;
    crm:P182i_starts_after_or_with_the_end_of myData:event_ACD_0002_03 ;
    crm:P182_ends_before_or_with_the_start_of myData:event_ACD_0002_04
  ] .

# Recommissioned for reviews and manoeuvres
myData:presence_ACD_0002_04 a crm:E93_Presence ;
  rdfs:label "Recommissioned for Jubilee Review (1887) and naval manoeuvres (1889)"@en ;
  crm:P195i_had_presence myData:ACD_0002 ;
  :has_operational_status :InCommission ;
  :has_propulsion_type :ScrewPropeller ;
  :has_ship_type :ArmouredCoastalDefenceShip ;
  crm:P164_is_temporally_specified_by [
    a crm:E52_Time-Span ;
    crm:P182i_starts_after_or_with_the_end_of myData:event_ACD_0002_04 ;
    crm:P182_ends_before_or_with_the_start_of myData:event_ACD_0002_05
  ] .

# In Dockyard Reserve
myData:presence_ACD_0002_05 a crm:E93_Presence ;
  rdfs:label "In Dockyard Reserve"@en ;
  crm:P195i_had_presence myData:ACD_0002 ;
  :has_operational_status :InOrdinary ;
  :has_propulsion_type :ScrewPropeller ;
  :has_ship_type :ArmouredCoastalDefenceShip ;
  crm:P164_is_temporally_specified_by [
    a crm:E52_Time-Span ;
    crm:P182i_starts_after_or_with_the_end_of myData:event_ACD_0002_05 ;
    crm:P182_ends_before_or_with_the_start_of myData:event_ACD_0002_06
  ] .

# --- Data from file: AIF_0001.ttl ---


### Places
myData:place_blackwall a crm:E53_Place ; rdfs:label "Blackwall"@en .
myData:place_portsmouth a crm:E53_Place ; rdfs:label "Portsmouth"@en .
myData:place_portland a crm:E53_Place ; rdfs:label "Portland"@en .
myData:place_greenock a crm:E53_Place ; rdfs:label "Greenock"@en .
myData:place_pembroke a crm:E53_Place ; rdfs:label "Pembroke"@en .
myData:place_west_hartlepool a crm:E53_Place ; rdfs:label "West Hartlepool"@en .

### Ship Roles
myData:role_coastguard_ship a :ShipRole ; rdfs:label "Coastguard ship"@en .
myData:role_tender_ship a :ShipRole ; rdfs:label "Tender ship"@en .
myData:role_depot_ship a :ShipRole ; rdfs:label "Depot ship"@en .
myData:role_oil_jetty a :ShipRole ; rdfs:label "Oil jetty"@en .
myData:role_museum_ship a :ShipRole ; rdfs:label "Museum ship"@en .

### Ship
myData:AIF_0001 a sealit:Ship ;
  rdfs:label "HMS Warrior"@en ;
  :has_propulsion_type :ScrewPropeller ;
  :has_ship_type :ArmouredIronFrigate ;
  dcterms:source "Winfield, Rif. British Warships in the Age of Sail, 1817-1863. Seaforth Publishing, 2014."@en .

### Construction and Commissioning
myData:event_AIF_0001_01 a crm:E12_Production ;
  rdfs:label "Construction by Thames Iron Sbdg Co., Blackwall"@en ;
  crm:P7_took_place_at myData:place_blackwall ;
  crm:P4_has_time-span [
    a crm:E52_Time-Span ;
    crm:P79_beginning_is_qualified_by "1859-05-25"^^xsd:date ; # K: Keel laid
    crm:P80_end_is_qualified_by "1860-12-29"^^xsd:date # L: Launched
  ] ;
  :incurred_cost [
    a crm:E97_Monetary_Amount ;
    rdfs:comment "First cost: £377,292"@en ;
    crm:P90_has_value "377292.0"^^xsd:decimal
  ] ;
  crm:P21_had_general_purpose :CombatCapabilityInvestment .

myData:event_AIF_0001_02 a :Commissioning ;
  rdfs:label "Commissioned 1.8.1861"@en ;
  crm:P4_has_time-span [ a crm:E52_Time-Span ; crm:P82_at_some_time_within "1861-08-01"^^xsd:date ] .

myData:presence_AIF_0001_01 a crm:E93_Presence ;
  rdfs:label "Under fitting between launch and commissioning"@en ;
  crm:P195i_had_presence myData:AIF_0001 ;
  :has_operational_status :UnderFitting ;
  crm:P164_is_temporally_specified_by [ a crm:E52_Time-Span ;
    crm:P182i_starts_after_or_with_the_end_of myData:event_AIF_0001_01 ;
    crm:P182_ends_before_or_with_the_start_of myData:event_AIF_0001_02 ] .

### First Service Period
myData:event_AIF_0001_03 a :Decommissioning ;
  rdfs:label "Paid off 22.11.1864 at Portsmouth"@en ;
  crm:P7_took_place_at myData:place_portsmouth ;
  crm:P4_has_time-span [ a crm:E52_Time-Span ; crm:P82_at_some_time_within "1864-11-22"^^xsd:date ] .

myData:presence_AIF_0001_02 a crm:E93_Presence ;
  rdfs:label "In commission for the Channel squadron (1861-1864)"@en ;
  crm:P195i_had_presence myData:AIF_0001 ;
  :has_operational_status :InCommission ;
  crm:P164_is_temporally_specified_by [ a crm:E52_Time-Span ;
    crm:P182i_starts_after_or_with_the_end_of myData:event_AIF_0001_02 ;
    crm:P182_ends_before_or_with_the_start_of myData:event_AIF_0001_03 ] .

### Second Service Period
myData:event_AIF_0001_04 a :Recommissioning ;
  rdfs:label "Recommissioned 7.7.1867"@en ;
  crm:P4_has_time-span [ a crm:E52_Time-Span ; crm:P82_at_some_time_within "1867-07-07"^^xsd:date ] .

myData:presence_AIF_0001_03 a crm:E93_Presence ;
  rdfs:label "Paid off at Portsmouth (1864-1867)"@en ;
  crm:P195i_had_presence myData:AIF_0001 ;
  :has_operational_status :PaidOff ;
  crm:P167_was_within myData:place_portsmouth ;
  crm:P164_is_temporally_specified_by [ a crm:E52_Time-Span ;
    crm:P182i_starts_after_or_with_the_end_of myData:event_AIF_0001_03 ;
    crm:P182_ends_before_or_with_the_start_of myData:event_AIF_0001_04 ] .

myData:event_AIF_0001_05 a :Decommissioning ;
  rdfs:label "Paid off 15.9.1871"@en ;
  crm:P4_has_time-span [ a crm:E52_Time-Span ; crm:P82_at_some_time_within "1871-09-15"^^xsd:date ] .

myData:presence_AIF_0001_04 a crm:E93_Presence ;
  rdfs:label "In commission for the Channel squadron (1867-1871)"@en ;
  crm:P195i_had_presence myData:AIF_0001 ;
  :has_operational_status :InCommission ;
  crm:P164_is_temporally_specified_by [ a crm:E52_Time-Span ;
    crm:P182i_starts_after_or_with_the_end_of myData:event_AIF_0001_04 ;
    crm:P182_ends_before_or_with_the_start_of myData:event_AIF_0001_05 ] .

### Refit and Third Service Period
myData:event_AIF_0001_06 a :Refit ;
  rdfs:label "Refitted, with a poop and a steam capstan added"@en ;
  :modifies_ship myData:AIF_0001 ;
  crm:P4_has_time-span [
    a crm:E52_Time-Span ;
    crm:P79_beginning_is_qualified_by "1871-09"^^xsd:gYearMonth ;
    crm:P80_end_is_qualified_by "1875-06"^^xsd:gYearMonth ] .

myData:presence_AIF_0001_05 a crm:E93_Presence ;
  rdfs:label "Undergoing refit (1871-1875)"@en ;
  crm:P195i_had_presence myData:AIF_0001 ;
  :has_operational_status :UnderRepair ;
  crm:P164_is_temporally_specified_by [ a crm:E52_Time-Span ;
    crm:P182i_starts_after_or_with_the_end_of myData:event_AIF_0001_05 ;
    crm:P182_ends_before_or_with_the_start_of myData:event_AIF_0001_07 ] .

myData:event_AIF_0001_07 a :Recommissioning ;
  rdfs:label "Recommissioned 11.6.1875"@en ;
  crm:P4_has_time-span [ a crm:E52_Time-Span ; crm:P82_at_some_time_within "1875-06-11"^^xsd:date ] .

myData:event_AIF_0001_07a a crm:E7_Activity ;
  rdfs:label "Assigned to coastguard at Portland"@en ;
  crm:P4_has_time-span [ a crm:E52_Time-Span ; crm:P82_at_some_time_within "1876"^^xsd:gYear ] .

myData:presence_AIF_0001_06 a crm:E93_Presence ;
  rdfs:label "In commission for the Channel squadron (1875-1876)"@en ;
  crm:P195i_had_presence myData:AIF_0001 ;
  :has_operational_status :InCommission ;
  crm:P164_is_temporally_specified_by [ a crm:E52_Time-Span ;
    crm:P182i_starts_after_or_with_the_end_of myData:event_AIF_0001_07 ;
    crm:P182_ends_before_or_with_the_start_of myData:event_AIF_0001_07a ] .

myData:event_AIF_0001_08 a :Decommissioning ;
  rdfs:label "Paid off 30.4.1881"@en ;
  crm:P4_has_time-span [ a crm:E52_Time-Span ; crm:P82_at_some_time_within "1881-04-30"^^xsd:date ] .

myData:presence_AIF_0001_07 a crm:E93_Presence ;
  rdfs:label "Coastguard duty at Portland (1876-1881)"@en ;
  crm:P195i_had_presence myData:AIF_0001 ;
  :has_operational_status :InNonCombatDuty ;
  :has_ship_role myData:role_coastguard_ship ;
  crm:P167_was_within myData:place_portland ;
  crm:P164_is_temporally_specified_by [ a crm:E52_Time-Span ;
    crm:P182i_starts_after_or_with_the_end_of myData:event_AIF_0001_07a ;
    crm:P182_ends_before_or_with_the_start_of myData:event_AIF_0001_08 ] .

### Fourth Service Period
myData:event_AIF_0001_09 a :Recommissioning ;
  rdfs:label "Recommissioned 1.5.1881"@en ;
  crm:P4_has_time-span [ a crm:E52_Time-Span ; crm:P82_at_some_time_within "1881-05-01"^^xsd:date ] .

myData:event_AIF_0001_10 a :ShipConversion ;
  rdfs:label "Became tender to Asia at Portsmouth"@en ;
  crm:P4_has_time-span [ a crm:E52_Time-Span ; crm:P82_at_some_time_within "1883-06"^^xsd:gYearMonth ] .

myData:presence_AIF_0001_08 a crm:E93_Presence ;
  rdfs:label "Coastguard duty at Greenock (1881-1883)"@en ;
  crm:P195i_had_presence myData:AIF_0001 ;
  :has_operational_status :InNonCombatDuty ;
  :has_ship_role myData:role_coastguard_ship ;
  crm:P167_was_within myData:place_greenock ;
  crm:P164_is_temporally_specified_by [ a crm:E52_Time-Span ;
    crm:P182i_starts_after_or_with_the_end_of myData:event_AIF_0001_09 ;
    crm:P182_ends_before_or_with_the_start_of myData:event_AIF_0001_10 ] .

myData:event_AIF_0001_11 a :Decommissioning ;
  rdfs:label "Paid off (Assumed 1884)"@en ;
  rdfs:comment "Text states 'paid off 1864' which is a clear typo; assuming 1884 based on chronology."@en ;
  crm:P4_has_time-span [ a crm:E52_Time-Span ; crm:P82_at_some_time_within "1884"^^xsd:gYear ] .

myData:presence_AIF_0001_09 a crm:E93_Presence ;
  rdfs:label "Tender to Asia at Portsmouth (1883-1884)"@en ;
  crm:P195i_had_presence myData:AIF_0001 ;
  :has_operational_status :InNonCombatDuty ;
  :has_ship_role myData:role_tender_ship ;
  crm:P167_was_within myData:place_portsmouth ;
  crm:P164_is_temporally_specified_by [ a crm:E52_Time-Span ;
    crm:P182i_starts_after_or_with_the_end_of myData:event_AIF_0001_10 ;
    crm:P182_ends_before_or_with_the_start_of myData:event_AIF_0001_11 ] .

### Harbour Service and Hulking
myData:event_AIF_0001_12 a :ShipConversion ;
  rdfs:label "Converted to destroyer depot ship"@en ;
  crm:P4_has_time-span [ a crm:E52_Time-Span ; crm:P82_at_some_time_within "1902-07"^^xsd:gYearMonth ] .

myData:presence_AIF_0001_10 a crm:E93_Presence ;
  rdfs:label "In Ordinary at Portsmouth (1884-1902)"@en ;
  crm:P195i_had_presence myData:AIF_0001 ;
  :has_operational_status :InOrdinary ;
  crm:P167_was_within myData:place_portsmouth ;
  crm:P164_is_temporally_specified_by [ a crm:E52_Time-Span ;
    crm:P182i_starts_after_or_with_the_end_of myData:event_AIF_0001_11 ;
    crm:P182_ends_before_or_with_the_start_of myData:event_AIF_0001_12 ] .

myData:event_AIF_0001_13 a crm:E13_Attribute_Assignment ;
  rdfs:label "Renamed Vernon Ill"@en ;
  crm:P140_assigned_attribute_to myData:AIF_0001 ;
  crm:P141_assigned "Vernon Ill" ;
  crm:P4_has_time-span [ a crm:E52_Time-Span ; crm:P82_at_some_time_within "1904-03"^^xsd:gYearMonth ] .

myData:event_AIF_0001_14 a :ShipConversion ;
  rdfs:label "Hulked as oil jetty at Pembroke"@en ;
  crm:P7_took_place_at myData:place_pembroke ;
  crm:P4_has_time-span [ a crm:E52_Time-Span ; crm:P82_at_some_time_within "1923"^^xsd:gYear ] .

myData:presence_AIF_0001_11 a crm:E93_Presence ;
  rdfs:label "Harbour service as destroyer depot ship (1902-1923)"@en ;
  crm:P195i_had_presence myData:AIF_0001 ;
  :has_operational_status :InNonCombatDuty ;
  :has_ship_role myData:role_depot_ship ;
  crm:P167_was_within myData:place_portsmouth ;
  crm:P164_is_temporally_specified_by [ a crm:E52_Time-Span ;
    crm:P182i_starts_after_or_with_the_end_of myData:event_AIF_0001_12 ;
    crm:P182_ends_before_or_with_the_start_of myData:event_AIF_0001_14 ] .

myData:event_AIF_0001_15 a crm:E13_Attribute_Assignment ;
  rdfs:label "Reverted to Warrior"@en ;
  crm:P140_assigned_attribute_to myData:AIF_0001 ;
  crm:P141_assigned "Warrior" ;
  crm:P4_has_time-span [ a crm:E52_Time-Span ; crm:P82_at_some_time_within "1923"^^xsd:gYear ] .

myData:event_AIF_0001_16 a crm:E13_Attribute_Assignment ;
  rdfs:label "Renamed C.77"@en ;
  crm:P140_assigned_attribute_to myData:AIF_0001 ;
  crm:P141_assigned "C.77" ;
  crm:P4_has_time-span [ a crm:E52_Time-Span ; crm:P82_at_some_time_within "1942-08-27"^^xsd:date ] .

myData:event_AIF_0001_17 a :ShipConversion ;
  rdfs:label "Towed to West Hartlepool for conversion to a museum ship"@en ;
  crm:P7_took_place_at myData:place_west_hartlepool ;
  crm:P4_has_time-span [ a crm:E52_Time-Span ; crm:P82_at_some_time_within "1979"^^xsd:gYear ] .

myData:presence_AIF_0001_12 a crm:E93_Presence ;
  rdfs:label "Hulked as oil jetty at Pembroke (1923-1979)"@en ;
  crm:P195i_had_presence myData:AIF_0001 ;
  :has_operational_status :InNonCombatDuty ;
  :has_ship_role myData:role_oil_jetty ;
  crm:P167_was_within myData:place_pembroke ;
  crm:P164_is_temporally_specified_by [ a crm:E52_Time-Span ;
    crm:P182i_starts_after_or_with_the_end_of myData:event_AIF_0001_14 ;
    crm:P182_ends_before_or_with_the_start_of myData:event_AIF_0001_17 ] .

### Final State as Museum Ship
myData:presence_AIF_0001_13 a crm:E93_Presence ;
  rdfs:label "Preserved as museum ship at Portsmouth (1979-)"@en ;
  crm:P195i_had_presence myData:AIF_0001 ;
  :has_operational_status :InNonCombatDuty ;
  :has_ship_role myData:role_museum_ship ;
  crm:P167_was_within myData:place_portsmouth ;
  crm:P164_is_temporally_specified_by [ a crm:E52_Time-Span ;
    crm:P79_beginning_is_qualified_by "1979"^^xsd:gYear ] .

# --- Data from file: AIF_0003.ttl ---


### Places
myData:place_jarrow a crm:E53_Place ; rdfs:label "Jarrow"@en .
myData:place_devonport a crm:E53_Place ; rdfs:label "Devonport"@en .
myData:place_river_shannon a crm:E53_Place ; rdfs:label "River Shannon"@en .
myData:place_mersey a crm:E53_Place ; rdfs:label "Mersey"@en .
myData:place_plymouth a crm:E53_Place ; rdfs:label "Plymouth"@en .

### Ship
myData:AIF_0003 a sealit:Ship ;
  rdfs:label "HMS Defence"@en ;
  :has_propulsion_type :ScrewPropeller ;
  :has_ship_type :ArmouredIronFrigate ;
  dcterms:source "Winfield, Rif. British Warships in the Age of Sail, 1817-1863. Seaforth Publishing, 2014."@en .

### Career Events and Presences
# Construction
myData:event_AIF_0003_01 a crm:E12_Production ;
  rdfs:label "Built by Palmer Bros, Jarrow"@en ;
  crm:P7_took_place_at myData:place_jarrow ;
  crm:P4_has_time-span [
    a crm:E52_Time-Span ;
    crm:P79_beginning_is_qualified_by "1859-12-14"^^xsd:date ; # Ord/K
    crm:P80_end_is_qualified_by "1861-04-24"^^xsd:date   # L
  ] ;
  :incurred_cost [
    a crm:E97_Monetary_Amount ;
    rdfs:comment "First cost: £252,422"@en ;
    crm:P90_has_value "252422.0"^^xsd:decimal
  ] ;
  crm:P21_had_general_purpose :CombatCapabilityInvestment .

# First Commissioning and Service
myData:event_AIF_0003_02 a :Commissioning ;
  rdfs:label "Commissioned 5.12.1861 for the Channel squadron, completed 12.2.1862"@en ;
  crm:P4_has_time-span [
    a crm:E52_Time-Span ;
    crm:P79_beginning_is_qualified_by "1861-12-05"^^xsd:date ;
    crm:P80_end_is_qualified_by "1862-02-12"^^xsd:date
  ] .

myData:presence_AIF_0003_01 a crm:E93_Presence ;
  rdfs:label "Under fitting between launch and first commissioning"@en ;
  crm:P195i_had_presence myData:AIF_0003 ;
  :has_operational_status :UnderFitting ;
  :has_ship_type :ArmouredIronFrigate ;
  :has_propulsion_type :ScrewPropeller ;
  crm:P164_is_temporally_specified_by [ a crm:E52_Time-Span ;
    crm:P182i_starts_after_or_with_the_end_of myData:event_AIF_0003_01 ;
    crm:P182_ends_before_or_with_the_start_of myData:event_AIF_0003_02 ] .

# (The text implies continuous commission through captain changes until paid off in 1872)
myData:event_AIF_0003_03 a :Decommissioning ;
  rdfs:label "Paid off into Reserve at Devonport 2.8.1872"@en ;
  crm:P7_took_place_at myData:place_devonport ;
  crm:P4_has_time-span [ a crm:E52_Time-Span ; crm:P82_at_some_time_within "1872-08-02"^^xsd:date ] .

myData:presence_AIF_0003_02 a crm:E93_Presence ;
  rdfs:label "In Commission (Channel squadron, West Indies, Mediterranean) from 5.12.1861 to 2.8.1872"@en ;
  crm:P195i_had_presence myData:AIF_0003 ;
  :has_operational_status :InCommission ;
  :has_ship_type :ArmouredIronFrigate ;
  :has_propulsion_type :ScrewPropeller ;
  crm:P164_is_temporally_specified_by [ a crm:E52_Time-Span ;
    crm:P182i_starts_after_or_with_the_end_of myData:event_AIF_0003_02 ;
    crm:P182_ends_before_or_with_the_start_of myData:event_AIF_0003_03 ] .

# First non-combat duty
myData:event_AIF_0003_04 a :ShipConversion ;
  rdfs:label "Became Coastguard depot ship in River Shannon 2.1874"@en ;
  crm:P7_took_place_at myData:place_river_shannon ;
  crm:P4_has_time-span [ a crm:E52_Time-Span ; crm:P82_at_some_time_within "1874-02"^^xsd:gYearMonth ] .

myData:presence_AIF_0003_03 a crm:E93_Presence ;
  rdfs:label "In Reserve at Devonport"@en ;
  crm:P195i_had_presence myData:AIF_0003 ;
  :has_operational_status :InOrdinary ;
  :has_ship_type :ArmouredIronFrigate ;
  :has_propulsion_type :ScrewPropeller ;
  crm:P7_took_place_at myData:place_devonport ;
  crm:P164_is_temporally_specified_by [ a crm:E52_Time-Span ;
    crm:P182i_starts_after_or_with_the_end_of myData:event_AIF_0003_03 ;
    crm:P182_ends_before_or_with_the_start_of myData:event_AIF_0003_04 ] .

# Second Commissioning and Service
myData:event_AIF_0003_05 a :Recommissioning ;
  rdfs:label "Recommissioned 25.2.1876 for the Channel squadron"@en ;
  crm:P4_has_time-span [ a crm:E52_Time-Span ; crm:P82_at_some_time_within "1876-02-25"^^xsd:date ] .

myData:presence_AIF_0003_04 a crm:E93_Presence ;
  rdfs:label "Coastguard depot ship in River Shannon"@en ;
  crm:P195i_had_presence myData:AIF_0003 ;
  :has_operational_status :InNonCombatDuty ;
  :has_ship_role :CoastguardDepotShip ;
  :has_propulsion_type :ScrewPropeller ;
  crm:P7_took_place_at myData:place_river_shannon ;
  crm:P164_is_temporally_specified_by [ a crm:E52_Time-Span ;
    crm:P182i_starts_after_or_with_the_end_of myData:event_AIF_0003_04 ;
    crm:P182_ends_before_or_with_the_start_of myData:event_AIF_0003_05 ] .

myData:event_AIF_0003_06 a :Decommissioning ;
  rdfs:label "Paid off 5.12.1879"@en ;
  crm:P4_has_time-span [ a crm:E52_Time-Span ; crm:P82_at_some_time_within "1879-12-05"^^xsd:date ] .

myData:presence_AIF_0003_05 a crm:E93_Presence ;
  rdfs:label "In Commission (Channel squadron, Mediterranean) from 25.2.1876 to 5.12.1879"@en ;
  crm:P195i_had_presence myData:AIF_0003 ;
  :has_operational_status :InCommission ;
  :has_ship_type :ArmouredIronFrigate ;
  :has_propulsion_type :ScrewPropeller ;
  crm:P164_is_temporally_specified_by [ a crm:E52_Time-Span ;
    crm:P182i_starts_after_or_with_the_end_of myData:event_AIF_0003_05 ;
    crm:P182_ends_before_or_with_the_start_of myData:event_AIF_0003_06 ] .

# Subsequent non-combat duties
myData:event_AIF_0003_07 a :ShipConversion ;
  rdfs:label "Became Coastguard depot ship on the Mersey 6.1880"@en ;
  crm:P7_took_place_at myData:place_mersey ;
  crm:P4_has_time-span [ a crm:E52_Time-Span ; crm:P82_at_some_time_within "1880-06"^^xsd:gYearMonth ] .

myData:presence_AIF_0003_06 a crm:E93_Presence ;
  rdfs:label "Paid off period before becoming depot ship on Mersey"@en ;
  crm:P195i_had_presence myData:AIF_0003 ;
  :has_operational_status :PaidOff ;
  :has_ship_type :ArmouredIronFrigate ;
  :has_propulsion_type :ScrewPropeller ;
  crm:P164_is_temporally_specified_by [ a crm:E52_Time-Span ;
    crm:P182i_starts_after_or_with_the_end_of myData:event_AIF_0003_06 ;
    crm:P182_ends_before_or_with_the_start_of myData:event_AIF_0003_07 ] .

myData:event_AIF_0003_08 a :Decommissioning ;
  rdfs:label "Paid off into Reserve at Devonport 8.1885"@en ;
  crm:P7_took_place_at myData:place_devonport ;
  crm:P4_has_time-span [ a crm:E52_Time-Span ; crm:P82_at_some_time_within "1885-08"^^xsd:gYearMonth ] .

myData:presence_AIF_0003_07 a crm:E93_Presence ;
  rdfs:label "Coastguard depot ship on the Mersey"@en ;
  crm:P195i_had_presence myData:AIF_0003 ;
  :has_operational_status :InNonCombatDuty ;
  :has_ship_role :CoastguardDepotShip ;
  :has_propulsion_type :ScrewPropeller ;
  crm:P7_took_place_at myData:place_mersey ;
  crm:P164_is_temporally_specified_by [ a crm:E52_Time-Span ;
    crm:P182i_starts_after_or_with_the_end_of myData:event_AIF_0003_07 ;
    crm:P182_ends_before_or_with_the_start_of myData:event_AIF_0003_08 ] .

myData:event_AIF_0003_09 a :ShipConversion ;
  rdfs:label "Became floating workshop 1890"@en ;
  crm:P4_has_time-span [ a crm:E52_Time-Span ; crm:P82_at_some_time_within "1890"^^xsd:gYear ] .

myData:presence_AIF_0003_08 a crm:E93_Presence ;
  rdfs:label "In Reserve at Devonport"@en ;
  crm:P195i_had_presence myData:AIF_0003 ;
  :has_operational_status :InOrdinary ;
  :has_ship_type :ArmouredIronFrigate ;
  :has_propulsion_type :ScrewPropeller ;
  crm:P7_took_place_at myData:place_devonport ;
  crm:P164_is_temporally_specified_by [ a crm:E52_Time-Span ;
    crm:P182i_starts_after_or_with_the_end_of myData:event_AIF_0003_08 ;
    crm:P182_ends_before_or_with_the_start_of myData:event_AIF_0003_09 ] .

myData:event_AIF_0003_10 a :ShipConversion ;
  rdfs:label "Became training ship 6.1898"@en ;
  crm:P4_has_time-span [ a crm:E52_Time-Span ; crm:P82_at_some_time_within "1898-06"^^xsd:gYearMonth ] .

myData:event_AIF_0003_11 a crm:E13_Attribute_Assignment ;
  rdfs:label "Renamed Indus I in 6.1898"@en ;
  crm:P140_assigned_attribute_to myData:AIF_0003 ;
  crm:P141_assigned [ rdfs:label "Indus I"@en ] ;
  crm:P4_has_time-span [ a crm:E52_Time-Span ; crm:P82_at_some_time_within "1898-06"^^xsd:gYearMonth ] .

myData:presence_AIF_0003_09 a crm:E93_Presence ;
  rdfs:label "Floating workshop"@en ;
  crm:P195i_had_presence myData:AIF_0003 ;
  :has_operational_status :InNonCombatDuty ;
  :has_ship_role :FloatingWorkshop ;
  :has_propulsion_type :ScrewPropeller ;
  crm:P164_is_temporally_specified_by [ a crm:E52_Time-Span ;
    crm:P182i_starts_after_or_with_the_end_of myData:event_AIF_0003_09 ;
    crm:P182_ends_before_or_with_the_start_of myData:event_AIF_0003_10 ] .

myData:event_AIF_0003_12 a :ShipConversion ;
  rdfs:label "Hulked 1922"@en ;
  crm:P4_has_time-span [ a crm:E52_Time-Span ; crm:P82_at_some_time_within "1922"^^xsd:gYear ] .

myData:presence_AIF_0003_10 a crm:E93_Presence ;
  rdfs:label "Training ship, renamed Indus I"@en ;
  crm:P195i_had_presence myData:AIF_0003 ;
  :has_operational_status :InNonCombatDuty ;
  :has_ship_role :TrainingShip ;
  :has_propulsion_type :ScrewPropeller ;
  crm:P164_is_temporally_specified_by [ a crm:E52_Time-Span ;
    crm:P182i_starts_after_or_with_the_end_of myData:event_AIF_0003_10 ;
    crm:P182_ends_before_or_with_the_start_of myData:event_AIF_0003_12 ] .

# Final Destruction
myData:event_AIF_0003_13 a crm:E6_Destruction ;
  rdfs:label "Broken up (BU) at Plymouth 8.1935"@en ;
  crm:P13_destroyed myData:AIF_0003 ;
  crm:P7_took_place_at myData:place_plymouth ;
  crm:P4_has_time-span [ a crm:E52_Time-Span ; crm:P82_at_some_time_within "1935-08"^^xsd:gYearMonth ] .

myData:presence_AIF_0003_11 a crm:E93_Presence ;
  rdfs:label "Hulked until broken up"@en ;
  crm:P195i_had_presence myData:AIF_0003 ;
  :has_operational_status :InNonCombatDuty ;
  :has_ship_role :Hulk ;
  :has_propulsion_type :ScrewPropeller ;
  crm:P164_is_temporally_specified_by [ a crm:E52_Time-Span ;
    crm:P182i_starts_after_or_with_the_end_of myData:event_AIF_0003_12 ;
    crm:P182_ends_before_or_with_the_start_of myData:event_AIF_0003_13 ] .

# --- Data from file: AWC_0001.ttl ---


### Places
myData:place_chatham a crm:E53_Place ; rdfs:label "Chatham"@en .
myData:place_portsmouth a crm:E53_Place ; rdfs:label "Portsmouth"@en .
myData:place_port_said a crm:E53_Place ; rdfs:label "Port Said"@en .
myData:place_mediterranean a crm:E53_Place ; rdfs:label "Mediterranean"@en .

### Ship
myData:AWC_0001 a sealit:Ship ;
  rdfs:label "HMS Royal Oak"@en ;
  :has_propulsion_type :ScrewPropeller ;
  :has_ship_type :ArmouredWoodenCruiser ;
  dcterms:source "Winfield, Rif. British Warships in the Age of Sail, 1817-1863. Seaforth Publishing, 2014."@en .

### Construction and initial fitting
myData:event_AWC_0001_01 a crm:E12_Production ;
  rdfs:label "Construction of Royal Oak"@en ;
  crm:P7_took_place_at myData:place_chatham ;
  crm:P4_has_time-span [
    a crm:E52_Time-Span ;
    crm:P79_beginning_is_qualified_by "1859-04-08"^^xsd:date ; # Ord
    crm:P80_end_is_qualified_by "1862-09-10"^^xsd:date   # L
  ] ;
  :incurred_cost [
    a crm:E97_Monetary_Amount ;
    rdfs:comment "First cost: £254,537"@en ;
    crm:P90_has_value "254537.0"^^xsd:decimal
  ] ;
  crm:P21_had_general_purpose :CombatCapabilityInvestment .

myData:event_AWC_0001_02 a :Fitting ;
    rdfs:label "Completed fitting 28.5.1863"@en ;
    :modifies_ship myData:AWC_0001 ;
    crm:P7_took_place_at myData:place_chatham ;
    crm:P4_has_time-span [
        a crm:E52_Time-Span ;
        crm:P82_at_some_time_within "1863-05-28"^^xsd:date
    ] .

myData:presence_AWC_0001_01 a crm:E93_Presence ;
    rdfs:label "Under fitting after launch until first commission"@en ;
    crm:P195i_had_presence myData:AWC_0001 ;
    :has_operational_status :UnderFitting ;
    crm:P7_took_place_at myData:place_chatham ;
    crm:P164_is_temporally_specified_by [ a crm:E52_Time-Span ;
        crm:P182i_starts_after_or_with_the_end_of myData:event_AWC_0001_01 ;
        crm:P182_ends_before_or_with_the_start_of myData:event_AWC_0001_03 ] .

### First service period
myData:event_AWC_0001_03 a :Commissioning ;
  rdfs:label "Commissioned 27.4.1863 under Capt. Frederick Archibald Campbell"@en ;
  crm:P4_has_time-span [
    a crm:E52_Time-Span ;
    crm:P82_at_some_time_within "1863-04-27"^^xsd:date
  ] .

myData:presence_AWC_0001_02 a crm:E93_Presence ;
  rdfs:label "In Commission (27.4.1863-13.12.1867) for the Channel squadron, later to the Mediterranean."@en ;
  crm:P195i_had_presence myData:AWC_0001 ;
  :has_operational_status :InCommission ;
  crm:P7_took_place_at myData:place_mediterranean ;
  crm:P164_is_temporally_specified_by [ a crm:E52_Time-Span ;
    crm:P182i_starts_after_or_with_the_end_of myData:event_AWC_0001_03 ;
    crm:P182_ends_before_or_with_the_start_of myData:event_AWC_0001_04 ] .

myData:event_AWC_0001_04 a :Decommissioning ;
  rdfs:label "Paid off 13.12.1867 at Portsmouth"@en ;
  crm:P7_took_place_at myData:place_portsmouth ;
  crm:P4_has_time-span [
    a crm:E52_Time-Span ;
    crm:P82_at_some_time_within "1867-12-13"^^xsd:date
  ] .

### Second service period
myData:presence_AWC_0001_03 a crm:E93_Presence ;
  rdfs:label "Paid off for one day"@en ;
  crm:P195i_had_presence myData:AWC_0001 ;
  :has_operational_status :PaidOff ;
  crm:P7_took_place_at myData:place_portsmouth ;
  crm:P164_is_temporally_specified_by [ a crm:E52_Time-Span ;
    crm:P182i_starts_after_or_with_the_end_of myData:event_AWC_0001_04 ;
    crm:P182_ends_before_or_with_the_start_of myData:event_AWC_0001_05 ] .

myData:event_AWC_0001_05 a :Recommissioning ;
  rdfs:label "Recommissioned 14.12.1867 under Capt. Henry Shank Hillyar"@en ;
  crm:P4_has_time-span [
    a crm:E52_Time-Span ;
    crm:P82_at_some_time_within "1867-12-14"^^xsd:date
  ] .

myData:presence_AWC_0001_04 a crm:E93_Presence ;
  rdfs:label "In Commission (14.12.1867-9.1.1872) for the Channel squadron and Mediterranean; present at opening of Suez Canal (11.1869)."@en ;
  crm:P195i_had_presence myData:AWC_0001 ;
  :has_operational_status :InCommission ;
  crm:P7_took_place_at myData:place_mediterranean, myData:place_port_said ;
  crm:P164_is_temporally_specified_by [ a crm:E52_Time-Span ;
    crm:P182i_starts_after_or_with_the_end_of myData:event_AWC_0001_05 ;
    crm:P182_ends_before_or_with_the_start_of myData:event_AWC_0001_06 ] .

myData:event_AWC_0001_06 a :Decommissioning ;
  rdfs:label "Paid off 9.1.1872 at Portsmouth"@en ;
  crm:P7_took_place_at myData:place_portsmouth ;
  crm:P4_has_time-span [
    a crm:E52_Time-Span ;
    crm:P82_at_some_time_within "1872-01-09"^^xsd:date
  ] .

### Final period and destruction
myData:presence_AWC_0001_05 a crm:E93_Presence ;
  rdfs:label "In ordinary at Portsmouth (9.1.1872-30.9.1885)"@en ;
  crm:P195i_had_presence myData:AWC_0001 ;
  :has_operational_status :InOrdinary ;
  crm:P7_took_place_at myData:place_portsmouth ;
  crm:P164_is_temporally_specified_by [ a crm:E52_Time-Span ;
    crm:P182i_starts_after_or_with_the_end_of myData:event_AWC_0001_06 ;
    crm:P182_ends_before_or_with_the_start_of myData:event_AWC_0001_07 ] .

myData:event_AWC_0001_07 a crm:E6_Destruction ;
  rdfs:label "Sold 30.9.1885 to Castle to be broken up (BU)"@en ;
  crm:P13_destroyed myData:AWC_0001 ;
  crm:P4_has_time-span [
    a crm:E52_Time-Span ;
    crm:P82_at_some_time_within "1885-09-30"^^xsd:date
  ] .

# --- Data from file: AWC_0007.ttl ---


### Places
myData:place_deptford a crm:E53_Place ; rdfs:label "Deptford"@en .
myData:place_channel a crm:E53_Place ; rdfs:label "Channel"@en .
myData:place_mediterranean a crm:E53_Place ; rdfs:label "Mediterranean"@en .
myData:place_sheerness a crm:E53_Place ; rdfs:label "Sheerness"@en .

### Ship
myData:AWC_0007 a sealit:Ship ;
  rdfs:label "HMS Enterprise"@en ;
  rdfs:comment "ex-Circassian, renamed 22.7.1862"@en ;
  :has_propulsion_type :ScrewPropeller ;
  :has_ship_type :ArmouredWoodenCruiser ;
  dcterms:source "Winfield, Rif. British Warships in the Age of Sail, 1817-1863. Seaforth Publishing, 2014."@en .

### Career Events and Presences

# Construction and Renaming
myData:event_AWC_0007_01 a crm:E12_Production ;
  rdfs:label "Built at Deptford Dyd/Ravenhill, Salkeld & Co. Keel laid 5.5.1862, Launched 9.2.1864."@en ;
  crm:P7_took_place_at myData:place_deptford ;
  crm:P4_has_time-span [
    a crm:E52_Time-Span ;
    crm:P79_beginning_is_qualified_by "1861-03-21"^^xsd:date ; # Ord
    crm:P80_end_is_qualified_by "1864-02-09"^^xsd:date   # L
  ] ;
  :incurred_cost [
    a crm:E97_Monetary_Amount ;
    rdfs:comment "First cost: £62,474"@en ;
    crm:P90_has_value "62474.0"^^xsd:decimal
  ] ;
  crm:P21_had_general_purpose :CombatCapabilityInvestment .

myData:event_AWC_0007_02 a crm:E13_Attribute_Assignment ;
  rdfs:label "Renamed Enterprise from Circassian"@en ;
  crm:P140_assigned_attribute_to myData:AWC_0007 ;
  crm:P141_assigned [ a crm:E55_Type; rdfs:label "Enterprise"@en ] ;
  crm:P4_has_time-span [
    a crm:E52_Time-Span ;
    crm:P82_at_some_time_within "1862-07-22"^^xsd:date
  ] .

# Fitting and Commissioning
myData:presence_AWC_0007_01 a crm:E93_Presence ;
  rdfs:label "Fitting out at Deptford after launch"@en ;
  crm:P195i_had_presence myData:AWC_0007 ;
  :has_operational_status :UnderFitting ;
  crm:P167_was_within myData:place_deptford ;
  crm:P164_is_temporally_specified_by [
    a crm:E52_Time-Span ;
    crm:P182i_starts_after_or_with_the_end_of myData:event_AWC_0007_01 ;
    crm:P182_ends_before_or_with_the_start_of myData:event_AWC_0007_03
  ] .

myData:event_AWC_0007_03 a :Commissioning ;
  rdfs:label "Commissioned 26.3.1864 under Cmdr Charles John Rowley"@en ;
  :modifies_ship myData:AWC_0007 ;
  crm:P4_has_time-span [
    a crm:E52_Time-Span ;
    crm:P82_at_some_time_within "1864-03-26"^^xsd:date
  ] .

# Active Service (within this period, the ship was formally completed)
myData:event_AWC_0007_04 a :Fitting ;
  rdfs:label "Completed at Deptford"@en ;
  :modifies_ship myData:AWC_0007 ;
  crm:P7_took_place_at myData:place_deptford ;
  crm:P4_has_time-span [
    a crm:E52_Time-Span ;
    crm:P82_at_some_time_within "1864-06-03"^^xsd:date
  ] .

myData:event_AWC_0007_05 a :Commissioning ;
  rdfs:label "Commissioned 7.7.1866 under Cmdr George Stanley Bosanquet"@en ;
  :modifies_ship myData:AWC_0007 ;
  crm:P4_has_time-span [
    a crm:E52_Time-Span ;
    crm:P82_at_some_time_within "1866-07-07"^^xsd:date
  ] .

myData:event_AWC_0007_06 a :Commissioning ;
  rdfs:label "Commissioned 11.4.1870 under Cmdr George Digby Morant"@en ;
  :modifies_ship myData:AWC_0007 ;
  crm:P4_has_time-span [
    a crm:E52_Time-Span ;
    crm:P82_at_some_time_within "1870-04-11"^^xsd:date
  ] .

myData:presence_AWC_0007_02 a crm:E93_Presence ;
  rdfs:label "In commission for the Channel squadron, later to the Mediterranean"@en ;
  crm:P195i_had_presence myData:AWC_0007 ;
  :has_operational_status :InCommission ;
  crm:P167_was_within myData:place_channel, myData:place_mediterranean ;
  crm:P164_is_temporally_specified_by [
    a crm:E52_Time-Span ;
    crm:P182i_starts_after_or_with_the_end_of myData:event_AWC_0007_03 ;
    crm:P182_ends_before_or_with_the_start_of myData:event_AWC_0007_07
  ] .

# Decommissioning and Laid Up
myData:event_AWC_0007_07 a :Decommissioning ;
  rdfs:label "Paid off 30.8.1871 at Sheerness and laid up"@en ;
  :modifies_ship myData:AWC_0007 ;
  crm:P7_took_place_at myData:place_sheerness ;
  crm:P4_has_time-span [
    a crm:E52_Time-Span ;
    crm:P82_at_some_time_within "1871-08-30"^^xsd:date
  ] .

myData:presence_AWC_0007_03 a crm:E93_Presence ;
  rdfs:label "Laid up at Sheerness"@en ;
  crm:P195i_had_presence myData:AWC_0007 ;
  :has_operational_status :InOrdinary ;
  crm:P167_was_within myData:place_sheerness ;
  crm:P164_is_temporally_specified_by [
    a crm:E52_Time-Span ;
    crm:P182i_starts_after_or_with_the_end_of myData:event_AWC_0007_07 ;
    crm:P182_ends_before_or_with_the_start_of myData:event_AWC_0007_08
  ] .

# End of Career
myData:event_AWC_0007_08 a crm:E8_Acquisition ;
  rdfs:label "Sold 11.1.1886 to be broken up (BU)"@en ;
  crm:P23_transferred_title_of myData:AWC_0007 ;
  crm:P4_has_time-span [
    a crm:E52_Time-Span ;
    crm:P82_at_some_time_within "1886-01-11"^^xsd:date
  ] .

# --- Data from file: PF_0002.ttl ---


### Places
myData:place_portsmouth a crm:E53_Place ; rdfs:label "Portsmouth"@en .
myData:place_woolwich a crm:E53_Place ; rdfs:label "Woolwich"@en .
myData:place_east_coast_of_south_america a crm:E53_Place ; rdfs:label "East coast of South America"@en .
myData:place_mediterranean a crm:E53_Place ; rdfs:label "Mediterranean"@en .
myData:place_black_sea a crm:E53_Place ; rdfs:label "Black Sea"@en .
myData:place_sheerness a crm:E53_Place ; rdfs:label "Sheerness"@en .
myData:place_north_america a crm:E53_Place ; rdfs:label "North America"@en .
myData:place_west_indies a crm:E53_Place ; rdfs:label "West Indies"@en .
myData:place_gibraltar a crm:E53_Place ; rdfs:label "Gibraltar"@en .
myData:place_charlton a crm:E53_Place ; rdfs:label "Charlton"@en .

### Ship
myData:PF_0002 a sealit:Ship ;
  rdfs:label "HMS Firebrand"@en ;
  :has_propulsion_type :PaddleWheel ;
  :has_ship_type :PaddleFrigate ;
  dcterms:source "Winfield, Rif. British Warships in the Age of Sail, 1817-1863. Seaforth Publishing, 2014."@en .

### Construction and Commissioning
myData:event_PF_0002_01 a crm:E12_Production ;
  rdfs:label "As built: 190ft 0.5in, 163ft 5.125in x 37ft 6in oa (37ft 0in for tonnage) x 23ft 0in. 1,190bm."@en ;
  crm:P4_has_time-span [
    a crm:E52_Time-Span ;
    crm:P79_beginning_is_qualified_by "1841-03-18"^^xsd:date ;
    crm:P80_end_is_qualified_by "1842-09-05"^^xsd:date
  ] ;
  :incurred_cost [
    a crm:E97_Monetary_Amount ;
    rdfs:comment "First cost: Hull £23,310, machinery £18,747, fitting £13,034"@en ;
    crm:P90_has_value "55091.0"^^xsd:decimal
  ] .

myData:presence_PF_0002_01 a crm:E93_Presence ;
  rdfs:label "Under fitting at Portsmouth after launch"@en ;
  crm:P195i_had_presence myData:PF_0002 ;
  :has_operational_status :UnderFitting ;
  :has_propulsion_type :PaddleWheel ;
  :has_ship_type :PaddleFrigate ;
  crm:P167_was_within myData:place_portsmouth ;
  crm:P164_is_temporally_specified_by [ a crm:E52_Time-Span ;
    crm:P182i_starts_after_or_with_the_end_of myData:event_PF_0002_01 ;
    crm:P182_ends_before_or_with_the_start_of myData:event_PF_0002_02 ] .

myData:event_PF_0002_02 a :Commissioning ;
  rdfs:label "Commissioned 7.9.1844, Completed for sea 22.10.1844"@en ;
  crm:P4_has_time-span [
    a crm:E52_Time-Span ;
    crm:P79_beginning_is_qualified_by "1844-09-07"^^xsd:date ;
    crm:P80_end_is_qualified_by "1844-10-22"^^xsd:date
  ] .

myData:presence_PF_0002_02 a crm:E93_Presence ;
  rdfs:label "In commission in experimental squadron and on east coast of South America"@en ;
  crm:P195i_had_presence myData:PF_0002 ;
  :has_operational_status :InCommission ;
  :has_propulsion_type :PaddleWheel ;
  :has_ship_type :PaddleFrigate ;
  crm:P167_was_within myData:place_east_coast_of_south_america ;
  crm:P164_is_temporally_specified_by [ a crm:E52_Time-Span ;
    crm:P182i_starts_after_or_with_the_end_of myData:event_PF_0002_02 ;
    crm:P182_ends_before_or_with_the_start_of myData:event_PF_0002_03 ] .

### Decommissioning and Repair
myData:event_PF_0002_03 a :Decommissioning ;
  rdfs:label "Paid off 17.6.1848 at Woolwich"@en ;
  crm:P7_took_place_at myData:place_woolwich ;
  crm:P4_has_time-span [ a crm:E52_Time-Span ; crm:P82_at_some_time_within "1848-06-17"^^xsd:date ] .

myData:presence_PF_0002_03 a crm:E93_Presence ;
  rdfs:label "Paid off at Woolwich"@en ;
  crm:P195i_had_presence myData:PF_0002 ;
  :has_operational_status :PaidOff ;
  :has_propulsion_type :PaddleWheel ;
  :has_ship_type :PaddleFrigate ;
  crm:P167_was_within myData:place_woolwich ;
  crm:P164_is_temporally_specified_by [ a crm:E52_Time-Span ;
    crm:P182i_starts_after_or_with_the_end_of myData:event_PF_0002_03 ;
    crm:P182_ends_before_or_with_the_start_of myData:event_PF_0002_04 ] .

myData:event_PF_0002_04 a :SmallRepair ;
  rdfs:label "Small repair at Woolwich (10.1848-10.1849)"@en ;
  sealit:repaired myData:PF_0002 ;
  crm:P7_took_place_at myData:place_woolwich ;
  crm:P4_has_time-span [
    a crm:E52_Time-Span ;
    crm:P79_beginning_is_qualified_by "1848-10"^^xsd:gYearMonth ;
    crm:P80_end_is_qualified_by "1849-10"^^xsd:gYearMonth
  ] ;
  :incurred_cost [
    a crm:E97_Monetary_Amount ;
    rdfs:comment "£22,186"@en ;
    crm:P90_has_value "22186.0"^^xsd:decimal
  ] ;
  crm:P21_had_general_purpose :CombatCapabilityInvestment .

myData:presence_PF_0002_04 a crm:E93_Presence ;
  rdfs:label "Under small repair at Woolwich"@en ;
  crm:P195i_had_presence myData:PF_0002 ;
  :has_operational_status :UnderRepair ;
  :has_propulsion_type :PaddleWheel ;
  :has_ship_type :PaddleFrigate ;
  crm:P167_was_within myData:place_woolwich ;
  crm:P164_is_temporally_specified_by [ a crm:E52_Time-Span ;
    crm:P79_beginning_is_qualified_by "1848-10"^^xsd:gYearMonth ;
    crm:P80_end_is_qualified_by "1849-10"^^xsd:gYearMonth
  ] .

### Service in Mediterranean and Black Sea
myData:event_PF_0002_05 a :Recommissioning ;
  rdfs:label "Recommissioned 6.10.1849 for the Mediterranean"@en ;
  crm:P4_has_time-span [ a crm:E52_Time-Span ; crm:P82_at_some_time_within "1849-10-06"^^xsd:date ] .

myData:presence_PF_0002_05 a crm:E93_Presence ;
  rdfs:label "[Assumption] In ordinary between repair and recommissioning"@en ;
  crm:P195i_had_presence myData:PF_0002 ;
  :has_operational_status :InOrdinary ;
  :has_propulsion_type :PaddleWheel ;
  :has_ship_type :PaddleFrigate ;
  crm:P167_was_within myData:place_woolwich ;
  crm:P164_is_temporally_specified_by [ a crm:E52_Time-Span ;
    crm:P182i_starts_after_or_with_the_end_of myData:event_PF_0002_04 ;
    crm:P182_ends_before_or_with_the_start_of myData:event_PF_0002_05 ] .

myData:presence_PF_0002_06 a crm:E93_Presence ;
  rdfs:label "In commission in the Mediterranean and Black Sea"@en ;
  crm:P195i_had_presence myData:PF_0002 ;
  :has_operational_status :InCommission ;
  :has_propulsion_type :PaddleWheel ;
  :has_ship_type :PaddleFrigate ;
  crm:P167_was_within myData:place_mediterranean, myData:place_black_sea ;
  crm:P164_is_temporally_specified_by [ a crm:E52_Time-Span ;
    crm:P182i_starts_after_or_with_the_end_of myData:event_PF_0002_05 ;
    crm:P182_ends_before_or_with_the_start_of myData:event_PF_0002_06 ] .

myData:event_PF_0002_06 a :Decommissioning ;
  rdfs:label "Paid off 6.8.1856 at Sheerness into Steam Reserve"@en ;
  crm:P7_took_place_at myData:place_sheerness ;
  crm:P4_has_time-span [ a crm:E52_Time-Span ; crm:P82_at_some_time_within "1856-08-06"^^xsd:date ] .

### Steam Reserve and Reboilering
myData:presence_PF_0002_07 a crm:E93_Presence ;
  rdfs:label "In Steam Reserve at Sheerness"@en ;
  crm:P195i_had_presence myData:PF_0002 ;
  :has_operational_status :InOrdinary ;
  :has_propulsion_type :PaddleWheel ;
  :has_ship_type :PaddleFrigate ;
  crm:P167_was_within myData:place_sheerness ;
  crm:P164_is_temporally_specified_by [ a crm:E52_Time-Span ;
    crm:P182i_starts_after_or_with_the_end_of myData:event_PF_0002_06 ;
    crm:P182_ends_before_or_with_the_start_of myData:event_PF_0002_07 ] .

myData:event_PF_0002_07 a sealit:ShipRepair ;
  rdfs:label "Reboilered at Woolwich (11.1858-6.1859)"@en ;
  sealit:repaired myData:PF_0002 ;
  crm:P7_took_place_at myData:place_woolwich ;
  crm:P4_has_time-span [
    a crm:E52_Time-Span ;
    crm:P79_beginning_is_qualified_by "1858-11"^^xsd:gYearMonth ;
    crm:P80_end_is_qualified_by "1859-06"^^xsd:gYearMonth
  ] ;
  :incurred_cost [
    a crm:E97_Monetary_Amount ;
    rdfs:comment "£8,230"@en ;
    crm:P90_has_value "8230.0"^^xsd:decimal
  ] ;
  crm:P21_had_general_purpose :CombatCapabilityInvestment .

myData:presence_PF_0002_08 a crm:E93_Presence ;
  rdfs:label "Under repair (reboilering) at Woolwich"@en ;
  crm:P195i_had_presence myData:PF_0002 ;
  :has_operational_status :UnderRepair ;
  :has_propulsion_type :PaddleWheel ;
  :has_ship_type :PaddleFrigate ;
  crm:P167_was_within myData:place_woolwich ;
  crm:P164_is_temporally_specified_by [ a crm:E52_Time-Span ;
    crm:P79_beginning_is_qualified_by "1858-11"^^xsd:gYearMonth ;
    crm:P80_end_is_qualified_by "1859-06"^^xsd:gYearMonth
  ] .

### Final Service and Disposal
myData:event_PF_0002_08 a :Recommissioning ;
  rdfs:label "Recommissioned 27.4.1859"@en ;
  crm:P4_has_time-span [ a crm:E52_Time-Span ; crm:P82_at_some_time_within "1859-04-27"^^xsd:date ] .

myData:presence_PF_0002_09 a crm:E93_Presence ;
  rdfs:label "[Assumption] In ordinary between reboilering and recommissioning"@en ;
  crm:P195i_had_presence myData:PF_0002 ;
  :has_operational_status :InOrdinary ;
  :has_propulsion_type :PaddleWheel ;
  :has_ship_type :PaddleFrigate ;
  crm:P167_was_within myData:place_woolwich ;
  crm:P164_is_temporally_specified_by [ a crm:E52_Time-Span ;
    crm:P182i_starts_after_or_with_the_end_of myData:event_PF_0002_07 ;
    crm:P182_ends_before_or_with_the_start_of myData:event_PF_0002_08 ] .

myData:presence_PF_0002_10 a crm:E93_Presence ;
  rdfs:label "In commission for North America, West Indies, Gibraltar, Channel, and Mediterranean"@en ;
  crm:P195i_had_presence myData:PF_0002 ;
  :has_operational_status :InCommission ;
  :has_propulsion_type :PaddleWheel ;
  :has_ship_type :PaddleFrigate ;
  crm:P167_was_within myData:place_north_america, myData:place_west_indies, myData:place_gibraltar, myData:place_mediterranean ;
  crm:P164_is_temporally_specified_by [ a crm:E52_Time-Span ;
    crm:P182i_starts_after_or_with_the_end_of myData:event_PF_0002_08 ;
    crm:P182_ends_before_or_with_the_start_of myData:event_PF_0002_09 ] .

myData:event_PF_0002_09 a :Decommissioning ;
  rdfs:label "Paid off 9.4.1863"@en ;
  crm:P4_has_time-span [ a crm:E52_Time-Span ; crm:P82_at_some_time_within "1863-04-09"^^xsd:date ] .

myData:presence_PF_0002_11 a crm:E93_Presence ;
  rdfs:label "Paid off"@en ;
  crm:P195i_had_presence myData:PF_0002 ;
  :has_operational_status :PaidOff ;
  :has_propulsion_type :PaddleWheel ;
  :has_ship_type :PaddleFrigate ;
  crm:P164_is_temporally_specified_by [ a crm:E52_Time-Span ;
    crm:P182i_starts_after_or_with_the_end_of myData:event_PF_0002_09 ;
    crm:P182_ends_before_or_with_the_start_of myData:event_PF_0002_10 ] .

myData:event_PF_0002_10 a crm:E6_Destruction ;
  rdfs:label "Sold to Castle 7.10.1864 to be broken up at Charlton"@en ;
  crm:P13_destroyed myData:PF_0002 ;
  crm:P7_took_place_at myData:place_charlton ;
  crm:P4_has_time-span [ a crm:E52_Time-Span ; crm:P82_at_some_time_within "1864-10-07"^^xsd:date ] .

# --- Data from file: PF_0003.ttl ---


### Places
myData:place_woolwich a crm:E53_Place ; rdfs:label "Woolwich"@en .
myData:place_east_india_docks a crm:E53_Place ; rdfs:label "East India Docks"@en .
myData:place_portsmouth a crm:E53_Place ; rdfs:label "Portsmouth"@en .
myData:place_west_coast_of_africa a crm:E53_Place ; rdfs:label "West coast of Africa"@en .
myData:place_mediterranean a crm:E53_Place ; rdfs:label "Mediterranean"@en .
myData:place_black_sea a crm:E53_Place ; rdfs:label "Black Sea"@en .
myData:place_plymouth a crm:E53_Place ; rdfs:label "Plymouth"@en .
myData:place_north_america_and_west_indies a crm:E53_Place ; rdfs:label "North America and the West Indies"@en .
myData:place_south_america_east_coast a crm:E53_Place ; rdfs:label "East coast of South America"@en .

### Ship
myData:PF_0003 a sealit:Ship ;
  rdfs:label "HMS Gladiator"@en ;
  :has_propulsion_type :PaddleWheel ;
  :has_ship_type :PaddleFrigate ;
  dcterms:source "Winfield, Rif. British Warships in the Age of Sail, 1817-1863. Seaforth Publishing, 2014."@en .

### Construction and initial fitting
myData:event_PF_0003_01 a crm:E12_Production ;
  rdfs:label "As built: 190ft 0in, 163ft 8%in x 37ft Sin oa (37ft 2in for tonnage) x 23ft 0in. 1,210bm. 1,960 disp."@en ;
  crm:P7_took_place_at myData:place_woolwich ;
  crm:P4_has_time-span [
    a crm:E52_Time-Span ;
    crm:P79_beginning_is_qualified_by "1841-03-18"^^xsd:date ; # Ord
    crm:P80_end_is_qualified_by "1844-10-15"^^xsd:date # L
  ] ;
  :incurred_cost [
    a crm:E97_Monetary_Amount ;
    rdfs:comment "First cost: Hull £21,535, machinery £23,579, fitting £12,659"@en ;
    crm:P90_has_value "57773.0"^^xsd:decimal
  ] ;
  crm:P21_had_general_purpose :CombatCapabilityInvestment .

myData:event_PF_0003_02 a :Fitting ;
    rdfs:label "Completed at Woolwich (after engines fitted in East India Docks)"@en ;
    crm:P7_took_place_at myData:place_woolwich, myData:place_east_india_docks ;
    crm:P4_has_time-span [
        a crm:E52_Time-Span ;
        crm:P80_end_is_qualified_by "1846-04-25"^^xsd:date
    ] .

myData:presence_PF_0003_01 a crm:E93_Presence ;
  rdfs:label "Under fitting after launch until first commissioning"@en ;
  crm:P195i_had_presence myData:PF_0003 ;
  :has_operational_status :UnderFitting ;
  crm:P164_is_temporally_specified_by [
    a crm:E52_Time-Span ;
    crm:P182i_starts_after_or_with_the_end_of myData:event_PF_0003_01 ;
    crm:P182_ends_before_or_with_the_start_of myData:event_PF_0003_03
  ] .

### First commission period
myData:event_PF_0003_03 a :Commissioning ;
  rdfs:label "Commissioned 12.12.1845 for the Channel and Mediterranean"@en ;
  crm:P4_has_time-span [ a crm:E52_Time-Span ; crm:P82_at_some_time_within "1845-12-12"^^xsd:date ] .

myData:presence_PF_0003_02 a crm:E93_Presence ;
  rdfs:label "In commission in the Channel and Mediterranean"@en ;
  crm:P195i_had_presence myData:PF_0003 ;
  :has_operational_status :InCommission ;
  crm:P164_is_temporally_specified_by [
    a crm:E52_Time-Span ;
    crm:P182i_starts_after_or_with_the_end_of myData:event_PF_0003_03 ;
    crm:P182_ends_before_or_with_the_start_of myData:event_PF_0003_04
  ] .

myData:event_PF_0003_04 a :Decommissioning ;
  rdfs:label "Paid off 10.3.1849"@en ;
  crm:P4_has_time-span [ a crm:E52_Time-Span ; crm:P82_at_some_time_within "1849-03-10"^^xsd:date ] .

### Second commission period
myData:presence_PF_0003_03 a crm:E93_Presence ;
  rdfs:label "Paid off between commissions"@en ;
  crm:P195i_had_presence myData:PF_0003 ;
  :has_operational_status :PaidOff ;
  crm:P164_is_temporally_specified_by [
    a crm:E52_Time-Span ;
    crm:P182i_starts_after_or_with_the_end_of myData:event_PF_0003_04 ;
    crm:P182_ends_before_or_with_the_start_of myData:event_PF_0003_05
  ] .

myData:event_PF_0003_05 a :Recommissioning ;
  rdfs:label "Recommissioned 4.1.1850 for the west coast of Africa"@en ;
  crm:P4_has_time-span [ a crm:E52_Time-Span ; crm:P82_at_some_time_within "1850-01-04"^^xsd:date ] .

myData:presence_PF_0003_04 a crm:E93_Presence ;
  rdfs:label "In commission on the west coast of Africa"@en ;
  crm:P195i_had_presence myData:PF_0003 ;
  :has_operational_status :InCommission ;
  crm:P7_took_place_at myData:place_west_coast_of_africa ;
  crm:P164_is_temporally_specified_by [
    a crm:E52_Time-Span ;
    crm:P182i_starts_after_or_with_the_end_of myData:event_PF_0003_05 ;
    crm:P182_ends_before_or_with_the_start_of myData:event_PF_0003_06
  ] .

myData:event_PF_0003_06 a :Decommissioning ;
  rdfs:label "Paid off 16.5.1852 at Portsmouth"@en ;
  crm:P7_took_place_at myData:place_portsmouth ;
  crm:P4_has_time-span [ a crm:E52_Time-Span ; crm:P82_at_some_time_within "1852-05-16"^^xsd:date ] .

### Repair and Refit
myData:presence_PF_0003_05 a crm:E93_Presence ;
  rdfs:label "Paid off at Portsmouth before repair"@en ;
  crm:P195i_had_presence myData:PF_0003 ;
  :has_operational_status :PaidOff ;
  crm:P7_took_place_at myData:place_portsmouth ;
  crm:P164_is_temporally_specified_by [
    a crm:E52_Time-Span ;
    crm:P182i_starts_after_or_with_the_end_of myData:event_PF_0003_06 ;
    crm:P182_ends_before_or_with_the_start_of myData:event_PF_0003_07
  ] .

myData:event_PF_0003_07 a :Refit, :Repair ;
  rdfs:label "Repair and refit at Portsmouth 1852-53"@en ;
  :modifies_ship myData:PF_0003 ;
  crm:P7_took_place_at myData:place_portsmouth ;
  crm:P4_has_time-span [
    a crm:E52_Time-Span ;
    crm:P79_beginning_is_qualified_by "1852"^^xsd:gYear ;
    crm:P80_end_is_qualified_by "1853"^^xsd:gYear
  ] .

myData:presence_PF_0003_06 a crm:E93_Presence ;
  rdfs:label "Under repair and refit at Portsmouth"@en ;
  crm:P195i_had_presence myData:PF_0003 ;
  :has_operational_status :UnderRepair ;
  crm:P7_took_place_at myData:place_portsmouth ;
  crm:P164_is_temporally_specified_by [
    a crm:E52_Time-Span ;
    crm:P79_beginning_is_qualified_by "1852"^^xsd:gYear ;
    crm:P80_end_is_qualified_by "1853"^^xsd:gYear
  ] .

### Third commission period
myData:presence_PF_0003_07 a crm:E93_Presence ;
  rdfs:label "In ordinary after refit"@en ;
  crm:P195i_had_presence myData:PF_0003 ;
  :has_operational_status :InOrdinary ;
  crm:P7_took_place_at myData:place_portsmouth ;
  crm:P164_is_temporally_specified_by [
    a crm:E52_Time-Span ;
    crm:P182i_starts_after_or_with_the_end_of myData:event_PF_0003_07 ;
    crm:P182_ends_before_or_with_the_start_of myData:event_PF_0003_08
  ] .

myData:event_PF_0003_08 a :Recommissioning ;
  rdfs:label "Recommissioned 3.4.1854 for the Mediterranean and Black Sea"@en ;
  crm:P4_has_time-span [ a crm:E52_Time-Span ; crm:P82_at_some_time_within "1854-04-03"^^xsd:date ] .

myData:presence_PF_0003_08 a crm:E93_Presence ;
  rdfs:label "In commission in the Mediterranean and Black Sea"@en ;
  crm:P195i_had_presence myData:PF_0003 ;
  :has_operational_status :InCommission ;
  crm:P7_took_place_at myData:place_mediterranean, myData:place_black_sea ;
  crm:P164_is_temporally_specified_by [
    a crm:E52_Time-Span ;
    crm:P182i_starts_after_or_with_the_end_of myData:event_PF_0003_08 ;
    crm:P182_ends_before_or_with_the_start_of myData:event_PF_0003_09
  ] .

myData:event_PF_0003_09 a :Decommissioning ;
  rdfs:label "Paid off 22.5.1857 at Plymouth into Steam Reserve"@en ;
  crm:P7_took_place_at myData:place_plymouth ;
  crm:P4_has_time-span [ a crm:E52_Time-Span ; crm:P82_at_some_time_within "1857-05-22"^^xsd:date ] .

### Fourth commission period
myData:presence_PF_0003_09 a crm:E93_Presence ;
  rdfs:label "In Steam Reserve at Plymouth"@en ;
  crm:P195i_had_presence myData:PF_0003 ;
  :has_operational_status :InOrdinary ;
  crm:P7_took_place_at myData:place_plymouth ;
  crm:P164_is_temporally_specified_by [
    a crm:E52_Time-Span ;
    crm:P182i_starts_after_or_with_the_end_of myData:event_PF_0003_09 ;
    crm:P182_ends_before_or_with_the_start_of myData:event_PF_0003_10
  ] .

myData:event_PF_0003_10 a :Recommissioning ;
  rdfs:label "Recommissioned 22.6.1859 for North America and the West Indies"@en ;
  crm:P4_has_time-span [ a crm:E52_Time-Span ; crm:P82_at_some_time_within "1859-06-22"^^xsd:date ] .

myData:presence_PF_0003_10 a crm:E93_Presence ;
  rdfs:label "In commission in North America and the West Indies"@en ;
  crm:P195i_had_presence myData:PF_0003 ;
  :has_operational_status :InCommission ;
  crm:P7_took_place_at myData:place_north_america_and_west_indies ;
  crm:P164_is_temporally_specified_by [
    a crm:E52_Time-Span ;
    crm:P182i_starts_after_or_with_the_end_of myData:event_PF_0003_10 ;
    crm:P182_ends_before_or_with_the_start_of myData:event_PF_0003_11
  ] .

myData:event_PF_0003_11 a :Decommissioning ;
  rdfs:label "Paid off 29.10.1861 at Plymouth into Steam Reserve"@en ;
  crm:P7_took_place_at myData:place_plymouth ;
  crm:P4_has_time-span [ a crm:E52_Time-Span ; crm:P82_at_some_time_within "1861-10-29"^^xsd:date ] .

### Fifth commission period and end of career
myData:presence_PF_0003_11 a crm:E93_Presence ;
  rdfs:label "In Steam Reserve at Plymouth"@en ;
  crm:P195i_had_presence myData:PF_0003 ;
  :has_operational_status :InOrdinary ;
  crm:P7_took_place_at myData:place_plymouth ;
  crm:P164_is_temporally_specified_by [
    a crm:E52_Time-Span ;
    crm:P182i_starts_after_or_with_the_end_of myData:event_PF_0003_11 ;
    crm:P182_ends_before_or_with_the_start_of myData:event_PF_0003_12
  ] .

myData:event_PF_0003_12 a :Recommissioning ;
  rdfs:label "Recommissioned 9.3.1864 for particular service"@en ;
  crm:P4_has_time-span [ a crm:E52_Time-Span ; crm:P82_at_some_time_within "1864-03-09"^^xsd:date ] .

myData:presence_PF_0003_12 a crm:E93_Presence ;
  rdfs:label "In commission for particular service and on the east coast of South America"@en ;
  crm:P195i_had_presence myData:PF_0003 ;
  :has_operational_status :InCommission ;
  crm:P7_took_place_at myData:place_south_america_east_coast ;
  crm:P164_is_temporally_specified_by [
    a crm:E52_Time-Span ;
    crm:P182i_starts_after_or_with_the_end_of myData:event_PF_0003_12 ;
    crm:P182_ends_before_or_with_the_start_of myData:event_PF_0003_13
  ] .

myData:event_PF_0003_13 a :Decommissioning ;
  rdfs:label "Paid off 20.2.1872"@en ;
  crm:P4_has_time-span [ a crm:E52_Time-Span ; crm:P82_at_some_time_within "1872-02-20"^^xsd:date ] .

myData:presence_PF_0003_13 a crm:E93_Presence ;
  rdfs:label "Laid up before being broken up"@en ;
  crm:P195i_had_presence myData:PF_0003 ;
  :has_operational_status :InOrdinary ;
  crm:P164_is_temporally_specified_by [
    a crm:E52_Time-Span ;
    crm:P182i_starts_after_or_with_the_end_of myData:event_PF_0003_13 ;
    crm:P182_ends_before_or_with_the_start_of myData:event_PF_0003_14
  ] .

myData:event_PF_0003_14 a crm:E6_Destruction ;
  rdfs:label "Broken up (BU) 3.1879"@en ;
  rdfs:comment "Sold to Castle (by Admiralty Order 25.1.1877)"@en ;
  crm:P13_destroyed myData:PF_0003 ;
  crm:P4_has_time-span [ a crm:E52_Time-Span ; crm:P80_end_is_qualified_by "1879-03"^^xsd:gYearMonth ] .

# --- Data from file: PF_0008.ttl ---


### Places
myData:place_chatham a crm:E53_Place ; rdfs:label "Chatham"@en .
myData:place_east_india_dock a crm:E53_Place ; rdfs:label "East India Dock"@en .
myData:place_portsmouth a crm:E53_Place ; rdfs:label "Portsmouth"@en .
myData:place_woolwich a crm:E53_Place ; rdfs:label "Woolwich"@en .
myData:place_mediterranean_sea a crm:E53_Place ; rdfs:label "Mediterranean Sea"@en .
myData:place_black_sea a crm:E53_Place ; rdfs:label "Black Sea"@en .
myData:place_odessa a crm:E53_Place ; rdfs:label "Odessa"@en .
myData:place_sebastopol a crm:E53_Place ; rdfs:label "Sebastopol"@en .
myData:place_baltic_sea a crm:E53_Place ; rdfs:label "Baltic Sea"@en .
myData:place_east_indies a crm:E53_Place ; rdfs:label "East Indies"@en .
myData:place_china a crm:E53_Place ; rdfs:label "China"@en .
myData:place_hankow a crm:E53_Place ; rdfs:label "Hankow"@en .
myData:place_charlton a crm:E53_Place ; rdfs:label "Charlton"@en .

### Ship
myData:PF_0008 a sealit:Ship ;
  rdfs:label "HMS Retribution"@en ;
  :has_propulsion_type :PaddleWheel ;
  :has_ship_type :PaddleFrigate ;
  dcterms:source "Winfield, Rif. British Warships in the Age of Sail, 1817-1863. Seaforth Publishing, 2014."@en .

### Career Events and Presences

# 1. Construction and initial fitting (1842-1845)
myData:event_PF_0008_01 a crm:E12_Production ;
  rdfs:label "Built at Chatham Dyd/Maudslay, Sons & Field"@en ;
  crm:P7_took_place_at myData:place_chatham ;
  crm:P4_has_time-span [
    a crm:E52_Time-Span ;
    crm:P79_beginning_is_qualified_by "1842-03-26"^^xsd:date ; # Ord
    crm:P80_end_is_qualified_by "1844-07-02"^^xsd:date   # L
  ] ;
  :incurred_cost [
    a crm:E97_Monetary_Amount ;
    rdfs:comment "First cost: £91,540 total (hull £34,456, machinery £43,210, fitting £13,874)"@en ;
    crm:P90_has_value "91540.0"^^xsd:decimal
  ] .

myData:event_PF_0008_02 a :Fitting ;
  rdfs:label "Completed at Chatham after fitting machinery at East India Dock"@en ;
  crm:P7_took_place_at myData:place_chatham, myData:place_east_india_dock ;
  crm:P4_has_time-span [
    a crm:E52_Time-Span ;
    crm:P80_end_is_qualified_by "1845-12-23"^^xsd:date # C
  ] .

myData:event_PF_0008_03 a :Commissioning ;
  rdfs:label "Commissioned 14.10.1845"@en ;
  crm:P4_has_time-span [ a crm:E52_Time-Span ; crm:P82_at_some_time_within "1845-10-14"^^xsd:date ] .

myData:presence_PF_0008_01 a crm:E93_Presence ;
  rdfs:label "Under fitting from launch to first commissioning"@en ;
  crm:P195i_had_presence myData:PF_0008 ;
  :has_operational_status :UnderFitting ;
  crm:P164_is_temporally_specified_by [ a crm:E52_Time-Span ;
    crm:P182i_starts_after_or_with_the_end_of myData:event_PF_0008_01 ;
    crm:P182_ends_before_or_with_the_start_of myData:event_PF_0008_03 ] .

# 2. First service period (1845-1846)
myData:event_PF_0008_04 a :Decommissioning ;
  rdfs:label "Paid off 16.10.1846 at Portsmouth"@en ;
  crm:P7_took_place_at myData:place_portsmouth ;
  crm:P4_has_time-span [ a crm:E52_Time-Span ; crm:P82_at_some_time_within "1846-10-16"^^xsd:date ] .

myData:presence_PF_0008_02 a crm:E93_Presence ;
  rdfs:label "In commission for the Channel (1845-1846)"@en ;
  crm:P195i_had_presence myData:PF_0008 ;
  :has_operational_status :InCommission ;
  crm:P164_is_temporally_specified_by [ a crm:E52_Time-Span ;
    crm:P182i_starts_after_or_with_the_end_of myData:event_PF_0008_03 ;
    crm:P182_ends_before_or_with_the_start_of myData:event_PF_0008_04 ] .

# 3. Refit and re-engine (1849-1850)
myData:presence_PF_0008_03 a crm:E93_Presence ;
  rdfs:label "Paid off at Portsmouth before refit"@en ;
  crm:P195i_had_presence myData:PF_0008 ;
  :has_operational_status :PaidOff ;
  crm:P7_took_place_at myData:place_portsmouth ;
  crm:P164_is_temporally_specified_by [ a crm:E52_Time-Span ;
    crm:P182i_starts_after_or_with_the_end_of myData:event_PF_0008_04 ;
    crm:P80_end_is_qualified_by "1849"^^xsd:gYear ] .

myData:event_PF_0008_05 a :Refit ;
  rdfs:label "Re-engined at Woolwich and fitted for sea at Portsmouth (1849-1850) for £36,076"@en ;
  :modifies_ship myData:PF_0008 ;
  crm:P7_took_place_at myData:place_woolwich, myData:place_portsmouth ;
  crm:P4_has_time-span [
    a crm:E52_Time-Span ;
    crm:P79_beginning_is_qualified_by "1849"^^xsd:gYear ;
    crm:P80_end_is_qualified_by "1850-10"^^xsd:gYearMonth
  ] ;
  :incurred_cost [
    a crm:E97_Monetary_Amount ;
    rdfs:comment "£36,076"@en ;
    crm:P90_has_value "36076.0"^^xsd:decimal
  ] ;
  crm:P21_had_general_purpose :CombatCapabilityInvestment .

myData:event_PF_0008_06 a :Recommissioning ;
  rdfs:label "Recommissioned 7.8.1850"@en ;
  crm:P4_has_time-span [ a crm:E52_Time-Span ; crm:P82_at_some_time_within "1850-08-07"^^xsd:date ] .

myData:presence_PF_0008_04 a crm:E93_Presence ;
  rdfs:label "Under repair at Woolwich and Portsmouth"@en ;
  crm:P195i_had_presence myData:PF_0008 ;
  :has_operational_status :UnderRepair ;
  crm:P164_is_temporally_specified_by [ a crm:E52_Time-Span ;
    crm:P79_beginning_is_qualified_by "1849"^^xsd:gYear ;
    crm:P182_ends_before_or_with_the_start_of myData:event_PF_0008_06 ] .

# 4. Second service period (Crimean War, 1850-1855)
myData:event_PF_0008_07 a :Recommissioning ;
  rdfs:label "Recommissioned 10.6.1852"@en ;
  crm:P4_has_time-span [ a crm:E52_Time-Span ; crm:P82_at_some_time_within "1852-06-10"^^xsd:date ] .

myData:event_PF_0008_08 a :Decommissioning ;
  rdfs:label "Paid off 2.2.1855 at Portsmouth"@en ;
  crm:P7_took_place_at myData:place_portsmouth ;
  crm:P4_has_time-span [ a crm:E52_Time-Span ; crm:P82_at_some_time_within "1855-02-02"^^xsd:date ] .

myData:presence_PF_0008_05 a crm:E93_Presence ;
  rdfs:label "In commission for Mediterranean and Black Sea (1850-1855)"@en ;
  crm:P195i_had_presence myData:PF_0008 ;
  :has_operational_status :InCommission ;
  crm:P7_took_place_at myData:place_mediterranean_sea, myData:place_black_sea, myData:place_odessa, myData:place_sebastopol ;
  crm:P164_is_temporally_specified_by [ a crm:E52_Time-Span ;
    crm:P182i_starts_after_or_with_the_end_of myData:event_PF_0008_06 ;
    crm:P182_ends_before_or_with_the_start_of myData:event_PF_0008_08 ] .

# 5. Third service period (Baltic, 1855-1856)
myData:presence_PF_0008_06 a crm:E93_Presence ;
  rdfs:label "Paid off at Portsmouth (Feb-Mar 1855)"@en ;
  crm:P195i_had_presence myData:PF_0008 ;
  :has_operational_status :PaidOff ;
  crm:P7_took_place_at myData:place_portsmouth ;
  crm:P164_is_temporally_specified_by [ a crm:E52_Time-Span ;
    crm:P182i_starts_after_or_with_the_end_of myData:event_PF_0008_08 ;
    crm:P80_end_is_qualified_by "1855-03"^^xsd:gYearMonth ] .

myData:event_PF_0008_09 a :Recommissioning ;
  rdfs:label "Recommissioned 3.1855"@en ;
  crm:P4_has_time-span [ a crm:E52_Time-Span ; crm:P82_at_some_time_within "1855-03"^^xsd:gYearMonth ] .

myData:event_PF_0008_10 a :Decommissioning ;
  rdfs:label "Paid off 22.8.1856 at Portsmouth"@en ;
  crm:P7_took_place_at myData:place_portsmouth ;
  crm:P4_has_time-span [ a crm:E52_Time-Span ; crm:P82_at_some_time_within "1856-08-22"^^xsd:date ] .

myData:presence_PF_0008_07 a crm:E93_Presence ;
  rdfs:label "In commission for the Baltic (1855-1856)"@en ;
  crm:P195i_had_presence myData:PF_0008 ;
  :has_operational_status :InCommission ;
  crm:P7_took_place_at myData:place_baltic_sea ;
  crm:P164_is_temporally_specified_by [ a crm:E52_Time-Span ;
    crm:P182i_starts_after_or_with_the_end_of myData:event_PF_0008_09 ;
    crm:P182_ends_before_or_with_the_start_of myData:event_PF_0008_10 ] .

# 6. Fourth service period (Channel, East Indies, China, 1856-1860)
myData:presence_PF_0008_08 a crm:E93_Presence ;
  rdfs:label "Paid off at Portsmouth (Aug 1856)"@en ;
  crm:P195i_had_presence myData:PF_0008 ;
  :has_operational_status :PaidOff ;
  crm:P7_took_place_at myData:place_portsmouth ;
  crm:P164_is_temporally_specified_by [ a crm:E52_Time-Span ;
    crm:P182i_starts_after_or_with_the_end_of myData:event_PF_0008_10 ;
    crm:P80_end_is_qualified_by "1856-08-24"^^xsd:date ] .

myData:event_PF_0008_11 a :Recommissioning ;
  rdfs:label "Recommissioned 24.8.1856"@en ;
  crm:P4_has_time-span [ a crm:E52_Time-Span ; crm:P82_at_some_time_within "1856-08-24"^^xsd:date ] .

myData:event_PF_0008_12 a :Commissioning ;
  rdfs:label "On 26.1.1859 under Capt. Peter Cracraft"@en ;
  crm:P4_has_time-span [ a crm:E52_Time-Span ; crm:P82_at_some_time_within "1859-01-26"^^xsd:date ] .

myData:event_PF_0008_13 a :Commissioning ;
  rdfs:label "On 15.2.1859 under Capt. Harry Edmund Edgell"@en ;
  crm:P4_has_time-span [ a crm:E52_Time-Span ; crm:P82_at_some_time_within "1859-02-15"^^xsd:date ] .

myData:event_PF_0008_14 a :Decommissioning ;
  rdfs:label "Paid off 22.12.1860 at Portsmouth"@en ;
  crm:P7_took_place_at myData:place_portsmouth ;
  crm:P4_has_time-span [ a crm:E52_Time-Span ; crm:P82_at_some_time_within "1860-12-22"^^xsd:date ] .

myData:presence_PF_0008_09 a crm:E93_Presence ;
  rdfs:label "In commission for Channel, East Indies and China (1856-1860)"@en ;
  crm:P195i_had_presence myData:PF_0008 ;
  :has_operational_status :InCommission ;
  crm:P7_took_place_at myData:place_east_indies, myData:place_china, myData:place_hankow ;
  crm:P164_is_temporally_specified_by [ a crm:E52_Time-Span ;
    crm:P182i_starts_after_or_with_the_end_of myData:event_PF_0008_11 ;
    crm:P182_ends_before_or_with_the_start_of myData:event_PF_0008_14 ] .

# 7. End of career (1860-1864)
myData:event_PF_0008_15 a crm:E6_Destruction ;
  rdfs:label "Sold to Castle & Beech to be broken up at Charlton"@en ;
  crm:P13_destroyed myData:PF_0008 ;
  crm:P7_took_place_at myData:place_charlton ;
  crm:P4_has_time-span [ a crm:E52_Time-Span ; crm:P79_beginning_is_qualified_by "1864-07-15"^^xsd:date ] .

myData:presence_PF_0008_10 a crm:E93_Presence ;
  rdfs:label "In ordinary at Portsmouth until sold"@en ;
  crm:P195i_had_presence myData:PF_0008 ;
  :has_operational_status :InOrdinary ;
  crm:P7_took_place_at myData:place_portsmouth ;
  crm:P164_is_temporally_specified_by [ a crm:E52_Time-Span ;
    crm:P182i_starts_after_or_with_the_end_of myData:event_PF_0008_14 ;
    crm:P182_ends_before_or_with_the_start_of myData:event_PF_0008_15 ] .

# --- Data from file: PGV_0005.ttl ---


### Places
myData:place_govan a crm:E53_Place ; rdfs:label "Govan"@en .
myData:place_woolwich a crm:E53_Place ; rdfs:label "Woolwich"@en .
myData:place_devenport a crm:E53_Place ; rdfs:label "Devenport"@en .
myData:place_mediterranean a crm:E53_Place ; rdfs:label "Mediterranean"@en .
myData:place_home_station a crm:E53_Place ; rdfs:label "Home station"@en .
myData:place_lisbon a crm:E53_Place ; rdfs:label "Lisbon"@en .
myData:place_portsmouth a crm:E53_Place ; rdfs:label "Portsmouth"@en .
myData:place_west_coast_of_africa a crm:E53_Place ; rdfs:label "West coast of Africa"@en .
myData:place_ascension a crm:E53_Place ; rdfs:label "Ascension"@en .
myData:place_sheerness a crm:E53_Place ; rdfs:label "Sheerness"@en .
myData:place_west_coast_of_scotland a crm:E53_Place ; rdfs:label "West coast of Scotland"@en .

### Ship Roles
myData:role_fishery_protection a :ShipRole ; rdfs:label "Fishery Protection Vessel"@en .

### Ship
myData:PGV_0005 a sealit:Ship ;
  rdfs:label "HMS Jackal"@en ;
  :has_propulsion_type :PaddleWheel ;
  :has_ship_type :PaddleGunvessel ;
  dcterms:source "Winfield, Rif. British Warships in the Age of Sail, 1817-1863. Seaforth Publishing, 2014."@en .

### Construction and initial fitting
myData:event_PGV_0005_01 a crm:E12_Production ;
  rdfs:label "Construction by Robert Napier & Sons, Govan"@en ;
  crm:P7_took_place_at myData:place_govan ;
  crm:P4_has_time-span [
    a crm:E52_Time-Span ;
    crm:P79_beginning_is_qualified_by "1844-01-16"^^xsd:date ; # Ord
    crm:P80_end_is_qualified_by "1844-10-28"^^xsd:date   # L
  ] ;
  :incurred_cost [
    a crm:E97_Monetary_Amount ;
    rdfs:comment "First cost: £14,665 (hull £5,680, machinery £6,000; fitting £2,985)"@en ;
    crm:P90_has_value "14665.0"^^xsd:decimal
  ] .

myData:event_PGV_0005_02 a :Fitting ;
  rdfs:label "Completed at Woolwich and Devenport"@en ;
  :modifies_ship myData:PGV_0005 ;
  crm:P7_took_place_at myData:place_woolwich, myData:place_devenport ;
  crm:P4_has_time-span [
    a crm:E52_Time-Span ;
    crm:P80_end_is_qualified_by "1845-09-22"^^xsd:date # C
  ] .

myData:presence_PGV_0005_01 a crm:E93_Presence ;
  rdfs:label "Under fitting after launch until first commissioning"@en ;
  crm:P195i_had_presence myData:PGV_0005 ;
  :has_operational_status :UnderFitting ;
  :has_propulsion_type :PaddleWheel ;
  :has_ship_type :PaddleGunvessel ;
  crm:P167_was_within myData:place_woolwich, myData:place_devenport ;
  crm:P164_is_temporally_specified_by [ a crm:E52_Time-Span ;
    crm:P182i_starts_after_or_with_the_end_of myData:event_PGV_0005_01 ;
    crm:P182_ends_before_or_with_the_start_of myData:event_PGV_0005_03
  ] .

### First Commission
myData:event_PGV_0005_03 a :Commissioning ;
  rdfs:label "Commissioned 7.4.1845 for the Mediterranean"@en ;
  :modifies_ship myData:PGV_0005 ;
  crm:P4_has_time-span [ a crm:E52_Time-Span ; crm:P82_at_some_time_within "1845-04-07"^^xsd:date ] .

myData:presence_PGV_0005_02 a crm:E93_Presence ;
  rdfs:label "In Commission (7.4.1845 - 24.4.1848) for the Mediterranean and Home station"@en ;
  crm:P195i_had_presence myData:PGV_0005 ;
  :has_operational_status :InCommission ;
  :has_propulsion_type :PaddleWheel ;
  :has_ship_type :PaddleGunvessel ;
  crm:P167_was_within myData:place_mediterranean, myData:place_home_station, myData:place_lisbon ;
  crm:P164_is_temporally_specified_by [ a crm:E52_Time-Span ;
    crm:P182i_starts_after_or_with_the_end_of myData:event_PGV_0005_03 ;
    crm:P182_ends_before_or_with_the_start_of myData:event_PGV_0005_04
  ] .

myData:event_PGV_0005_04 a :Decommissioning ;
  rdfs:label "Paid off 24.4.1848 at Portsmouth"@en ;
  :modifies_ship myData:PGV_0005 ;
  crm:P7_took_place_at myData:place_portsmouth ;
  crm:P4_has_time-span [ a crm:E52_Time-Span ; crm:P82_at_some_time_within "1848-04-24"^^xsd:date ] .

### Steam Reserve
myData:presence_PGV_0005_03 a crm:E93_Presence ;
  rdfs:label "In Steam Reserve at Devenport (24.4.1848 - 26.1.1850)"@en ;
  crm:P195i_had_presence myData:PGV_0005 ;
  :has_operational_status :InOrdinary ;
  :has_propulsion_type :PaddleWheel ;
  :has_ship_type :PaddleGunvessel ;
  crm:P167_was_within myData:place_devenport ;
  crm:P164_is_temporally_specified_by [ a crm:E52_Time-Span ;
    crm:P182i_starts_after_or_with_the_end_of myData:event_PGV_0005_04 ;
    crm:P182_ends_before_or_with_the_start_of myData:event_PGV_0005_05
  ] .

### Second Commission
myData:event_PGV_0005_05 a :Recommissioning ;
  rdfs:label "Recommissioned 26.1.1850 for west coast of Africa"@en ;
  :modifies_ship myData:PGV_0005 ;
  crm:P4_has_time-span [ a crm:E52_Time-Span ; crm:P82_at_some_time_within "1850-01-26"^^xsd:date ] .

myData:presence_PGV_0005_04 a crm:E93_Presence ;
  rdfs:label "In Commission (26.1.1850 - 12.6.1852) on west coast of Africa"@en ;
  crm:P195i_had_presence myData:PGV_0005 ;
  :has_operational_status :InCommission ;
  :has_propulsion_type :PaddleWheel ;
  :has_ship_type :PaddleGunvessel ;
  crm:P167_was_within myData:place_west_coast_of_africa, myData:place_ascension ;
  crm:P164_is_temporally_specified_by [ a crm:E52_Time-Span ;
    crm:P182i_starts_after_or_with_the_end_of myData:event_PGV_0005_05 ;
    crm:P182_ends_before_or_with_the_start_of myData:event_PGV_0005_06
  ] .

myData:event_PGV_0005_06 a :Decommissioning ;
  rdfs:label "Paid off 12.6.1852"@en ;
  :modifies_ship myData:PGV_0005 ;
  crm:P4_has_time-span [ a crm:E52_Time-Span ; crm:P82_at_some_time_within "1852-06-12"^^xsd:date ] .

### Refit 1
myData:presence_PGV_0005_05 a crm:E93_Presence ;
  rdfs:label "Paid off period before refit (12.6.1852 - 1854)"@en ;
  crm:P195i_had_presence myData:PGV_0005 ;
  :has_operational_status :PaidOff ;
  :has_propulsion_type :PaddleWheel ;
  :has_ship_type :PaddleGunvessel ;
  crm:P164_is_temporally_specified_by [ a crm:E52_Time-Span ;
    crm:P182i_starts_after_or_with_the_end_of myData:event_PGV_0005_06 ;
    crm:P182_ends_before_or_with_the_start_of myData:event_PGV_0005_07
  ] .

myData:event_PGV_0005_07 a :Refit ;
  rdfs:label "Refitted at Woolwich (1854) for £4,612"@en ;
  :modifies_ship myData:PGV_0005 ;
  crm:P7_took_place_at myData:place_woolwich ;
  crm:P4_has_time-span [
    a crm:E52_Time-Span ;
    crm:P82_at_some_time_within "1854"^^xsd:gYear
  ] ;
  :incurred_cost [
    a crm:E97_Monetary_Amount ;
    rdfs:comment "£4,612"@en ;
    crm:P90_has_value "4612.0"^^xsd:decimal
  ] ;
  crm:P21_had_general_purpose :CombatCapabilityInvestment .

myData:presence_PGV_0005_06 a crm:E93_Presence ;
  rdfs:label "Under repair at Woolwich (1854)"@en ;
  crm:P195i_had_presence myData:PGV_0005 ;
  :has_operational_status :UnderRepair ;
  :has_propulsion_type :PaddleWheel ;
  :has_ship_type :PaddleGunvessel ;
  crm:P167_was_within myData:place_woolwich ;
  crm:P164_is_temporally_specified_by [ a crm:E52_Time-Span ;
    crm:P182i_starts_after_or_with_the_end_of myData:event_PGV_0005_07 ;
    crm:P182_ends_before_or_with_the_start_of myData:event_PGV_0005_08
  ] .

### Third Commission
myData:event_PGV_0005_08 a :Recommissioning ;
  rdfs:label "Recommissioned 30.6.1854 for particular service"@en ;
  :modifies_ship myData:PGV_0005 ;
  crm:P4_has_time-span [ a crm:E52_Time-Span ; crm:P82_at_some_time_within "1854-06-30"^^xsd:date ] .

myData:presence_PGV_0005_07 a crm:E93_Presence ;
  rdfs:label "In Commission (30.6.1854 - 29.10.1858)"@en ;
  crm:P195i_had_presence myData:PGV_0005 ;
  :has_operational_status :InCommission ;
  :has_propulsion_type :PaddleWheel ;
  :has_ship_type :PaddleGunvessel ;
  crm:P164_is_temporally_specified_by [ a crm:E52_Time-Span ;
    crm:P182i_starts_after_or_with_the_end_of myData:event_PGV_0005_08 ;
    crm:P182_ends_before_or_with_the_start_of myData:event_PGV_0005_09
  ] .

myData:event_PGV_0005_09 a :Decommissioning ;
  rdfs:label "Paid off 29.10.1858 at Sheerness"@en ;
  :modifies_ship myData:PGV_0005 ;
  crm:P7_took_place_at myData:place_sheerness ;
  crm:P4_has_time-span [ a crm:E52_Time-Span ; crm:P82_at_some_time_within "1858-10-29"^^xsd:date ] .

### Refit 2
myData:presence_PGV_0005_08 a crm:E93_Presence ;
  rdfs:label "Paid off period before refit (29.10.1858 - 1858)"@en ;
  crm:P195i_had_presence myData:PGV_0005 ;
  :has_operational_status :PaidOff ;
  :has_propulsion_type :PaddleWheel ;
  :has_ship_type :PaddleGunvessel ;
  crm:P167_was_within myData:place_sheerness ;
  crm:P164_is_temporally_specified_by [ a crm:E52_Time-Span ;
    crm:P182i_starts_after_or_with_the_end_of myData:event_PGV_0005_09 ;
    crm:P182_ends_before_or_with_the_start_of myData:event_PGV_0005_10
  ] .

myData:event_PGV_0005_10 a :Refit ;
  rdfs:label "Refitted at Woolwich (1858-59) for £7,847"@en ;
  :modifies_ship myData:PGV_0005 ;
  crm:P7_took_place_at myData:place_woolwich ;
  crm:P4_has_time-span [
    a crm:E52_Time-Span ;
    crm:P79_beginning_is_qualified_by "1858"^^xsd:gYear ;
    crm:P80_end_is_qualified_by "1859"^^xsd:gYear
  ] ;
  :incurred_cost [
    a crm:E97_Monetary_Amount ;
    rdfs:comment "£7,847"@en ;
    crm:P90_has_value "7847.0"^^xsd:decimal
  ] ;
  crm:P21_had_general_purpose :CombatCapabilityInvestment .

myData:presence_PGV_0005_09 a crm:E93_Presence ;
  rdfs:label "Under repair at Woolwich (1858-59)"@en ;
  crm:P195i_had_presence myData:PGV_0005 ;
  :has_operational_status :UnderRepair ;
  :has_propulsion_type :PaddleWheel ;
  :has_ship_type :PaddleGunvessel ;
  crm:P167_was_within myData:place_woolwich ;
  crm:P164_is_temporally_specified_by [ a crm:E52_Time-Span ;
    crm:P182i_starts_after_or_with_the_end_of myData:event_PGV_0005_10 ;
    crm:P182_ends_before_or_with_the_start_of myData:event_PGV_0005_11
  ] .

### Fourth Commission (Fishery Protection)
myData:event_PGV_0005_11 a :Recommissioning ;
  rdfs:label "Recommissioned 21.5.1859 for fishery protection"@en ;
  :modifies_ship myData:PGV_0005 ;
  crm:P4_has_time-span [ a crm:E52_Time-Span ; crm:P82_at_some_time_within "1859-05-21"^^xsd:date ] .

myData:presence_PGV_0005_10 a crm:E93_Presence ;
  rdfs:label "On fishery protection on west coast of Scotland (21.5.1859 - 5.1.1885)"@en ;
  crm:P195i_had_presence myData:PGV_0005 ;
  :has_operational_status :InNonCombatDuty ;
  :has_propulsion_type :PaddleWheel ;
  :has_ship_role myData:role_fishery_protection ;
  crm:P167_was_within myData:place_west_coast_of_scotland ;
  crm:P164_is_temporally_specified_by [ a crm:E52_Time-Span ;
    crm:P182i_starts_after_or_with_the_end_of myData:event_PGV_0005_11 ;
    crm:P182_ends_before_or_with_the_start_of myData:event_PGV_0005_12
  ] .

myData:event_PGV_0005_12 a :Recommissioning ;
  rdfs:label "Recommissioned 5.1.1885"@en ;
  :modifies_ship myData:PGV_0005 ;
  crm:P4_has_time-span [ a crm:E52_Time-Span ; crm:P82_at_some_time_within "1885-01-05"^^xsd:date ] .

myData:presence_PGV_0005_11 a crm:E93_Presence ;
  rdfs:label "On fishery protection on west coast of Scotland (5.1.1885 - 30.4.1886)"@en ;
  crm:P195i_had_presence myData:PGV_0005 ;
  :has_operational_status :InNonCombatDuty ;
  :has_propulsion_type :PaddleWheel ;
  :has_ship_role myData:role_fishery_protection ;
  crm:P167_was_within myData:place_west_coast_of_scotland ;
  crm:P164_is_temporally_specified_by [ a crm:E52_Time-Span ;
    crm:P182i_starts_after_or_with_the_end_of myData:event_PGV_0005_12 ;
    crm:P182_ends_before_or_with_the_start_of myData:event_PGV_0005_13
  ] .

### Final period and Destruction
myData:event_PGV_0005_13 a :Decommissioning ;
  rdfs:label "Paid off 30.4.1886"@en ;
  :modifies_ship myData:PGV_0005 ;
  crm:P4_has_time-span [ a crm:E52_Time-Span ; crm:P82_at_some_time_within "1886-04-30"^^xsd:date ] .

myData:presence_PGV_0005_12 a crm:E93_Presence ;
  rdfs:label "Paid off for sale (30.4.1886 - 11.1887)"@en ;
  crm:P195i_had_presence myData:PGV_0005 ;
  :has_operational_status :PaidOff ;
  :has_propulsion_type :PaddleWheel ;
  :has_ship_type :PaddleGunvessel ;
  crm:P164_is_temporally_specified_by [ a crm:E52_Time-Span ;
    crm:P182i_starts_after_or_with_the_end_of myData:event_PGV_0005_13 ;
    crm:P182_ends_before_or_with_the_start_of myData:event_PGV_0005_14
  ] .

myData:event_PGV_0005_14 a crm:E6_Destruction ;
  rdfs:label "Sold to be broken up (BU) in 11.1887"@en ;
  crm:P13_destroyed myData:PGV_0005 ;
  crm:P4_has_time-span [ a crm:E52_Time-Span ; crm:P82_at_some_time_within "1887-11"^^xsd:gYearMonth ] .

# --- Data from file: PGV_0011.ttl ---


### Places
myData:place_millwall a crm:E53_Place ;
    rdfs:label "Millwall"@en .
myData:place_west_coast_of_africa a crm:E53_Place ;
    rdfs:label "West coast of Africa"@en .

### Ship
myData:PGV_0011 a sealit:Ship ;
    rdfs:label "HMS Grappler"@en ;
    :has_propulsion_type :PaddleWheel ;
    :has_ship_type :PaddleGunvessel ;
    dcterms:source "Winfield, Rif. British Warships in the Age of Sail, 1817-1863. Seaforth Publishing, 2014."@en .

### Career Events and Presences

# 1. Construction
myData:event_PGV_0011_01 a crm:E12_Production ;
    rdfs:label "As built: 165ft 2in, 149ft 3in x 26ft 7in x 16ft 7in. 561 4/94bm."@en ;
    rdfs:comment "Built by William Fairbairn & Co., Millwall (hull) and Maudslay, Sons & Field (machinery)."@en ;
    crm:P7_took_place_at myData:place_millwall ;
    crm:P4_has_time-span [
        a crm:E52_Time-Span ;
        crm:P79_beginning_is_qualified_by "1844-07-27"^^xsd:date ; # Ord
        crm:P80_end_is_qualified_by "1845-12-30"^^xsd:date   # L
    ] ;
    :incurred_cost [
        a crm:E97_Monetary_Amount ;
        rdfs:comment "First cost: £35,161 total (hull £13,863, machinery £16,830, fitting £4,468)."@en ;
        crm:P90_has_value "35161.0"^^xsd:decimal
    ] ;
    crm:P21_had_general_purpose :CombatCapabilityInvestment .

# Presence between launch and commissioning
myData:presence_PGV_0011_01 a crm:E93_Presence ;
    rdfs:label "Fitting out after launch"@en ;
    crm:P195i_had_presence myData:PGV_0011 ;
    :has_operational_status :UnderFitting ;
    :has_propulsion_type :PaddleWheel ;
    :has_ship_type :PaddleGunvessel ;
    crm:P164_is_temporally_specified_by [
        a crm:E52_Time-Span ;
        crm:P182i_starts_after_or_with_the_end_of myData:event_PGV_0011_01 ;
        crm:P182_ends_before_or_with_the_start_of myData:event_PGV_0011_02
    ] .

# 2. Commissioning
myData:event_PGV_0011_02 a :Commissioning ;
    rdfs:label "Commissioned 10.11.1846 and Completed 26.11.1846"@en ;
    crm:P4_has_time-span [
        a crm:E52_Time-Span ;
        crm:P79_beginning_is_qualified_by "1846-11-10"^^xsd:date ; # Commissioned
        crm:P80_end_is_qualified_by "1846-11-26"^^xsd:date   # C
    ] .

# Presence in commission
myData:presence_PGV_0011_02 a crm:E93_Presence ;
    rdfs:label "In Commission for the west coast of Africa"@en ;
    rdfs:comment "Took slavers Taglioni 30.3.1847, Pampa 26.11.1847 and Aguia 8.12.1847"@en ;
    crm:P195i_had_presence myData:PGV_0011 ;
    :has_operational_status :InCommission ;
    :has_propulsion_type :PaddleWheel ;
    :has_ship_type :PaddleGunvessel ;
    crm:P167_was_within myData:place_west_coast_of_africa ;
    crm:P164_is_temporally_specified_by [
        a crm:E52_Time-Span ;
        crm:P182i_starts_after_or_with_the_end_of myData:event_PGV_0011_02 ;
        crm:P182_ends_before_or_with_the_start_of myData:event_PGV_0011_03
    ] .

# 3. Decommissioning
myData:event_PGV_0011_03 a :Decommissioning ;
    rdfs:label "Paid off 10.1.1849"@en ;
    crm:P4_has_time-span [
        a crm:E52_Time-Span ;
        crm:P82_at_some_time_within "1849-01-10"^^xsd:date
    ] .

# Presence after paid off
myData:presence_PGV_0011_03 a crm:E93_Presence ;
    rdfs:label "Paid off and awaiting disposal"@en ;
    crm:P195i_had_presence myData:PGV_0011 ;
    :has_operational_status :PaidOff ;
    :has_propulsion_type :PaddleWheel ;
    :has_ship_type :PaddleGunvessel ;
    crm:P164_is_temporally_specified_by [
        a crm:E52_Time-Span ;
        crm:P182i_starts_after_or_with_the_end_of myData:event_PGV_0011_03 ;
        crm:P182_ends_before_or_with_the_start_of myData:event_PGV_0011_04
    ] .

# 4. End of career: Sale
myData:event_PGV_0011_04 a crm:E8_Acquisition ;
    rdfs:label "Sold to W. P. Beach to be broken up (for £560) on 2.2.1850"@en ;
    crm:P4_has_time-span [
        a crm:E52_Time-Span ;
        crm:P82_at_some_time_within "1850-02-02"^^xsd:date
    ] .

# --- Data from file: PM_0007.ttl ---


### Places
myData:place_pembroke a crm:E53_Place ;
  rdfs:label "Pembroke"@en .
myData:place_mediterranean a crm:E53_Place ;
  rdfs:label "Mediterranean"@en .
myData:place_malta a crm:E53_Place ;
  rdfs:label "Malta"@en .

### Ship Role
:SurveyVessel a :ShipRole ;
  rdfs:label "Survey Vessel"@en .

### Ship
myData:PM_0007 a sealit:Ship ;
  rdfs:label "HMS Medina"@en ;
  :has_propulsion_type :PaddleWheel ;
  :has_ship_type :PaddleMisc ;
  dcterms:source "Winfield, Rif. British Warships in the Age of Sail, 1817-1863. Seaforth Publishing, 2014."@en .

### Career Events and Presences

# Construction and First Commissioning
myData:event_PM_0007_01 a crm:E12_Production ;
  rdfs:label "Construction at Pembroke Dyd/Fawcett, Preston & Co."@en ;
  crm:P7_took_place_at myData:place_pembroke ;
  crm:P4_has_time-span [
    a crm:E52_Time-Span ;
    crm:P79_beginning_is_qualified_by "1839-03-30"^^xsd:date ;
    crm:P80_end_is_qualified_by "1840-03-18"^^xsd:date
  ] ;
  :incurred_cost [
    a crm:E97_Monetary_Amount ;
    rdfs:comment "First cost: Hull £16,411, fitting £21,311 (including machinery £14,767)"@en ;
    crm:P90_has_value "37722.0"^^xsd:decimal
  ] ;
  crm:P21_had_general_purpose :CombatCapabilityInvestment .

myData:event_PM_0007_02 a :Commissioning ;
  rdfs:label "Commissioned 4.1840"@en ;
  crm:P4_has_time-span [
    a crm:E52_Time-Span ;
    crm:P82_at_some_time_within "1840-04"^^xsd:gYearMonth
  ] .

# In Ordinary period
myData:presence_PM_0007_01 a crm:E93_Presence ;
  rdfs:label "[Assumption] In Ordinary from first commissioning (4.1840) to recommissioning for service (19.10.1848)"@en ;
  crm:P195i_had_presence myData:PM_0007 ;
  :has_operational_status :InOrdinary ;
  :has_propulsion_type :PaddleWheel ;
  :has_ship_type :PaddleMisc ;
  crm:P164_is_temporally_specified_by [
    a crm:E52_Time-Span ;
    crm:P182i_starts_after_or_with_the_end_of myData:event_PM_0007_02 ;
    crm:P182_ends_before_or_with_the_start_of myData:event_PM_0007_03
  ] .

# Mediterranean Service
myData:event_PM_0007_03 a :Recommissioning ;
  rdfs:label "Commissioned for Mediterranean service 19.10.1848"@en ;
  crm:P4_has_time-span [
    a crm:E52_Time-Span ;
    crm:P82_at_some_time_within "1848-10-19"^^xsd:date
  ] .

myData:presence_PM_0007_02 a crm:E93_Presence ;
  rdfs:label "In Commission in the Mediterranean (19.10.1848 - 7.1.1856)"@en ;
  crm:P195i_had_presence myData:PM_0007 ;
  :has_operational_status :InCommission ;
  :has_propulsion_type :PaddleWheel ;
  :has_ship_type :PaddleMisc ;
  crm:P7_took_place_at myData:place_mediterranean ;
  crm:P164_is_temporally_specified_by [
    a crm:E52_Time-Span ;
    crm:P182i_starts_after_or_with_the_end_of myData:event_PM_0007_03 ;
    crm:P182_ends_before_or_with_the_start_of myData:event_PM_0007_04
  ] .

myData:event_PM_0007_04 a :Recommissioning ;
  rdfs:label "Recommissioned as survey vessel 7.1.1856"@en ;
  crm:P4_has_time-span [
    a crm:E52_Time-Span ;
    crm:P82_at_some_time_within "1856-01-07"^^xsd:date
  ] .

myData:presence_PM_0007_03 a crm:E93_Presence ;
  rdfs:label "In Non-Combat Duty as a survey vessel in the Mediterranean (7.1.1856 - 10.11.1863)"@en ;
  crm:P195i_had_presence myData:PM_0007 ;
  :has_operational_status :InNonCombatDuty ;
  :has_propulsion_type :PaddleWheel ;
  :has_ship_role :SurveyVessel ;
  crm:P7_took_place_at myData:place_mediterranean ;
  crm:P164_is_temporally_specified_by [
    a crm:E52_Time-Span ;
    crm:P182i_starts_after_or_with_the_end_of myData:event_PM_0007_04 ;
    crm:P182_ends_before_or_with_the_start_of myData:event_PM_0007_05
  ] .

# Decommissioning and End of Career
myData:event_PM_0007_05 a :Decommissioning ;
  rdfs:label "Paid off at Malta 10.11.1863"@en ;
  crm:P7_took_place_at myData:place_malta ;
  crm:P4_has_time-span [
    a crm:E52_Time-Span ;
    crm:P82_at_some_time_within "1863-11-10"^^xsd:date
  ] .

myData:presence_PM_0007_04 a crm:E93_Presence ;
  rdfs:label "Paid off at Malta (10.11.1863 - 3.1864)"@en ;
  crm:P195i_had_presence myData:PM_0007 ;
  :has_operational_status :PaidOff ;
  :has_propulsion_type :PaddleWheel ;
  :has_ship_type :PaddleMisc ;
  crm:P7_took_place_at myData:place_malta ;
  crm:P164_is_temporally_specified_by [
    a crm:E52_Time-Span ;
    crm:P182i_starts_after_or_with_the_end_of myData:event_PM_0007_05 ;
    crm:P182_ends_before_or_with_the_start_of myData:event_PM_0007_06
  ] .

myData:event_PM_0007_06 a crm:E6_Destruction ;
  rdfs:label "Broken up at Malta 3.1864"@en ;
  crm:P13_destroyed myData:PM_0007 ;
  crm:P7_took_place_at myData:place_malta ;
  crm:P4_has_time-span [
    a crm:E52_Time-Span ;
    crm:P82_at_some_time_within "1864-03"^^xsd:gYearMonth
  ] .

# --- Data from file: PM_0017.ttl ---


### Places
myData:place_chatham   a crm:E53_Place ; rdfs:label "Chatham"@en .
myData:place_deptford  a crm:E53_Place ; rdfs:label "Deptford"@en .
myData:place_dover     a crm:E53_Place ; rdfs:label "Dover"@en .
myData:place_woolwich  a crm:E53_Place ; rdfs:label "Woolwich"@en .
myData:place_devonport a crm:E53_Place ; rdfs:label "Devonport"@en .

### Ship Roles (ad hoc instances based on text)
:MailPacket a :ShipRole ; rdfs:label "Mail Packet"@en .
:Tender     a :ShipRole ; rdfs:label "Tender"@en .
:Yacht      a :ShipRole ; rdfs:label "Yacht"@en .
:Flagship   a :ShipRole ; rdfs:label "Flagship"@en .

### Ship
myData:PM_0017 a sealit:Ship ;
  rdfs:label "HMS Vivid"@en ;
  :has_propulsion_type :PaddleWheel ;
  :has_ship_type :PaddleMisc ;
  dcterms:source "Winfield, Rif. British Warships in the Age of Sail, 1817-1863. Seaforth Publishing, 2014."@en .

### Career Events and Presences

# 1. Construction
myData:event_PM_0017_01 a crm:E12_Production ;
  rdfs:label "Construction of HMS Vivid"@en ;
  rdfs:comment "Ord: 4.2.1847 (named 13.2.1847). K: 5.1.1847. L: 7.2.1848."@en ;
  crm:P7_took_place_at myData:place_chatham ;
  crm:P4_has_time-span [
    a crm:E52_Time-Span ;
    crm:P79_beginning_is_qualified_by "1847-02-04"^^xsd:date ; # Ord
    crm:P80_end_is_qualified_by "1848-02-07"^^xsd:date   # L
  ] .

# 2. Commissioning for Mail Packet Service
myData:event_PM_0017_02 a :Commissioning ;
  rdfs:label "Commissioned 2.1848 for mail packet service at Dover"@en ;
  rdfs:comment "Completed 7.4.1848 at Chatham after machinery fitted at Deptford."@en ;
  crm:P7_took_place_at myData:place_chatham, myData:place_deptford, myData:place_dover ;
  crm:P4_has_time-span [
    a crm:E52_Time-Span ;
    crm:P79_beginning_is_qualified_by "1848-02"^^xsd:gYearMonth ;
    crm:P80_end_is_qualified_by "1848-04-07"^^xsd:date # C
  ] .

myData:presence_PM_0017_01 a crm:E93_Presence ;
  rdfs:label "In mail packet service at Dover (4.1848-5.1854)"@en ;
  crm:P195i_had_presence myData:PM_0017 ;
  :has_operational_status :InCommission ;
  :has_propulsion_type :PaddleWheel ;
  :has_ship_role :MailPacket ;
  crm:P167_was_within myData:place_dover ;
  crm:P164_is_temporally_specified_by [
    a crm:E52_Time-Span ;
    crm:P182i_starts_after_or_with_the_end_of myData:event_PM_0017_02 ;
    crm:P182_ends_before_or_with_the_start_of myData:event_PM_0017_03
  ] .

# 3. Recommissioned as Tender at Woolwich
myData:event_PM_0017_03 a :Recommissioning ;
  rdfs:label "Recommissioned in 5.1854 as tender to Fisguard at Woolwich"@en ;
  crm:P7_took_place_at myData:place_woolwich ;
  crm:P4_has_time-span [
    a crm:E52_Time-Span ;
    crm:P82_at_some_time_within "1854-05"^^xsd:gYearMonth
  ] .

myData:presence_PM_0017_02 a crm:E93_Presence ;
  rdfs:label "As tender at Woolwich (5.1854-2.1865)"@en ;
  crm:P195i_had_presence myData:PM_0017 ;
  :has_operational_status :InNonCombatDuty ;
  :has_propulsion_type :PaddleWheel ;
  :has_ship_role :Tender ;
  crm:P167_was_within myData:place_woolwich ;
  crm:P164_is_temporally_specified_by [
    a crm:E52_Time-Span ;
    crm:P182i_starts_after_or_with_the_end_of myData:event_PM_0017_03 ;
    crm:P182_ends_before_or_with_the_start_of myData:event_PM_0017_04
  ] .

# 4. Continue service as Tender at Woolwich
myData:event_PM_0017_04 a :Recommissioning ;
  rdfs:label "Recommissioned in 2.1865 for same service at Woolwich"@en ;
  crm:P7_took_place_at myData:place_woolwich ;
  crm:P4_has_time-span [
    a crm:E52_Time-Span ;
    crm:P82_at_some_time_within "1865-02"^^xsd:gYearMonth
  ] .

myData:presence_PM_0017_03 a crm:E93_Presence ;
  rdfs:label "As tender at Woolwich (2.1865-10.1872)"@en ;
  crm:P195i_had_presence myData:PM_0017 ;
  :has_operational_status :InNonCombatDuty ;
  :has_propulsion_type :PaddleWheel ;
  :has_ship_role :Tender ;
  crm:P167_was_within myData:place_woolwich ;
  crm:P164_is_temporally_specified_by [
    a crm:E52_Time-Span ;
    crm:P182i_starts_after_or_with_the_end_of myData:event_PM_0017_04 ;
    crm:P182_ends_before_or_with_the_start_of myData:event_PM_0017_05
  ] .

# 5. Recommissioned as Tender and Yacht at Devonport
myData:event_PM_0017_05 a :Recommissioning ;
  rdfs:label "Recommissioned 10.1872 as tender to Royal Adelaide and Port Admiral's yacht at Devonport"@en ;
  crm:P7_took_place_at myData:place_devonport ;
  crm:P4_has_time-span [
    a crm:E52_Time-Span ;
    crm:P82_at_some_time_within "1872-10"^^xsd:gYearMonth
  ] .

myData:presence_PM_0017_04 a crm:E93_Presence ;
  rdfs:label "As tender and yacht at Devonport (10.1872-11.1878)"@en ;
  crm:P195i_had_presence myData:PM_0017 ;
  :has_operational_status :InNonCombatDuty ;
  :has_propulsion_type :PaddleWheel ;
  :has_ship_role :Tender, :Yacht ;
  crm:P167_was_within myData:place_devonport ;
  crm:P164_is_temporally_specified_by [
    a crm:E52_Time-Span ;
    crm:P182i_starts_after_or_with_the_end_of myData:event_PM_0017_05 ;
    crm:P182_ends_before_or_with_the_start_of myData:event_PM_0017_06
  ] .

# 6. Continue service as Tender at Devonport
myData:event_PM_0017_06 a :Recommissioning ;
  rdfs:label "Recommissioned 11.1878 for same service at Devonport"@en ;
  crm:P7_took_place_at myData:place_devonport ;
  crm:P4_has_time-span [
    a crm:E52_Time-Span ;
    crm:P82_at_some_time_within "1878-11"^^xsd:gYearMonth
  ] .

myData:presence_PM_0017_05 a crm:E93_Presence ;
  rdfs:label "As tender at Devonport (11.1878-8.1882)"@en ;
  crm:P195i_had_presence myData:PM_0017 ;
  :has_operational_status :InNonCombatDuty ;
  :has_propulsion_type :PaddleWheel ;
  :has_ship_role :Tender ;
  crm:P167_was_within myData:place_devonport ;
  crm:P164_is_temporally_specified_by [
    a crm:E52_Time-Span ;
    crm:P182i_starts_after_or_with_the_end_of myData:event_PM_0017_06 ;
    crm:P182_ends_before_or_with_the_start_of myData:event_PM_0017_07
  ] .

# 7. Recommissioned as Tender at Devonport
myData:event_PM_0017_07 a :Recommissioning ;
  rdfs:label "Recommissioned 14.8.1882 as tender to Royal Albert"@en ;
  crm:P7_took_place_at myData:place_devonport ;
  crm:P4_has_time-span [
    a crm:E52_Time-Span ;
    crm:P82_at_some_time_within "1882-08-14"^^xsd:date
  ] .

myData:presence_PM_0017_06 a crm:E93_Presence ;
  rdfs:label "As tender at Devonport (8.1882-10.1888)"@en ;
  crm:P195i_had_presence myData:PM_0017 ;
  :has_operational_status :InNonCombatDuty ;
  :has_propulsion_type :PaddleWheel ;
  :has_ship_role :Tender ;
  crm:P167_was_within myData:place_devonport ;
  crm:P164_is_temporally_specified_by [
    a crm:E52_Time-Span ;
    crm:P182i_starts_after_or_with_the_end_of myData:event_PM_0017_07 ;
    crm:P182_ends_before_or_with_the_start_of myData:event_PM_0017_08
  ] .

# 8. Recommissioned as Flagship at Devonport
myData:event_PM_0017_08 a :Recommissioning ;
  rdfs:label "Recommissioned 8.10.1888, becoming flagship from 11.1888 at Devonport"@en ;
  crm:P7_took_place_at myData:place_devonport ;
  crm:P4_has_time-span [
    a crm:E52_Time-Span ;
    crm:P82_at_some_time_within "1888-10-08"^^xsd:date
  ] .

myData:presence_PM_0017_07 a crm:E93_Presence ;
  rdfs:label "As flagship at Devonport (10.1888-5.1894)"@en ;
  crm:P195i_had_presence myData:PM_0017 ;
  :has_operational_status :InNonCombatDuty ;
  :has_propulsion_type :PaddleWheel ;
  :has_ship_role :Flagship ;
  crm:P167_was_within myData:place_devonport ;
  crm:P164_is_temporally_specified_by [
    a crm:E52_Time-Span ;
    crm:P182i_starts_after_or_with_the_end_of myData:event_PM_0017_08 ;
    crm:P182_ends_before_or_with_the_start_of myData:event_PM_0017_09
  ] .

# 9. End of Career: Sale
myData:event_PM_0017_09 a crm:E8_Acquisition ;
  rdfs:label "Sold to G. Cowen & Sons in 5.1894"@en ;
  crm:P4_has_time-span [
    a crm:E52_Time-Span ;
    crm:P82_at_some_time_within "1894-05"^^xsd:gYearMonth
  ] .

# --- Data from file: PM_0025.ttl ---


### Places
myData:place_portsmouth a crm:E53_Place ; rdfs:label "Portsmouth"@en .
myData:place_channel a crm:E53_Place ; rdfs:label "Channel Squadron"@en .
myData:place_mediterranean a crm:E53_Place ; rdfs:label "Mediterranean"@en .
myData:place_suez a crm:E53_Place ; rdfs:label "Suez"@en .
myData:place_nile a crm:E53_Place ; rdfs:label "Nile"@en .
myData:place_woolwich a crm:E53_Place ; rdfs:label "Woolwich"@en .
myData:place_sunderland a crm:E53_Place ; rdfs:label "Sunderland"@en .

### Ship
myData:PM_0025 a sealit:Ship ;
  rdfs:label "HMS Helicon"@en ;
  :has_propulsion_type :PaddleWheel ;
  :has_ship_type :PaddleMisc ;
  dcterms:source "Winfield, Rif. British Warships in the Age of Sail, 1817-1863. Seaforth Publishing, 2014."@en .

### Construction and Commissioning
myData:event_PM_0025_01 a crm:E12_Production ;
  rdfs:label "As built: 220ft 0in, about 197ft 0in x 28ft 3in x 14ft 6in. 837bm. 945 disp."@en ;
  crm:P4_has_time-span [
    a crm:E52_Time-Span ;
    crm:P79_beginning_is_qualified_by "1861-05-30"^^xsd:date ; # Keel laid
    crm:P80_end_is_qualified_by "1865-01-31"^^xsd:date # Launched
  ] .

myData:presence_PM_0025_01 a crm:E93_Presence ;
  rdfs:label "[Assumption] Under fitting between launch and commissioning"@en ;
  crm:P195i_had_presence myData:PM_0025 ;
  :has_operational_status :UnderFitting ;
  :has_propulsion_type :PaddleWheel ;
  :has_ship_type :PaddleMisc ;
  crm:P167_was_within myData:place_portsmouth ;
  crm:P164_is_temporally_specified_by [
    a crm:E52_Time-Span ;
    crm:P182i_starts_after_or_with_the_end_of myData:event_PM_0025_01 ;
    crm:P182_ends_before_or_with_the_start_of myData:event_PM_0025_02
  ] .

myData:event_PM_0025_02 a :Commissioning ;
  rdfs:label "Commissioned 9.1865 for the Channel Squadron"@en ;
  crm:P4_has_time-span [
    a crm:E52_Time-Span ;
    crm:P82_at_some_time_within "1865-09"^^xsd:gYearMonth
  ] .

### Service Periods
myData:presence_PM_0025_02 a crm:E93_Presence ;
  rdfs:label "In Commission for Channel Squadron, Mediterranean, and Suez patrol (9.1865-1887)"@en ;
  crm:P195i_had_presence myData:PM_0025 ;
  :has_operational_status :InCommission ;
  :has_propulsion_type :PaddleWheel ;
  :has_ship_type :PaddleMisc ;
  crm:P167_was_within myData:place_channel, myData:place_mediterranean, myData:place_suez, myData:place_nile ;
  crm:P164_is_temporally_specified_by [
    a crm:E52_Time-Span ;
    crm:P182i_starts_after_or_with_the_end_of myData:event_PM_0025_02 ;
    crm:P182_ends_before_or_with_the_start_of myData:event_PM_0025_03
  ] .

### Repair and Refit
myData:event_PM_0025_03 a :Refit ;
  rdfs:label "Repair and refit at Woolwich 1887"@en ;
  :modifies_ship myData:PM_0025 ;
  crm:P7_took_place_at myData:place_woolwich ;
  crm:P4_has_time-span [
    a crm:E52_Time-Span ;
    crm:P82_at_some_time_within "1887"^^xsd:gYear
  ] ;
  crm:P21_had_general_purpose :CombatCapabilityInvestment .

myData:presence_PM_0025_03 a crm:E93_Presence ;
  rdfs:label "Under repair and refit at Woolwich (1887)"@en ;
  crm:P195i_had_presence myData:PM_0025 ;
  :has_operational_status :UnderRepair ;
  :has_propulsion_type :PaddleWheel ;
  :has_ship_type :PaddleMisc ;
  crm:P167_was_within myData:place_woolwich ;
  crm:P164_is_temporally_specified_by [
    a crm:E52_Time-Span ;
    crm:P82_at_some_time_within "1887"^^xsd:gYear
  ] .

myData:presence_PM_0025_04 a crm:E93_Presence ;
  rdfs:label "[Assumption] In Ordinary after refit and before recommissioning"@en ;
  crm:P195i_had_presence myData:PM_0025 ;
  :has_operational_status :InOrdinary ;
  :has_propulsion_type :PaddleWheel ;
  :has_ship_type :PaddleMisc ;
  crm:P167_was_within myData:place_woolwich ;
  crm:P164_is_temporally_specified_by [
    a crm:E52_Time-Span ;
    crm:P182i_starts_after_or_with_the_end_of myData:event_PM_0025_03 ;
    crm:P182_ends_before_or_with_the_start_of myData:event_PM_0025_04
  ] .

### Renaming and Later Service
myData:event_PM_0025_04 a crm:E13_Attribute_Assignment ;
  rdfs:label "Renamed Enchantress 1.4.1888"@en ;
  crm:P140_assigned_attribute_to myData:PM_0025 ;
  crm:P141_assigned [ a crm:E41_E55_Type_Appellation ; rdfs:label "Enchantress"@en ] ;
  crm:P4_has_time-span [
    a crm:E52_Time-Span ;
    crm:P82_at_some_time_within "1888-04-01"^^xsd:date
  ] .

myData:event_PM_0025_05 a :Recommissioning ;
  rdfs:label "Recommissioned as tender at Portsmouth 1.4.1888"@en ;
  crm:P4_has_time-span [
    a crm:E52_Time-Span ;
    crm:P82_at_some_time_within "1888-04-01"^^xsd:date
  ] .

myData:presence_PM_0025_05 a crm:E93_Presence ;
  rdfs:label "In non-combat duty as tender at Portsmouth (1.4.1888-11.7.1905)"@en ;
  crm:P195i_had_presence myData:PM_0025 ;
  :has_operational_status :InNonCombatDuty ;
  :has_propulsion_type :PaddleWheel ;
  :has_ship_role :Tender ;
  crm:P167_was_within myData:place_portsmouth ;
  crm:P164_is_temporally_specified_by [
    a crm:E52_Time-Span ;
    crm:P182i_starts_after_or_with_the_end_of myData:event_PM_0025_05 ;
    crm:P182_ends_before_or_with_the_start_of myData:event_PM_0025_06
  ] .

### End of Career
myData:event_PM_0025_06 a crm:E6_Destruction ;
  rdfs:label "Sold to Laidler, Sunderland 11.7.1905"@en ;
  rdfs:comment "The sale of the ship marks the end of its naval career, modeled as a Destruction event in this context."@en ;
  crm:P13_destroyed myData:PM_0025 ;
  crm:P7_took_place_at myData:place_sunderland ;
  crm:P4_has_time-span [
    a crm:E52_Time-Span ;
    crm:P82_at_some_time_within "1905-07-11"^^xsd:date
  ] .

# --- Data from file: PM_0028.ttl ---


### Places
myData:place_devenport a crm:E53_Place ; rdfs:label "Devenport"@en .
myData:place_china a crm:E53_Place ; rdfs:label "China"@en .
myData:place_hong_kong a crm:E53_Place ; rdfs:label "Hong Kong"@en .

### Ship Roles
myData:role_admiralty_board_yacht a :ShipRole ; rdfs:label "Admiralty Board yacht"@en .

### Ship
myData:PM_0028 a sealit:Ship ;
  rdfs:label "HMS Vigilant"@en ;
  :has_propulsion_type :PaddleWheel ;
  :has_ship_type :PaddleMisc ;
  dcterms:source "Winfield, Rif. British Warships in the Age of Sail, 1817-1863. Seaforth Publishing, 2014."@en .

### Career Events and Presences

# Construction (Anchor Start)
myData:event_PM_0028_01 a crm:E12_Production ;
  rdfs:label "Built at Devenport Dyd/James Watt & Co. (1,815ihp = 13.2kts). As built: 220ft 0in, 200ft 33/ain x 28ft 2in (28ft 0in for tonnage) x 28ft 3in x 14ft 6in. 83521!94bm. 951 disp. L: 17.2.1871."@en ;
  crm:P7_took_place_at myData:place_devenport ;
  crm:P4_has_time-span [
    a crm:E52_Time-Span ;
    crm:P79_beginning_is_qualified_by "1870-04-11"^^xsd:date ; # K: Keel laid
    crm:P80_end_is_qualified_by "1871-12"^^xsd:gYearMonth # C: Completed
  ] .

# Initial fitting period
myData:presence_PM_0028_01 a crm:E93_Presence ;
  rdfs:label "[Assumption] Under fitting after completion and before first commissioning"@en ;
  crm:P195i_had_presence myData:PM_0028 ;
  :has_operational_status :UnderFitting ;
  crm:P164_is_temporally_specified_by [ a crm:E52_Time-Span ;
    crm:P182i_starts_after_or_with_the_end_of myData:event_PM_0028_01 ;
    crm:P182_ends_before_or_with_the_start_of myData:event_PM_0028_02 ] .

# First commission
myData:event_PM_0028_02 a :Commissioning ;
  rdfs:label "Commissioned 3.1.1872 under Cmdr Edward Hobart Seymour"@en ;
  crm:P4_has_time-span [ a crm:E52_Time-Span ; crm:P82_at_some_time_within "1872-01-03"^^xsd:date ] .

myData:event_PM_0028_03 a :Decommissioning ;
  rdfs:label "Paid off 14.5.1872"@en ;
  crm:P4_has_time-span [ a crm:E52_Time-Span ; crm:P82_at_some_time_within "1872-05-14"^^xsd:date ] .

myData:presence_PM_0028_02 a crm:E93_Presence ;
  rdfs:label "In commission (3.1.1872 - 14.5.1872)"@en ;
  crm:P195i_had_presence myData:PM_0028 ;
  :has_operational_status :InCommission ;
  crm:P164_is_temporally_specified_by [ a crm:E52_Time-Span ;
    crm:P182i_starts_after_or_with_the_end_of myData:event_PM_0028_02 ;
    crm:P182_ends_before_or_with_the_start_of myData:event_PM_0028_03 ] .

# Second commission (as yacht)
myData:event_PM_0028_04 a :Recommissioning ;
  rdfs:label "Recommissioned 30.6.1872 as temporary Admiralty Board yacht"@en ;
  crm:P4_has_time-span [ a crm:E52_Time-Span ; crm:P82_at_some_time_within "1872-06-30"^^xsd:date ] .

myData:presence_PM_0028_03 a crm:E93_Presence ;
  rdfs:label "Paid off (14.5.1872 - 30.6.1872)"@en ;
  crm:P195i_had_presence myData:PM_0028 ;
  :has_operational_status :PaidOff ;
  crm:P164_is_temporally_specified_by [ a crm:E52_Time-Span ;
    crm:P182i_starts_after_or_with_the_end_of myData:event_PM_0028_03 ;
    crm:P182_ends_before_or_with_the_start_of myData:event_PM_0028_04 ] .

myData:event_PM_0028_05 a :Commissioning ;
  rdfs:label "On 14.1.1873 under Staff Cmdr Robert L. Cleveland"@en ;
  crm:P4_has_time-span [ a crm:E52_Time-Span ; crm:P82_at_some_time_within "1873-01-14"^^xsd:date ] .

myData:event_PM_0028_06 a :Decommissioning ;
  rdfs:label "Paid off 30.6.1874"@en ;
  crm:P4_has_time-span [ a crm:E52_Time-Span ; crm:P82_at_some_time_within "1874-06-30"^^xsd:date ] .

myData:presence_PM_0028_04 a crm:E93_Presence ;
  rdfs:label "As temporary Admiralty Board yacht (30.6.1872 - 30.6.1874)"@en ;
  crm:P195i_had_presence myData:PM_0028 ;
  :has_operational_status :InNonCombatDuty ;
  :has_ship_role myData:role_admiralty_board_yacht ;
  crm:P164_is_temporally_specified_by [ a crm:E52_Time-Span ;
    crm:P182i_starts_after_or_with_the_end_of myData:event_PM_0028_04 ;
    crm:P182_ends_before_or_with_the_start_of myData:event_PM_0028_06 ] .

# Third commission (China)
myData:event_PM_0028_07 a :Recommissioning ;
  rdfs:label "Recommissioned 1.9.1874 for China"@en ;
  crm:P4_has_time-span [ a crm:E52_Time-Span ; crm:P82_at_some_time_within "1874-09-01"^^xsd:date ] .

myData:presence_PM_0028_05 a crm:E93_Presence ;
  rdfs:label "Paid off (30.6.1874 - 1.9.1874)"@en ;
  crm:P195i_had_presence myData:PM_0028 ;
  :has_operational_status :PaidOff ;
  crm:P164_is_temporally_specified_by [ a crm:E52_Time-Span ;
    crm:P182i_starts_after_or_with_the_end_of myData:event_PM_0028_06 ;
    crm:P182_ends_before_or_with_the_start_of myData:event_PM_0028_07 ] .

myData:event_PM_0028_08 a :Commissioning ;
  rdfs:label "In 9.1877 under Cmdr William Martin Annesley, still in China"@en ;
  crm:P4_has_time-span [ a crm:E52_Time-Span ; crm:P82_at_some_time_within "1877-09"^^xsd:gYearMonth ] .

myData:event_PM_0028_09 a :Decommissioning ;
  rdfs:label "Paid off 1880"@en ;
  crm:P4_has_time-span [ a crm:E52_Time-Span ; crm:P82_at_some_time_within "1880"^^xsd:gYear ] .

myData:presence_PM_0028_06 a crm:E93_Presence ;
  rdfs:label "In commission in China (1.9.1874 - 1880)"@en ;
  crm:P195i_had_presence myData:PM_0028 ;
  :has_operational_status :InCommission ;
  crm:P167_was_within myData:place_china ;
  crm:P164_is_temporally_specified_by [ a crm:E52_Time-Span ;
    crm:P182i_starts_after_or_with_the_end_of myData:event_PM_0028_07 ;
    crm:P182_ends_before_or_with_the_start_of myData:event_PM_0028_09 ] .

# Fourth commission (Hong Kong)
myData:event_PM_0028_10 a :Recommissioning ;
  rdfs:label "Recommissioned 8.1884 at Hong Kong under Lieut Peyton Hoskyns"@en ;
  crm:P7_took_place_at myData:place_hong_kong ;
  crm:P4_has_time-span [ a crm:E52_Time-Span ; crm:P82_at_some_time_within "1884-08"^^xsd:gYearMonth ] .

myData:presence_PM_0028_07 a crm:E93_Presence ;
  rdfs:label "Paid off (1880 - 8.1884)"@en ;
  crm:P195i_had_presence myData:PM_0028 ;
  :has_operational_status :PaidOff ;
  crm:P167_was_within myData:place_hong_kong ;
  crm:P164_is_temporally_specified_by [ a crm:E52_Time-Span ;
    crm:P182i_starts_after_or_with_the_end_of myData:event_PM_0028_09 ;
    crm:P182_ends_before_or_with_the_start_of myData:event_PM_0028_10 ] .

# Sale (Anchor End)
myData:event_PM_0028_11 a crm:E8_Acquisition ;
  rdfs:label "Sold 7.10.1886 at Hong Kong"@en ;
  crm:P7_took_place_at myData:place_hong_kong ;
  crm:P4_has_time-span [ a crm:E52_Time-Span ; crm:P82_at_some_time_within "1886-10-07"^^xsd:date ] .

myData:presence_PM_0028_08 a crm:E93_Presence ;
  rdfs:label "In commission at Hong Kong (8.1884 - 7.10.1886)"@en ;
  crm:P195i_had_presence myData:PM_0028 ;
  :has_operational_status :InCommission ;
  crm:P167_was_within myData:place_hong_kong ;
  crm:P164_is_temporally_specified_by [ a crm:E52_Time-Span ;
    crm:P182i_starts_after_or_with_the_end_of myData:event_PM_0028_10 ;
    crm:P182_ends_before_or_with_the_start_of myData:event_PM_0028_11 ] .

# --- Data from file: PM_0032.ttl ---


### Places
myData:place_pembroke_dyd a crm:E53_Place ;
  rdfs:label "Pembroke Dyd"@en .
myData:place_portsmouth a crm:E53_Place ;
  rdfs:label "Portsmouth"@en .

### Ship
myData:PM_0032 a sealit:Ship ;
  rdfs:label "HMS Alberta"@en ;
  :has_propulsion_type :PaddleWheel ;
  :has_ship_type :PaddleMisc ;
  dcterms:source "Winfield, Rif. British Warships in the Age of Sail, 1817-1863. Seaforth Publishing, 2014."@en .

### Career Events and Presences

# Construction
myData:event_PM_0032_01 a crm:E12_Production ;
  rdfs:label "Construction at Pembroke Dyd"@en ;
  crm:P7_took_place_at myData:place_pembroke_dyd ;
  crm:P4_has_time-span [
    a crm:E52_Time-Span ;
    crm:P79_beginning_is_qualified_by "1863"^^xsd:gYear ; # Ord
    crm:P80_end_is_qualified_by "1863-10-03"^^xsd:date   # L
  ] .

# Commissioning Events
myData:event_PM_0032_02 a :Commissioning ;
  rdfs:label "Commissioned 20.8.1864 under Staff Cmdr David Nairne Welch"@en ;
  crm:P4_has_time-span [
    a crm:E52_Time-Span ;
    crm:P82_at_some_time_within "1864-08-20"^^xsd:date
  ] .

myData:event_PM_0032_03 a :Commissioning ;
  rdfs:label "On 1.4.1878 under Capt. Alfred Balliston"@en ;
  crm:P4_has_time-span [
    a crm:E52_Time-Span ;
    crm:P82_at_some_time_within "1878-04-01"^^xsd:date
  ] .

myData:event_PM_0032_04 a :Commissioning ;
  rdfs:label "On 12.7.1883 under Capt. William Burgess Goldsmith"@en ;
  crm:P4_has_time-span [
    a crm:E52_Time-Span ;
    crm:P82_at_some_time_within "1883-07-12"^^xsd:date
  ] .

myData:event_PM_0032_05 a :Commissioning ;
  rdfs:label "On 14.10.1897 under Capt. (retd) George Alexander Broad"@en ;
  crm:P4_has_time-span [
    a crm:E52_Time-Span ;
    crm:P82_at_some_time_within "1897-10-14"^^xsd:date
  ] .

# Other Events
myData:event_PM_0032_06 a crm:E7_Activity ;
  rdfs:label "Damaged in collision with Mistletoe"@en ;
  crm:P4_has_time-span [
    a crm:E52_Time-Span ;
    crm:P82_at_some_time_within "1875"^^xsd:gYear
  ] .

# Destruction (End of Career)
myData:event_PM_0032_07 a crm:E6_Destruction ;
  rdfs:label "Broken up at Portsmouth"@en ;
  crm:P13_destroyed myData:PM_0032 ;
  crm:P7_took_place_at myData:place_portsmouth ;
  crm:P4_has_time-span [
    a crm:E52_Time-Span ;
    crm:P82_at_some_time_within "1912"^^xsd:gYear
  ] .

# Presences covering the entire career timeline

myData:presence_PM_0032_01 a crm:E93_Presence ;
  rdfs:label "[Assumption] Under fitting between launch and commissioning"@en ;
  crm:P195i_had_presence myData:PM_0032 ;
  :has_operational_status :UnderFitting ;
  crm:P167_was_within myData:place_pembroke_dyd ;
  crm:P164_is_temporally_specified_by [
    a crm:E52_Time-Span ;
    crm:P182i_starts_after_or_with_the_end_of myData:event_PM_0032_01 ;
    crm:P182_ends_before_or_with_the_start_of myData:event_PM_0032_02
  ] .

myData:presence_PM_0032_02 a crm:E93_Presence ;
  rdfs:label "In commission from 20.8.1864 until being broken up in 1912"@en ;
  crm:P195i_had_presence myData:PM_0032 ;
  :has_operational_status :InCommission ;
  crm:P164_is_temporally_specified_by [
    a crm:E52_Time-Span ;
    crm:P182i_starts_after_or_with_the_end_of myData:event_PM_0032_02 ;
    crm:P182_ends_before_or_with_the_start_of myData:event_PM_0032_07
  ] .

# --- Data from file: PM_0053.ttl ---


### Places
myData:place_north_shields a crm:E53_Place ;
  rdfs:label "North Shields"@en .
myData:place_constantinople a crm:E53_Place ;
  rdfs:label "Constantinople"@en .

### Ship Roles
:PaddleTug a :ShipRole ;
  rdfs:label "Paddle Tug"@en .

### Ship
myData:PM_0053 a sealit:Ship ;
  rdfs:label "LANDRAIL (ex-Gipsy Queen)"@en ;
  rdfs:comment "Wooden paddle tug of 50nhp."@en ;
  :has_propulsion_type :PaddleWheel ;
  :has_ship_type :PaddleMisc ;
  dcterms:source "Winfield, Rif. British Warships in the Age of Sail, 1817-1863. Seaforth Publishing, 2014."@en .

### Career Events and Presences

# Production as a mercantile vessel, serving as the physical starting point.
myData:event_PM_0053_01 a crm:E12_Production ;
  rdfs:label "Built as mercantile Gipsy Queen at North Shields 1854"@en ;
  crm:P7_took_place_at myData:place_north_shields ;
  crm:P4_has_time-span [
    a crm:E52_Time-Span ;
    crm:P82_at_some_time_within "1854"^^xsd:gYear
  ] .

# The Royal Navy career starts with its purchase.
myData:event_PM_0053_02 a crm:E8_Acquisition ;
  rdfs:label "Purchased on 24 May 1855 at Constantinople for £7,500"@en ;
  :modifies_ship myData:PM_0053 ;
  crm:P7_took_place_at myData:place_constantinople ;
  crm:P4_has_time-span [
    a crm:E52_Time-Span ;
    crm:P82_at_some_time_within "1855-05-24"^^xsd:date
  ] ;
  :incurred_cost [
    a crm:E97_Monetary_Amount ;
    rdfs:comment "£7,500"@en ;
    crm:P90_has_value "7500.0"^^xsd:decimal
  ] ;
  crm:P21_had_general_purpose :NonCombatDutyInvestment .

# The Royal Navy career ends with its sale.
myData:event_PM_0053_03 a crm:E8_Acquisition ;
  rdfs:label "Sold on 21 July 1856 at Constantinople to J.Parry for £2,400"@en ;
  rdfs:comment "This event marks the end of the ship's career in the Royal Navy."@en ;
  :modifies_ship myData:PM_0053 ;
  crm:P7_took_place_at myData:place_constantinople ;
  crm:P4_has_time-span [
    a crm:E52_Time-Span ;
    crm:P82_at_some_time_within "1856-07-21"^^xsd:date
  ] .

# Presence covering the entire service period in the Royal Navy.
myData:presence_PM_0053_01 a crm:E93_Presence ;
  rdfs:label "In service with the Royal Navy as a paddle tug"@en ;
  crm:P195i_had_presence myData:PM_0053 ;
  :has_operational_status :InNonCombatDuty ;
  :has_ship_role :PaddleTug ;
  :has_propulsion_type :PaddleWheel ;
  crm:P167_was_within myData:place_constantinople ;
  crm:P164_is_temporally_specified_by [
    a crm:E52_Time-Span ;
    crm:P182i_starts_after_or_with_the_end_of myData:event_PM_0053_02 ;
    crm:P182_ends_before_or_with_the_start_of myData:event_PM_0053_03
  ] .

# --- Data from file: PM_0061.ttl ---


### Places
myData:place_malta a crm:E53_Place ;
  rdfs:label "Malta"@en .
myData:place_portsmouth a crm:E53_Place ;
  rdfs:label "Portsmouth"@en .

### Ship Roles
myData:role_tug a :ShipRole ;
  rdfs:label "Tug"@en .

### Ship
myData:PM_0061 a sealit:Ship ;
  rdfs:label "HMS Wallace"@en ;
  rdfs:comment "Ex-mercantile, possibly Lyons, built 1854 by J. Scott Russell, Millwall. Iron-hulled paddle tug of 100nhp."@en ;
  :has_propulsion_type :PaddleWheel ;
  :has_ship_type :PaddleMisc ;
  dcterms:source "Winfield, Rif. British Warships in the Age of Sail, 1817-1863. Seaforth Publishing, 2014."@en .

### Events and Presences

# Production as a mercantile ship (Anchor for 'age' calculation)
myData:event_PM_0061_01 a crm:E12_Production ;
  rdfs:label "Built 1854"@en ;
  rdfs:comment "Possibly the mercantile 'Lyons' built by J. Scott Russell, Millwall."@en ;
  crm:P4_has_time-span [
    a crm:E52_Time-Span ;
    crm:P82_at_some_time_within "1854"^^xsd:gYear
  ] .

# Purchase by the Royal Navy (Start of naval career)
myData:event_PM_0061_02 a crm:E8_Acquisition ;
  rdfs:label "Purchased for £9,500 by Admiral Lyons in July 1855"@en ;
  rdfs:comment "Purchased at Malta?"@en ;
  crm:P7_took_place_at myData:place_malta ;
  crm:P4_has_time-span [
    a crm:E52_Time-Span ;
    crm:P82_at_some_time_within "1855-07"^^xsd:gYearMonth
  ] ;
  :incurred_cost [
    a crm:E97_Monetary_Amount ;
    rdfs:comment "£9,500"@en ;
    crm:P90_has_value "9500.0"^^xsd:decimal
  ] ;
  crm:P21_had_general_purpose :CombatCapabilityInvestment .

# Presence after purchase, before transfer to Portsmouth
myData:presence_PM_0061_01 a crm:E93_Presence ;
  rdfs:label "Service after purchase (at Malta?)"@en ;
  crm:P195i_had_presence myData:PM_0061 ;
  :has_operational_status :InCommission ;
  :has_propulsion_type :PaddleWheel ;
  :has_ship_type :PaddleMisc ;
  crm:P7_took_place_at myData:place_malta ;
  crm:P164_is_temporally_specified_by [
    a crm:E52_Time-Span ;
    crm:P182i_starts_after_or_with_the_end_of myData:event_PM_0061_02 ;
    crm:P182_ends_before_or_with_the_start_of myData:event_PM_0061_03
  ] .

# Event to delineate change in status/location
myData:event_PM_0061_03 a crm:E7_Activity ;
  rdfs:label "Transferred to Portsmouth 1857"@en ;
  crm:P7_took_place_at myData:place_portsmouth ;
  crm:P4_has_time-span [
    a crm:E52_Time-Span ;
    crm:P82_at_some_time_within "1857"^^xsd:gYear
  ] .

# Presence at Portsmouth
myData:presence_PM_0061_02 a crm:E93_Presence ;
  rdfs:label "Attached to the Clarence Victualling Yard at Portsmouth"@en ;
  crm:P195i_had_presence myData:PM_0061 ;
  :has_operational_status :InNonCombatDuty ;
  :has_propulsion_type :PaddleWheel ;
  :has_ship_role myData:role_tug ;
  crm:P7_took_place_at myData:place_portsmouth ;
  crm:P164_is_temporally_specified_by [
    a crm:E52_Time-Span ;
    crm:P182i_starts_after_or_with_the_end_of myData:event_PM_0061_03 ;
    crm:P182_ends_before_or_with_the_start_of myData:event_PM_0061_04
  ] .

# Sale (End of naval career)
myData:event_PM_0061_04 a crm:E8_Acquisition ;
  rdfs:label "Sold 1869"@en ;
  crm:P4_has_time-span [
    a crm:E52_Time-Span ;
    crm:P82_at_some_time_within "1869"^^xsd:gYear
  ] .

# --- Data from file: PM_0063.ttl ---


### Places
myData:place_newcastle a crm:E53_Place ;
  rdfs:label "Newcastle"@en .
myData:place_malta a crm:E53_Place ;
  rdfs:label "Malta"@en .

### Ship Roles
:Tug a :ShipRole ;
  rdfs:label "Tug"@en .

### Ship
myData:PM_0063 a sealit:Ship ;
  rdfs:label "DRAGON"@en ;
  rdfs:comment "ex-mercantile Dragon. Wooden paddle tug of 40nhp. Dimensions & tons: 85ft 0in, 74ft 10¾in x 16ft 10in x 8ft ?in. 113bm."@en ;
  :has_propulsion_type :PaddleWheel ;
  :has_ship_type :PaddleMisc ;
  dcterms:source "Winfield, Rif. British Warships in the Age of Sail, 1817-1863. Seaforth Publishing, 2014."@en .

### Career Events and Presences

# Anchor Start Event: Pre-RN Construction
myData:event_PM_0063_01 a crm:E12_Production ;
  rdfs:label "Built as mercantile Dragon"@en ;
  crm:P7_took_place_at myData:place_newcastle ;
  crm:P4_has_time-span [
    a crm:E52_Time-Span ;
    crm:P82_at_some_time_within "1855"^^xsd:gYear
  ] .

# RN Career Start Event: Purchase by the Royal Navy
myData:event_PM_0063_02 a :Purchase ;
  rdfs:label "Purchased at Malta for £1,200 for towing mud barges"@en ;
  :modifies_ship myData:PM_0063 ;
  crm:P7_took_place_at myData:place_malta ;
  crm:P4_has_time-span [
    a crm:E52_Time-Span ;
    crm:P82_at_some_time_within "1860-07-11"^^xsd:date
  ] ;
  :incurred_cost [
    a crm:E97_Monetary_Amount ;
    rdfs:comment "£1,200"@en ;
    crm:P90_has_value "1200.0"^^xsd:decimal
  ] ;
  crm:P21_had_general_purpose :NonCombatDutyInvestment .

# Presence during non-combat duty
myData:presence_PM_0063_01 a crm:E93_Presence ;
  rdfs:label "In non-combat duty as a tug at Malta"@en ;
  crm:P195i_had_presence myData:PM_0063 ;
  :has_operational_status :InNonCombatDuty ;
  :has_propulsion_type :PaddleWheel ;
  :has_ship_role :Tug ;
  crm:P167_was_within myData:place_malta ;
  crm:P164_is_temporally_specified_by [
    a crm:E52_Time-Span ;
    crm:P182i_starts_after_or_with_the_end_of myData:event_PM_0063_02 ;
    crm:P182_ends_before_or_with_the_start_of myData:event_PM_0063_03
  ] .

# Anchor End Event: Sold
myData:event_PM_0063_03 a crm:E8_Acquisition ;
  rdfs:label "Sold"@en ;
  crm:P4_has_time-span [
    a crm:E52_Time-Span ;
    crm:P82_at_some_time_within "1867"^^xsd:gYear
  ] .

# --- Data from file: PM_0068.ttl ---


### Places
myData:place_lake_huron a crm:E53_Place ;
  rdfs:label "Lake Huron"@en .

### Ship
myData:PM_0068 a sealit:Ship ;
  rdfs:label "HMS Experiment"@en ;
  rdfs:comment "As built: 96ft 6in, 86ft 0in x 14ft 6in x 7ft 2½in. 220bm. Men: 40? Guns: 1 x 6pdr brass on pivot + 1 x 12pdr carronade. Machinery: 25nhp."@en ;
  :has_propulsion_type :PaddleWheel ;
  :has_ship_type :PaddleMisc ;
  dcterms:source "Winfield, Rif. British Warships in the Age of Sail, 1817-1863. Seaforth Publishing, 2014."@en .

### Career Events and Presences

# Carrier Start: Purchase and Conversion
myData:event_PM_0068_01 a crm:E12_Production ;
  rdfs:label "Purchased 21 July 1838 and converted to paddle gunboat"@en ;
  crm:P108_has_produced myData:PM_0068 ;
  crm:P4_has_time-span [
    a crm:E52_Time-Span ;
    crm:P79_beginning_is_qualified_by "1838-07-21"^^xsd:date
  ] .

# Commissioning
myData:event_PM_0068_02 a :Commissioning ;
  rdfs:label "Commissioned 18.4.1843 under Lieut James Boxer"@en ;
  crm:P4_has_time-span [
    a crm:E52_Time-Span ;
    crm:P82_at_some_time_within "1843-04-18"^^xsd:date
  ] .

# Presence: Under Conversion/Repair
myData:presence_PM_0068_01 a crm:E93_Presence ;
  rdfs:label "Under conversion to paddle gunboat (1838-1843)"@en ;
  crm:P195i_had_presence myData:PM_0068 ;
  :has_operational_status :UnderRepair ;
  :has_propulsion_type :PaddleWheel ;
  :has_ship_type :PaddleMisc ;
  crm:P164_is_temporally_specified_by [
    a crm:E52_Time-Span ;
    crm:P182i_starts_after_or_with_the_end_of myData:event_PM_0068_01 ;
    crm:P182_ends_before_or_with_the_start_of myData:event_PM_0068_02
  ] .

# Change of Command
myData:event_PM_0068_03 a :Commissioning ;
  rdfs:label "On 16.12.1843 under Lieut James Harper"@en ;
  crm:P4_has_time-span [
    a crm:E52_Time-Span ;
    crm:P82_at_some_time_within "1843-12-16"^^xsd:date
  ] .

# Career End: Sale
myData:event_PM_0068_04 a crm:E8_Acquisition ;
  rdfs:label "Sold 1847 or 1848"@en ;
  crm:P24_transferred_title_of myData:PM_0068 ;
  crm:P4_has_time-span [
    a crm:E52_Time-Span ;
    crm:P79_beginning_is_qualified_by "1847"^^xsd:gYear ;
    crm:P80_end_is_qualified_by "1848"^^xsd:gYear
  ] .

# Presence: In Commission
myData:presence_PM_0068_02 a crm:E93_Presence ;
  rdfs:label "In commission on Lake Huron (1843-1847/8)"@en ;
  crm:P195i_had_presence myData:PM_0068 ;
  :has_operational_status :InCommission ;
  :has_propulsion_type :PaddleWheel ;
  :has_ship_type :PaddleMisc ;
  crm:P167_was_within myData:place_lake_huron ;
  crm:P164_is_temporally_specified_by [
    a crm:E52_Time-Span ;
    crm:P182i_starts_after_or_with_the_end_of myData:event_PM_0068_02 ;
    crm:P182_ends_before_or_with_the_start_of myData:event_PM_0068_04
  ] .

# --- Data from file: PM_0070.ttl ---


### Places
myData:place_lake_erie a crm:E53_Place ;
  rdfs:label "Lake Erie"@en .

myData:place_canada a crm:E53_Place ;
  rdfs:label "Canada"@en .

### Ship
myData:PM_0070 a sealit:Ship ;
  rdfs:label "HMS Montreal"@en ;
  rdfs:comment "A two-masted schooner (perhaps not a paddler)."@en ;
  :has_propulsion_type :PaddleWheel ;
  :has_ship_type :PaddleMisc ;
  dcterms:source "Winfield, Rif. British Warships in the Age of Sail, 1817-1863. Seaforth Publishing, 2014."@en .

### Events
# Career Anchor: Production event for age calculation
myData:event_PM_0070_01 a crm:E12_Production ;
  rdfs:label "Built 1836 in Canada (as mercantile)"@en ;
  crm:P7_took_place_at myData:place_canada ;
  crm:P4_has_time-span [
    a crm:E52_Time-Span ;
    crm:P82_at_some_time_within "1836"^^xsd:gYear
  ] .

# Royal Navy Career starts with Purchase
myData:event_PM_0070_02 a crm:E8_Acquisition ;
  rdfs:label "Purchased 18 October 1839 for use on Lake Erie"@en ;
  crm:P4_has_time-span [
    a crm:E52_Time-Span ;
    crm:P82_at_some_time_within "1839-10-18"^^xsd:date
  ] .

myData:event_PM_0070_03 a :Commissioning ;
  rdfs:label "Commissioned 3.4.1843 under Cmdr William Newton Fowell; on 10.8.1843 under Lieut John Tyssen"@en ;
  crm:P4_has_time-span [
    a crm:E52_Time-Span ;
    crm:P82_at_some_time_within "1843-04-03"^^xsd:date
  ] .

myData:event_PM_0070_04 a :Decommissioning ;
  rdfs:label "Paid off 8.1848"@en ;
  crm:P4_has_time-span [
    a crm:E52_Time-Span ;
    crm:P82_at_some_time_within "1848-08"^^xsd:gYearMonth
  ] .

# Career Anchor: Sale event marking the end of the career
myData:event_PM_0070_05 a crm:E8_Acquisition ;
  rdfs:label "Sold 1848"@en ;
  crm:P4_has_time-span [
    a crm:E52_Time-Span ;
    crm:P82_at_some_time_within "1848"^^xsd:gYear
  ] .

### Presences
myData:presence_PM_0070_01 a crm:E93_Presence ;
  rdfs:label "[Assumption] In ordinary between purchase and commissioning"@en ;
  crm:P195i_had_presence myData:PM_0070 ;
  :has_operational_status :InOrdinary ;
  crm:P164_is_temporally_specified_by [
    a crm:E52_Time-Span ;
    crm:P182i_starts_after_or_with_the_end_of myData:event_PM_0070_02 ;
    crm:P182_ends_before_or_with_the_start_of myData:event_PM_0070_03
  ] .

myData:presence_PM_0070_02 a crm:E93_Presence ;
  rdfs:label "In commission on Lake Erie"@en ;
  crm:P195i_had_presence myData:PM_0070 ;
  :has_operational_status :InCommission ;
  crm:P167_was_within myData:place_lake_erie ;
  crm:P164_is_temporally_specified_by [
    a crm:E52_Time-Span ;
    crm:P182i_starts_after_or_with_the_end_of myData:event_PM_0070_03 ;
    crm:P182_ends_before_or_with_the_start_of myData:event_PM_0070_04
  ] .

myData:presence_PM_0070_03 a crm:E93_Presence ;
  rdfs:label "Paid off before being sold"@en ;
  crm:P195i_had_presence myData:PM_0070 ;
  :has_operational_status :PaidOff ;
  crm:P164_is_temporally_specified_by [
    a crm:E52_Time-Span ;
    crm:P182i_starts_after_or_with_the_end_of myData:event_PM_0070_04 ;
    crm:P182_ends_before_or_with_the_start_of myData:event_PM_0070_05
  ] .

# --- Data from file: PM_0072.ttl ---


### Places
myData:place_millwall a crm:E53_Place ;
  rdfs:label "Millwall"@en .
myData:place_kingston_yard a crm:E53_Place ;
  rdfs:label "Kingston Yard, Lake Ontario"@en .

### Ship
myData:PM_0072 a sealit:Ship ;
  rdfs:label "HMS Mohawk"@en ;
  :has_propulsion_type :PaddleWheel ;
  :has_ship_type :PaddleMisc ;
  dcterms:source "Winfield, Rif. British Warships in the Age of Sail, 1817-1863. Seaforth Publishing, 2014."@en .

### Events
myData:event_PM_0072_01 a crm:E12_Production ;
  rdfs:label "Built by William Fairbairn & Co., Millwall/William Fairbairn. Delivered in pieces 11.1841. Launched 21.2.1843 at Kingston Yard."@en ;
  :modifies_ship myData:PM_0072 ;
  crm:P7_took_place_at myData:place_millwall , myData:place_kingston_yard ;
  crm:P4_has_time-span [
    a crm:E52_Time-Span ;
    crm:P79_beginning_is_qualified_by "1841-01-06"^^xsd:date ;
    crm:P80_end_is_qualified_by "1843-02-21"^^xsd:date
  ] .

myData:event_PM_0072_02 a :Commissioning ;
  rdfs:label "Commissioned 3.4.1843 under Lieut John William Bedford"@en ;
  :modifies_ship myData:PM_0072 ;
  crm:P4_has_time-span [
    a crm:E52_Time-Span ;
    crm:P82_at_some_time_within "1843-04-03"^^xsd:date
  ] .

myData:event_PM_0072_03 a :Commissioning ;
  rdfs:label "On 26.7.1843 under Cmdr William Newton Fowell"@en ;
  :modifies_ship myData:PM_0072 ;
  crm:P4_has_time-span [
    a crm:E52_Time-Span ;
    crm:P82_at_some_time_within "1843-07-26"^^xsd:date
  ] .

myData:event_PM_0072_04 a :Commissioning ;
  rdfs:label "On 1.7.1846 under Lieut John Tyssen"@en ;
  :modifies_ship myData:PM_0072 ;
  crm:P4_has_time-span [
    a crm:E52_Time-Span ;
    crm:P82_at_some_time_within "1846-07-01"^^xsd:date
  ] .

myData:event_PM_0072_05 a :Commissioning ;
  rdfs:label "On 26.8.1848 under Lieut Frederick Charles Herbert"@en ;
  :modifies_ship myData:PM_0072 ;
  crm:P4_has_time-span [
    a crm:E52_Time-Span ;
    crm:P82_at_some_time_within "1848-08-26"^^xsd:date
  ] .

myData:event_PM_0072_06 a crm:E8_Acquisition ;
  rdfs:label "Sold 21.6.1852 to J. F.Parke for £1,643"@en ;
  crm:P4_has_time-span [
    a crm:E52_Time-Span ;
    crm:P82_at_some_time_within "1852-06-21"^^xsd:date
  ] ;
  :incurred_cost [
    a crm:E97_Monetary_Amount ;
    rdfs:comment "£1,643"@en ;
    crm:P90_has_value "1643.0"^^xsd:decimal
  ] .

### Presences
myData:presence_PM_0072_01 a crm:E93_Presence ;
  rdfs:label "[Assumption] In Ordinary between launch and first commissioning"@en ;
  crm:P195i_had_presence myData:PM_0072 ;
  :has_operational_status :InOrdinary ;
  :has_propulsion_type :PaddleWheel ;
  :has_ship_type :PaddleMisc ;
  crm:P167_was_within myData:place_kingston_yard ;
  crm:P164_is_temporally_specified_by [
    a crm:E52_Time-Span ;
    crm:P182i_starts_after_or_with_the_end_of myData:event_PM_0072_01 ;
    crm:P182_ends_before_or_with_the_start_of myData:event_PM_0072_02
  ] .

myData:presence_PM_0072_02 a crm:E93_Presence ;
  rdfs:label "In commission (3.4.1843 - 21.6.1852)"@en ;
  crm:P195i_had_presence myData:PM_0072 ;
  :has_operational_status :InCommission ;
  :has_propulsion_type :PaddleWheel ;
  :has_ship_type :PaddleMisc ;
  crm:P164_is_temporally_specified_by [
    a crm:E52_Time-Span ;
    crm:P182i_starts_after_or_with_the_end_of myData:event_PM_0072_02 ;
    crm:P182_ends_before_or_with_the_start_of myData:event_PM_0072_06
  ] .

# --- Data from file: PSL_0003.ttl ---


### Places
myData:place_chatham a crm:E53_Place ; rdfs:label "Chatham"@en .
myData:place_mediterranean a crm:E53_Place ; rdfs:label "Mediterranean"@en .
myData:place_syrian_coast a crm:E53_Place ; rdfs:label "Syrian coast"@en .
myData:place_african_coast a crm:E53_Place ; rdfs:label "African coast"@en .
myData:place_portsmouth a crm:E53_Place ; rdfs:label "Portsmouth"@en .
myData:place_baltic a crm:E53_Place ; rdfs:label "Baltic"@en .
myData:place_usa a crm:E53_Place ; rdfs:label "USA"@en .
myData:place_woolwich a crm:E53_Place ; rdfs:label "Woolwich"@en .
myData:place_pacific a crm:E53_Place ; rdfs:label "Pacific"@en .
myData:place_charlton a crm:E53_Place ; rdfs:label "Charlton"@en .

### Ship
myData:PSL_0003 a sealit:Ship ;
  rdfs:label "HMS Hecate"@en ;
  :has_propulsion_type :PaddleWheel ;
  :has_ship_type :PaddleSloop ;
  dcterms:source "Winfield, Rif. British Warships in the Age of Sail, 1817-1863. Seaforth Publishing, 2014."@en .

### Construction and Commissioning
myData:event_PSL_0003_01 a crm:E12_Production ;
  rdfs:label "Construction of Hecate"@en ;
  rdfs:comment "Ord: 12.3.1838. K: 6.1838. L: 30.3.1839."@en ;
  crm:P4_has_time-span [
    a crm:E52_Time-Span ;
    crm:P79_beginning_is_qualified_by "1838-03-12"^^xsd:date ;
    crm:P80_end_is_qualified_by "1839-03-30"^^xsd:date
  ] ;
  :incurred_cost [
    a crm:E97_Monetary_Amount ;
    rdfs:comment "First cost: £27,742 (including £11,113 for machinery)"@en ;
    crm:P90_has_value "27742.0"^^xsd:decimal
  ] ;
  crm:P21_had_general_purpose :CombatCapabilityInvestment .

myData:event_PSL_0003_02 a :Commissioning ;
  rdfs:label "Completed at Chatham 7.12.1839"@en ;
  crm:P7_took_place_at myData:place_chatham ;
  crm:P4_has_time-span [
    a crm:E52_Time-Span ;
    crm:P82_at_some_time_within "1839-12-07"^^xsd:date
  ] .

myData:presence_PSL_0003_01 a crm:E93_Presence ;
  rdfs:label "Under fitting at Chatham after launch"@en ;
  crm:P195i_had_presence myData:PSL_0003 ;
  :has_operational_status :UnderFitting ;
  crm:P167_was_within myData:place_chatham ;
  crm:P164_is_temporally_specified_by [ a crm:E52_Time-Span ;
    crm:P182i_starts_after_or_with_the_end_of myData:event_PSL_0003_01 ;
    crm:P182_ends_before_or_with_the_start_of myData:event_PSL_0003_03 ] .

myData:event_PSL_0003_03 a :Commissioning ;
  rdfs:label "Commissioned 14.9.1839 for the Mediterranean"@en ;
  crm:P4_has_time-span [ a crm:E52_Time-Span ; crm:P82_at_some_time_within "1839-09-14"^^xsd:date ] .

myData:event_PSL_0003_04 a :Decommissioning ;
  rdfs:label "Paid off 23.8.1843"@en ;
  crm:P4_has_time-span [ a crm:E52_Time-Span ; crm:P82_at_some_time_within "1843-08-23"^^xsd:date ] .

myData:presence_PSL_0003_02 a crm:E93_Presence ;
  rdfs:label "In commission for Mediterranean and Syrian Coast operations"@en ;
  crm:P195i_had_presence myData:PSL_0003 ;
  :has_operational_status :InCommission ;
  crm:P167_was_within myData:place_mediterranean, myData:place_syrian_coast ;
  crm:P164_is_temporally_specified_by [ a crm:E52_Time-Span ;
    crm:P182i_starts_after_or_with_the_end_of myData:event_PSL_0003_03 ;
    crm:P182_ends_before_or_with_the_start_of myData:event_PSL_0003_04 ] .

myData:event_PSL_0003_05 a :Recommissioning ;
  rdfs:label "Recommissioned 11.6.1845 for the African coast"@en ;
  crm:P4_has_time-span [ a crm:E52_Time-Span ; crm:P82_at_some_time_within "1845-06-11"^^xsd:date ] .

myData:presence_PSL_0003_03 a crm:E93_Presence ;
  rdfs:label "Paid off between services"@en ;
  crm:P195i_had_presence myData:PSL_0003 ;
  :has_operational_status :PaidOff ;
  crm:P164_is_temporally_specified_by [ a crm:E52_Time-Span ;
    crm:P182i_starts_after_or_with_the_end_of myData:event_PSL_0003_04 ;
    crm:P182_ends_before_or_with_the_start_of myData:event_PSL_0003_05 ] .

myData:event_PSL_0003_06 a :Decommissioning ;
  rdfs:label "Paid off 25.9.1848 at Portsmouth"@en ;
  crm:P7_took_place_at myData:place_portsmouth ;
  crm:P4_has_time-span [ a crm:E52_Time-Span ; crm:P82_at_some_time_within "1848-09-25"^^xsd:date ] .

myData:presence_PSL_0003_04 a crm:E93_Presence ;
  rdfs:label "In commission for African coast service"@en ;
  crm:P195i_had_presence myData:PSL_0003 ;
  :has_operational_status :InCommission ;
  crm:P167_was_within myData:place_african_coast ;
  crm:P164_is_temporally_specified_by [ a crm:E52_Time-Span ;
    crm:P182i_starts_after_or_with_the_end_of myData:event_PSL_0003_05 ;
    crm:P182_ends_before_or_with_the_start_of myData:event_PSL_0003_06 ] .

myData:event_PSL_0003_07 a :Recommissioning ;
  rdfs:label "Recommissioned 5.5.1849 for the Baltic"@en ;
  crm:P4_has_time-span [ a crm:E52_Time-Span ; crm:P82_at_some_time_within "1849-05-05"^^xsd:date ] .

myData:presence_PSL_0003_05 a crm:E93_Presence ;
  rdfs:label "Paid off at Portsmouth"@en ;
  crm:P195i_had_presence myData:PSL_0003 ;
  :has_operational_status :PaidOff ;
  crm:P167_was_within myData:place_portsmouth ;
  crm:P164_is_temporally_specified_by [ a crm:E52_Time-Span ;
    crm:P182i_starts_after_or_with_the_end_of myData:event_PSL_0003_06 ;
    crm:P182_ends_before_or_with_the_start_of myData:event_PSL_0003_07 ] .

myData:event_PSL_0003_08 a :Decommissioning ;
  rdfs:label "Paid off 20.6.1849"@en ;
  crm:P4_has_time-span [ a crm:E52_Time-Span ; crm:P82_at_some_time_within "1849-06-20"^^xsd:date ] .

myData:presence_PSL_0003_06 a crm:E93_Presence ;
  rdfs:label "In commission for the Baltic"@en ;
  crm:P195i_had_presence myData:PSL_0003 ;
  :has_operational_status :InCommission ;
  crm:P167_was_within myData:place_baltic ;
  crm:P164_is_temporally_specified_by [ a crm:E52_Time-Span ;
    crm:P182i_starts_after_or_with_the_end_of myData:event_PSL_0003_07 ;
    crm:P182_ends_before_or_with_the_start_of myData:event_PSL_0003_08 ] .

myData:event_PSL_0003_09 a :Recommissioning ;
  rdfs:label "Recommissioned 30.10.1849 to transport Ambassador to USA"@en ;
  crm:P4_has_time-span [ a crm:E52_Time-Span ; crm:P82_at_some_time_within "1849-10-30"^^xsd:date ] .

myData:presence_PSL_0003_07 a crm:E93_Presence ;
  rdfs:label "Paid off between services"@en ;
  crm:P195i_had_presence myData:PSL_0003 ;
  :has_operational_status :PaidOff ;
  crm:P164_is_temporally_specified_by [ a crm:E52_Time-Span ;
    crm:P182i_starts_after_or_with_the_end_of myData:event_PSL_0003_08 ;
    crm:P182_ends_before_or_with_the_start_of myData:event_PSL_0003_09 ] .

myData:event_PSL_0003_10 a :Decommissioning ;
  rdfs:label "Paid off 1.2.1850"@en ;
  crm:P4_has_time-span [ a crm:E52_Time-Span ; crm:P82_at_some_time_within "1850-02-01"^^xsd:date ] .

myData:presence_PSL_0003_08 a crm:E93_Presence ;
  rdfs:label "In commission for transport to USA"@en ;
  crm:P195i_had_presence myData:PSL_0003 ;
  :has_operational_status :InCommission ;
  crm:P167_was_within myData:place_usa ;
  crm:P164_is_temporally_specified_by [ a crm:E52_Time-Span ;
    crm:P182i_starts_after_or_with_the_end_of myData:event_PSL_0003_09 ;
    crm:P182_ends_before_or_with_the_start_of myData:event_PSL_0003_10 ] .

myData:event_PSL_0003_11 a :Recommissioning ;
  rdfs:label "Recommissioned 20.9.1850 for particular service"@en ;
  crm:P4_has_time-span [ a crm:E52_Time-Span ; crm:P82_at_some_time_within "1850-09-20"^^xsd:date ] .

myData:presence_PSL_0003_09 a crm:E93_Presence ;
  rdfs:label "Paid off between services"@en ;
  crm:P195i_had_presence myData:PSL_0003 ;
  :has_operational_status :PaidOff ;
  crm:P164_is_temporally_specified_by [ a crm:E52_Time-Span ;
    crm:P182i_starts_after_or_with_the_end_of myData:event_PSL_0003_10 ;
    crm:P182_ends_before_or_with_the_start_of myData:event_PSL_0003_11 ] .

myData:event_PSL_0003_12 a :Decommissioning ;
  rdfs:label "[Implied] Paid off before 1.3.1855"@en ;
  crm:P4_has_time-span [ a crm:E52_Time-Span ; crm:P80_end_is_qualified_by "1855-02-28"^^xsd:date ] .

myData:presence_PSL_0003_10 a crm:E93_Presence ;
  rdfs:label "In commission for particular service"@en ;
  crm:P195i_had_presence myData:PSL_0003 ;
  :has_operational_status :InCommission ;
  crm:P164_is_temporally_specified_by [ a crm:E52_Time-Span ;
    crm:P182i_starts_after_or_with_the_end_of myData:event_PSL_0003_11 ;
    crm:P182_ends_before_or_with_the_start_of myData:event_PSL_0003_12 ] .

myData:event_PSL_0003_13 a :Recommissioning ;
  rdfs:label "Recommissioned 1.3.1855 for the West coast of Africa"@en ;
  crm:P4_has_time-span [ a crm:E52_Time-Span ; crm:P82_at_some_time_within "1855-03-01"^^xsd:date ] .

myData:presence_PSL_0003_11 a crm:E93_Presence ;
  rdfs:label "Paid off between services"@en ;
  crm:P195i_had_presence myData:PSL_0003 ;
  :has_operational_status :PaidOff ;
  crm:P164_is_temporally_specified_by [ a crm:E52_Time-Span ;
    crm:P182i_starts_after_or_with_the_end_of myData:event_PSL_0003_12 ;
    crm:P182_ends_before_or_with_the_start_of myData:event_PSL_0003_13 ] .

myData:event_PSL_0003_14 a :Decommissioning ;
  rdfs:label "Paid off 3.7.1858 at Woolwich"@en ;
  crm:P7_took_place_at myData:place_woolwich ;
  crm:P4_has_time-span [ a crm:E52_Time-Span ; crm:P82_at_some_time_within "1858-07-03"^^xsd:date ] .

myData:presence_PSL_0003_12 a crm:E93_Presence ;
  rdfs:label "In commission for West coast of Africa service"@en ;
  crm:P195i_had_presence myData:PSL_0003 ;
  :has_operational_status :InCommission ;
  crm:P167_was_within myData:place_african_coast ;
  crm:P164_is_temporally_specified_by [ a crm:E52_Time-Span ;
    crm:P182i_starts_after_or_with_the_end_of myData:event_PSL_0003_13 ;
    crm:P182_ends_before_or_with_the_start_of myData:event_PSL_0003_14 ] .

myData:event_PSL_0003_15 a :ShipConversion ;
  rdfs:label "Fitted as survey ship 6.1860"@en ;
  :modifies_ship myData:PSL_0003 ;
  crm:P4_has_time-span [ a crm:E52_Time-Span ; crm:P82_at_some_time_within "1860-06"^^xsd:gYearMonth ] ;
  crm:P21_had_general_purpose :NonCombatDutyInvestment .

myData:presence_PSL_0003_13 a crm:E93_Presence ;
  rdfs:label "Paid off at Woolwich and awaiting conversion"@en ;
  crm:P195i_had_presence myData:PSL_0003 ;
  :has_operational_status :PaidOff ;
  crm:P167_was_within myData:place_woolwich ;
  crm:P164_is_temporally_specified_by [ a crm:E52_Time-Span ;
    crm:P182i_starts_after_or_with_the_end_of myData:event_PSL_0003_14 ;
    crm:P182_ends_before_or_with_the_start_of myData:event_PSL_0003_15 ] .

myData:event_PSL_0003_16 a :Recommissioning ;
  rdfs:label "Recommissioned 15.5.1860 for the Pacific"@en ;
  crm:P4_has_time-span [ a crm:E52_Time-Span ; crm:P82_at_some_time_within "1860-05-15"^^xsd:date ] .

myData:event_PSL_0003_17 a :Decommissioning ;
  rdfs:label "Paid off 1.1864 at Woolwich"@en ;
  crm:P7_took_place_at myData:place_woolwich ;
  crm:P4_has_time-span [ a crm:E52_Time-Span ; crm:P82_at_some_time_within "1864-01"^^xsd:gYearMonth ] .

myData:presence_PSL_0003_14 a crm:E93_Presence ;
  rdfs:label "In service as survey ship for the Pacific"@en ;
  crm:P195i_had_presence myData:PSL_0003 ;
  :has_operational_status :InNonCombatDuty ;
  :has_ship_role :SurveyShip ;
  crm:P167_was_within myData:place_pacific ;
  crm:P164_is_temporally_specified_by [ a crm:E52_Time-Span ;
    crm:P182i_starts_after_or_with_the_end_of myData:event_PSL_0003_16 ;
    crm:P182_ends_before_or_with_the_start_of myData:event_PSL_0003_17 ] .

myData:event_PSL_0003_18 a crm:E6_Destruction ;
  rdfs:label "Sold to Castle & Beech, Charlton for BU"@en ;
  crm:P13_destroyed myData:PSL_0003 ;
  crm:P7_took_place_at myData:place_charlton ;
  crm:P4_has_time-span [
    a crm:E52_Time-Span ;
    crm:P79_beginning_is_qualified_by "1864-11"^^xsd:gYearMonth ;
    crm:P80_end_is_qualified_by "1865-01"^^xsd:gYearMonth
  ] .

myData:presence_PSL_0003_15 a crm:E93_Presence ;
  rdfs:label "Paid off at Woolwich awaiting disposal"@en ;
  crm:P195i_had_presence myData:PSL_0003 ;
  :has_operational_status :PaidOff ;
  crm:P167_was_within myData:place_woolwich ;
  crm:P164_is_temporally_specified_by [ a crm:E52_Time-Span ;
    crm:P182i_starts_after_or_with_the_end_of myData:event_PSL_0003_17 ;
    crm:P182_ends_before_or_with_the_start_of myData:event_PSL_0003_18 ] .

# --- Data from file: PSL_0005.ttl ---


### Places
myData:place_chatham a crm:E53_Place ; rdfs:label "Chatham"@en .
myData:place_sheerness a crm:E53_Place ; rdfs:label "Sheerness"@en .
myData:place_mediterranean a crm:E53_Place ; rdfs:label "Mediterranean"@en .
myData:place_acre a crm:E53_Place ; rdfs:label "Acre"@en .
myData:place_woolwich a crm:E53_Place ; rdfs:label "Woolwich"@en .
myData:place_north_america_west_indies a crm:E53_Place ; rdfs:label "North America and the West Indies"@en .
myData:place_sebastopol a crm:E53_Place ; rdfs:label "Sebastopol"@en .
myData:place_azov a crm:E53_Place ; rdfs:label "Azov operations"@en .
myData:place_black_sea a crm:E53_Place ; rdfs:label "Black Sea"@en .
myData:place_deptford a crm:E53_Place ; rdfs:label "Deptford"@en .
myData:place_west_coast_of_africa a crm:E53_Place ; rdfs:label "West coast of Africa"@en .
myData:place_west_indies a crm:E53_Place ; rdfs:label "West Indies"@en .
myData:place_portsmouth a crm:E53_Place ; rdfs:label "Portsmouth"@en .
myData:place_cowes a crm:E53_Place ; rdfs:label "Cowes"@en .

### Ship
myData:PSL_0005 a sealit:Ship ;
  rdfs:label "HMS Vesuvius"@en ;
  :has_propulsion_type :PaddleWheel ;
  :has_ship_type :PaddleSloop ;
  dcterms:source "Winfield, Rif. British Warships in the Age of Sail, 1817-1863. Seaforth Publishing, 2014."@en .

### Career Events and Presences

# 1. Construction and Fitting (1838-1840)
myData:event_PSL_0005_01 a crm:E12_Production ;
  rdfs:label "Construction of Vesuvius"@en ;
  rdfs:comment "Ord: 12.3.1838. K: 9.1838. L: 11.7.1839."@en ;
  crm:P4_has_time-span [
    a crm:E52_Time-Span ;
    crm:P79_beginning_is_qualified_by "1838-03-12"^^xsd:date ;
    crm:P80_end_is_qualified_by "1839-07-11"^^xsd:date
  ] ;
  :incurred_cost [
    a crm:E97_Monetary_Amount ;
    rdfs:comment "First cost: £39,505 (hull £21,707, machinery £13,309, fitting £4,389)"@en ;
    crm:P90_has_value "39505.0"^^xsd:decimal
  ] ;
  crm:P21_had_general_purpose :CombatCapabilityInvestment .

myData:event_PSL_0005_02 a :Fitting ;
  rdfs:label "Completed at Chatham"@en ;
  crm:P7_took_place_at myData:place_chatham ;
  crm:P4_has_time-span [ a crm:E52_Time-Span ; crm:P82_at_some_time_within "1840-04-20"^^xsd:date ] .

myData:presence_PSL_0005_01 a crm:E93_Presence ;
  rdfs:label "Under fitting at Chatham"@en ;
  crm:P195i_had_presence myData:PSL_0005 ;
  :has_operational_status :UnderFitting ;
  crm:P167_was_within myData:place_chatham ;
  crm:P164_is_temporally_specified_by [
    a crm:E52_Time-Span ;
    crm:P182i_starts_after_or_with_the_end_of myData:event_PSL_0005_01 ;
    crm:P182_ends_before_or_with_the_start_of myData:event_PSL_0005_02
  ] .

# 2. First Commission and Mediterranean Service (1840-1844)
myData:event_PSL_0005_03 a :Commissioning ;
  rdfs:label "Commissioned for trials, then used as transport"@en ;
  crm:P7_took_place_at myData:place_sheerness ;
  crm:P4_has_time-span [ a crm:E52_Time-Span ; crm:P82_at_some_time_within "1840-05"^^xsd:gYearMonth ] .

myData:presence_PSL_0005_02 a crm:E93_Presence ;
  rdfs:label "Awaiting commissioning at Chatham"@en ;
  crm:P195i_had_presence myData:PSL_0005 ;
  :has_operational_status :PaidOff ;
  crm:P167_was_within myData:place_chatham ;
  crm:P164_is_temporally_specified_by [
    a crm:E52_Time-Span ;
    crm:P182i_starts_after_or_with_the_end_of myData:event_PSL_0005_02 ;
    crm:P182_ends_before_or_with_the_start_of myData:event_PSL_0005_03
  ] .

myData:event_PSL_0005_04 a :Recommissioning ;
  rdfs:label "Recommissioned for the Mediterranean"@en ;
  crm:P4_has_time-span [ a crm:E52_Time-Span ; crm:P82_at_some_time_within "1840-08-31"^^xsd:date ] .

myData:presence_PSL_0005_03 a crm:E93_Presence ;
  rdfs:label "On trials and transport duty"@en ;
  crm:P195i_had_presence myData:PSL_0005 ;
  :has_operational_status :InCommission ;
  crm:P167_was_within myData:place_sheerness ;
  crm:P164_is_temporally_specified_by [
    a crm:E52_Time-Span ;
    crm:P182i_starts_after_or_with_the_end_of myData:event_PSL_0005_03 ;
    crm:P182_ends_before_or_with_the_start_of myData:event_PSL_0005_04
  ] .

myData:event_PSL_0005_05 a :Decommissioning ;
  rdfs:label "Paid off at Woolwich"@en ;
  crm:P7_took_place_at myData:place_woolwich ;
  crm:P4_has_time-span [ a crm:E52_Time-Span ; crm:P82_at_some_time_within "1844-11-15"^^xsd:date ] .

myData:presence_PSL_0005_04 a crm:E93_Presence ;
  rdfs:label "In commission for the Mediterranean (bombardment of Acre)"@en ;
  crm:P195i_had_presence myData:PSL_0005 ;
  :has_operational_status :InCommission ;
  crm:P167_was_within myData:place_mediterranean, myData:place_acre ;
  crm:P164_is_temporally_specified_by [
    a crm:E52_Time-Span ;
    crm:P182i_starts_after_or_with_the_end_of myData:event_PSL_0005_04 ;
    crm:P182_ends_before_or_with_the_start_of myData:event_PSL_0005_05
  ] .

# 3. North America and West Indies Service (1845-1848)
myData:event_PSL_0005_06 a :Recommissioning ;
  rdfs:label "Recommissioned for North America and the West Indies"@en ;
  crm:P4_has_time-span [ a crm:E52_Time-Span ; crm:P82_at_some_time_within "1845-03-22"^^xsd:date ] .

myData:presence_PSL_0005_05 a crm:E93_Presence ;
  rdfs:label "Paid off at Woolwich"@en ;
  crm:P195i_had_presence myData:PSL_0005 ;
  :has_operational_status :PaidOff ;
  crm:P167_was_within myData:place_woolwich ;
  crm:P164_is_temporally_specified_by [
    a crm:E52_Time-Span ;
    crm:P182i_starts_after_or_with_the_end_of myData:event_PSL_0005_05 ;
    crm:P182_ends_before_or_with_the_start_of myData:event_PSL_0005_06
  ] .

myData:event_PSL_0005_07 a :Decommissioning ;
  rdfs:label "Paid off"@en ;
  crm:P4_has_time-span [ a crm:E52_Time-Span ; crm:P82_at_some_time_within "1848-09-14"^^xsd:date ] .

myData:presence_PSL_0005_06 a crm:E93_Presence ;
  rdfs:label "In commission for North America and the West Indies"@en ;
  crm:P195i_had_presence myData:PSL_0005 ;
  :has_operational_status :InCommission ;
  crm:P167_was_within myData:place_north_america_west_indies ;
  crm:P164_is_temporally_specified_by [
    a crm:E52_Time-Span ;
    crm:P182i_starts_after_or_with_the_end_of myData:event_PSL_0005_06 ;
    crm:P182_ends_before_or_with_the_start_of myData:event_PSL_0005_07
  ] .

# 4. Crimean War Service (1852-1856)
myData:event_PSL_0005_08 a :Recommissioning ;
  rdfs:label "Recommissioned"@en ;
  crm:P4_has_time-span [ a crm:E52_Time-Span ; crm:P82_at_some_time_within "1852"^^xsd:gYear ] .

myData:presence_PSL_0005_07 a crm:E93_Presence ;
  rdfs:label "Paid off"@en ;
  crm:P195i_had_presence myData:PSL_0005 ;
  :has_operational_status :PaidOff ;
  crm:P164_is_temporally_specified_by [
    a crm:E52_Time-Span ;
    crm:P182i_starts_after_or_with_the_end_of myData:event_PSL_0005_07 ;
    crm:P182_ends_before_or_with_the_start_of myData:event_PSL_0005_08
  ] .

myData:event_PSL_0005_09 a :Decommissioning ;
  rdfs:label "Paid off"@en ;
  crm:P4_has_time-span [ a crm:E52_Time-Span ; crm:P82_at_some_time_within "1852-03-22"^^xsd:date ] .

myData:presence_PSL_0005_08 a crm:E93_Presence ;
  rdfs:label "In commission (shortly)"@en ;
  crm:P195i_had_presence myData:PSL_0005 ;
  :has_operational_status :InCommission ;
  crm:P164_is_temporally_specified_by [
    a crm:E52_Time-Span ;
    crm:P182i_starts_after_or_with_the_end_of myData:event_PSL_0005_08 ;
    crm:P182_ends_before_or_with_the_start_of myData:event_PSL_0005_09
  ] .

myData:event_PSL_0005_10 a :Recommissioning ;
  rdfs:label "Recommissioned for Crimean War service"@en ;
  crm:P4_has_time-span [ a crm:E52_Time-Span ; crm:P82_at_some_time_within "1853-08-17"^^xsd:date ] .

myData:presence_PSL_0005_09 a crm:E93_Presence ;
  rdfs:label "Paid off"@en ;
  crm:P195i_had_presence myData:PSL_0005 ;
  :has_operational_status :PaidOff ;
  crm:P164_is_temporally_specified_by [
    a crm:E52_Time-Span ;
    crm:P182i_starts_after_or_with_the_end_of myData:event_PSL_0005_09 ;
    crm:P182_ends_before_or_with_the_start_of myData:event_PSL_0005_10
  ] .

myData:event_PSL_0005_11 a :Decommissioning ;
  rdfs:label "Paid off at Woolwich"@en ;
  crm:P7_took_place_at myData:place_woolwich ;
  crm:P4_has_time-span [ a crm:E52_Time-Span ; crm:P82_at_some_time_within "1856-01-17"^^xsd:date ] .

myData:presence_PSL_0005_10 a crm:E93_Presence ;
  rdfs:label "In commission (bombardment of Sebastopol, Azov, Black Sea, Mediterranean)"@en ;
  crm:P195i_had_presence myData:PSL_0005 ;
  :has_operational_status :InCommission ;
  crm:P167_was_within myData:place_sebastopol, myData:place_azov, myData:place_black_sea, myData:place_mediterranean ;
  crm:P164_is_temporally_specified_by [
    a crm:E52_Time-Span ;
    crm:P182i_starts_after_or_with_the_end_of myData:event_PSL_0005_10 ;
    crm:P182_ends_before_or_with_the_start_of myData:event_PSL_0005_11
  ] .

# 5. West Coast of Africa Service (1857-1860)
myData:event_PSL_0005_12 a :Recommissioning ;
  rdfs:label "Recommissioned for the west coast of Africa"@en ;
  crm:P4_has_time-span [ a crm:E52_Time-Span ; crm:P82_at_some_time_within "1857-04-20"^^xsd:date ] .

myData:presence_PSL_0005_11 a crm:E93_Presence ;
  rdfs:label "Paid off at Woolwich"@en ;
  crm:P195i_had_presence myData:PSL_0005 ;
  :has_operational_status :PaidOff ;
  crm:P167_was_within myData:place_woolwich ;
  crm:P164_is_temporally_specified_by [
    a crm:E52_Time-Span ;
    crm:P182i_starts_after_or_with_the_end_of myData:event_PSL_0005_11 ;
    crm:P182_ends_before_or_with_the_start_of myData:event_PSL_0005_12
  ] .

myData:event_PSL_0005_13 a :Decommissioning ;
  rdfs:label "Paid off at Deptford"@en ;
  crm:P7_took_place_at myData:place_deptford ;
  crm:P4_has_time-span [ a crm:E52_Time-Span ; crm:P82_at_some_time_within "1860-02-22"^^xsd:date ] .

myData:presence_PSL_0005_12 a crm:E93_Presence ;
  rdfs:label "In commission for the west coast of Africa"@en ;
  crm:P195i_had_presence myData:PSL_0005 ;
  :has_operational_status :InCommission ;
  crm:P167_was_within myData:place_west_coast_of_africa ;
  crm:P164_is_temporally_specified_by [
    a crm:E52_Time-Span ;
    crm:P182i_starts_after_or_with_the_end_of myData:event_PSL_0005_12 ;
    crm:P182_ends_before_or_with_the_start_of myData:event_PSL_0005_13
  ] .

# 6. Final Service and Sale (1860-1865)
myData:event_PSL_0005_14 a :Fitting ;
  rdfs:label "Fitted with Armstrong guns"@en ;
  :modifies_ship myData:PSL_0005 ;
  crm:P4_has_time-span [ a crm:E52_Time-Span ; crm:P82_at_some_time_within "1862"^^xsd:gYear ] .

myData:presence_PSL_0005_13 a crm:E93_Presence ;
  rdfs:label "Paid off at Deptford"@en ;
  crm:P195i_had_presence myData:PSL_0005 ;
  :has_operational_status :PaidOff ;
  crm:P167_was_within myData:place_deptford ;
  crm:P164_is_temporally_specified_by [
    a crm:E52_Time-Span ;
    crm:P182i_starts_after_or_with_the_end_of myData:event_PSL_0005_13 ;
    crm:P182_ends_before_or_with_the_start_of myData:event_PSL_0005_14
  ] .

myData:presence_PSL_0005_14 a crm:E93_Presence ;
  rdfs:label "Under repair (fitting with Armstrong guns)"@en ;
  crm:P195i_had_presence myData:PSL_0005 ;
  :has_operational_status :UnderRepair ;
  crm:P164_is_temporally_specified_by [
    a crm:E52_Time-Span ;
    crm:P82_at_some_time_within "1862"^^xsd:gYear
  ] .

myData:event_PSL_0005_15 a :Commissioning ;
  rdfs:label "Commissioned for the West Indies"@en ;
  crm:P4_has_time-span [ a crm:E52_Time-Span ; crm:P82_at_some_time_within "1862-07-16"^^xsd:date ] .

myData:presence_PSL_0005_15 a crm:E93_Presence ;
  rdfs:label "Paid off after fitting"@en ;
  crm:P195i_had_presence myData:PSL_0005 ;
  :has_operational_status :PaidOff ;
  crm:P164_is_temporally_specified_by [
    a crm:E52_Time-Span ;
    crm:P182i_starts_after_or_with_the_end_of myData:event_PSL_0005_14 ;
    crm:P182_ends_before_or_with_the_start_of myData:event_PSL_0005_15
  ] .

myData:event_PSL_0005_16 a :Decommissioning ;
  rdfs:label "Paid off at Portsmouth"@en ;
  crm:P7_took_place_at myData:place_portsmouth ;
  crm:P4_has_time-span [ a crm:E52_Time-Span ; crm:P82_at_some_time_within "1864-11-08"^^xsd:date ] .

myData:presence_PSL_0005_16 a crm:E93_Presence ;
  rdfs:label "In commission for the West Indies"@en ;
  crm:P195i_had_presence myData:PSL_0005 ;
  :has_operational_status :InCommission ;
  crm:P167_was_within myData:place_west_indies ;
  crm:P164_is_temporally_specified_by [
    a crm:E52_Time-Span ;
    crm:P182i_starts_after_or_with_the_end_of myData:event_PSL_0005_15 ;
    crm:P182_ends_before_or_with_the_start_of myData:event_PSL_0005_16
  ] .

myData:event_PSL_0005_17 a crm:E8_Acquisition ;
  rdfs:label "Sold to be broken up"@en ;
  rdfs:comment "Sold 6.1865 to BU, and towed away 10.11.1865 to White, Cowes."@en ;
  crm:P7_took_place_at myData:place_cowes ;
  crm:P4_has_time-span [ a crm:E52_Time-Span ; crm:P82_at_some_time_within "1865-06"^^xsd:gYearMonth ] .

myData:presence_PSL_0005_17 a crm:E93_Presence ;
  rdfs:label "Paid off at Portsmouth before sale"@en ;
  crm:P195i_had_presence myData:PSL_0005 ;
  :has_operational_status :PaidOff ;
  crm:P167_was_within myData:place_portsmouth ;
  crm:P164_is_temporally_specified_by [
    a crm:E52_Time-Span ;
    crm:P182i_starts_after_or_with_the_end_of myData:event_PSL_0005_16 ;
    crm:P182_ends_before_or_with_the_start_of myData:event_PSL_0005_17
  ] .

# --- Data from file: PSL_0016.ttl ---


### Places
myData:place_portsmouth a crm:E53_Place ; rdfs:label "Portsmouth"@en .
myData:place_pembroke a crm:E53_Place ; rdfs:label "Pembroke"@en .
myData:place_cape_of_good_hope a crm:E53_Place ; rdfs:label "Cape of Good Hope"@en .
myData:place_cape_recife_algoa_bay a crm:E53_Place ; rdfs:label "Cape Recife, Algoa Bay (South Africa)"@en .

### Ship
myData:PSL_0016 a sealit:Ship ;
  rdfs:label "HMS Thunderbolt"@en ;
  :has_propulsion_type :PaddleWheel ;
  :has_ship_type :PaddleSloop ;
  dcterms:source "Winfield, Rif. British Warships in the Age of Sail, 1817-1863. Seaforth Publishing, 2014."@en .

### Construction and initial fitting
myData:event_PSL_0016_01 a crm:E12_Production ;
  rdfs:label "As built: 180ft 0in, 156ft 0in x 36ft Oin oa (35ft Sin for tonnage) x 21 ft Oin. 1,055 54/94bm."@en ;
  crm:P4_has_time-span [
    a crm:E52_Time-Span ;
    crm:P79_beginning_is_qualified_by "1841-03-18"^^xsd:date ; # Ord
    crm:P80_end_is_qualified_by "1842-01-13"^^xsd:date # L
  ] ;
  :incurred_cost [
    a crm:E97_Monetary_Amount ;
    rdfs:comment "First cost: £44,567 total (hull £24,454, machinery £13,600, fitting £5,113)"@en ;
    crm:P90_has_value "44567.0"^^xsd:decimal
  ] .

### Commissioning, Service, and Destruction
myData:event_PSL_0016_02 a :Fitting ;
  rdfs:label "Completed at Portsmouth after machinery fitted at Pembroke"@en ;
  :modifies_ship myData:PSL_0016 ;
  crm:P7_took_place_at myData:place_portsmouth , myData:place_pembroke ;
  crm:P4_has_time-span [
    a crm:E52_Time-Span ;
    crm:P80_end_is_qualified_by "1843-02-08"^^xsd:date # C
  ] .

myData:event_PSL_0016_03 a :Commissioning ;
  rdfs:label "Commissioned 28.11.1842 under Cmdr George Nathaniel Broke, for the Cape of Good Hope"@en ;
  crm:P4_has_time-span [
    a crm:E52_Time-Span ;
    crm:P82_at_some_time_within "1842-11-28"^^xsd:date
  ] .

myData:presence_PSL_0016_01 a crm:E93_Presence ;
  rdfs:label "Under fitting until first commissioning"@en ;
  crm:P195i_had_presence myData:PSL_0016 ;
  :has_operational_status :UnderFitting ;
  crm:P167_was_within myData:place_portsmouth, myData:place_pembroke ;
  crm:P164_is_temporally_specified_by [ a crm:E52_Time-Span ;
    crm:P182i_starts_after_or_with_the_end_of myData:event_PSL_0016_01 ;
    crm:P182_ends_before_or_with_the_start_of myData:event_PSL_0016_03
  ] .

myData:event_PSL_0016_04 a :Commissioning ;
  rdfs:label "On 27.12.1845 under Cmdr Alexander Boyle, on same station"@en ;
  crm:P4_has_time-span [
    a crm:E52_Time-Span ;
    crm:P82_at_some_time_within "1845-12-27"^^xsd:date
  ] .

myData:event_PSL_0016_05 a crm:E6_Destruction ;
  rdfs:label "Wrecked on Cape Recife, Algoa Bay (South Africa)"@en ;
  crm:P13_destroyed myData:PSL_0016 ;
  crm:P7_took_place_at myData:place_cape_recife_algoa_bay ;
  crm:P4_has_time-span [
    a crm:E52_Time-Span ;
    crm:P82_at_some_time_within "1847-02-03"^^xsd:date
  ] .

myData:presence_PSL_0016_02 a crm:E93_Presence ;
  rdfs:label "In commission at the Cape of Good Hope station"@en ;
  crm:P195i_had_presence myData:PSL_0016 ;
  :has_operational_status :InCommission ;
  crm:P167_was_within myData:place_cape_of_good_hope ;
  crm:P164_is_temporally_specified_by [ a crm:E52_Time-Span ;
    crm:P182i_starts_after_or_with_the_end_of myData:event_PSL_0016_03 ;
    crm:P182_ends_before_or_with_the_start_of myData:event_PSL_0016_05
  ] .

# --- Data from file: PSL_0022.ttl ---


### Places
myData:place_pembroke_dyd a crm:E53_Place ; rdfs:label "Pembroke Dyd"@en .
myData:place_liverpool a crm:E53_Place ; rdfs:label "Liverpool"@en .
myData:place_devonport a crm:E53_Place ; rdfs:label "Devonport"@en .
myData:place_east_indies a crm:E53_Place ; rdfs:label "East Indies"@en .
myData:place_china a crm:E53_Place ; rdfs:label "China"@en .
myData:place_new_zealand a crm:E53_Place ; rdfs:label "New Zealand"@en .
myData:place_lemma_island a crm:E53_Place ; rdfs:label "Lemma Island"@en .
myData:place_channel a crm:E53_Place ; rdfs:label "Channel"@en .
myData:place_mediterranean a crm:E53_Place ; rdfs:label "Mediterranean"@en .
myData:place_black_sea a crm:E53_Place ; rdfs:label "Black Sea"@en .
myData:place_fort_nicolaiev a crm:E53_Place ; rdfs:label "Fort Nicolaiev"@en .
myData:place_fatshan a crm:E53_Place ; rdfs:label "Fatshan"@en .
myData:place_coulan a crm:E53_Place ; rdfs:label "Coulan"@en .
myData:place_portsmouth a crm:E53_Place ; rdfs:label "Portsmouth"@en .
myData:place_charlton a crm:E53_Place ; rdfs:label "Charlton"@en .

### Ship
myData:PSL_0022 a sealit:Ship ;
  rdfs:label "HMS Inflexible"@en ;
  :has_propulsion_type :PaddleWheel ;
  :has_ship_type :PaddleSloop ;
  dcterms:source "Winfield, Rif. British Warships in the Age of Sail, 1817-1863. Seaforth Publishing, 2014."@en .

### Career Events and Presences
# Construction and Fitting (1841-1846)
myData:event_PSL_0022_01 a crm:E12_Production ;
  rdfs:label "Built at Pembroke Dockyard, engines by Fawcett, Preston & Co."@en ;
  rdfs:comment "As built: 190ft 0in, 165ft 10in x 36ft 0in oa (35ft 8in for tonnage) x 21ft 1in. 1,122 11/94bm. Draught 7ft 8in/8ft 1in."@en ;
  crm:P7_took_place_at myData:place_pembroke_dyd ;
  crm:P4_has_time-span [
    a crm:E52_Time-Span ;
    crm:P79_beginning_is_qualified_by "1841-03-18"^^xsd:date ; # Ord
    crm:P80_end_is_qualified_by "1845-05-22"^^xsd:date   # L
  ] ;
  :incurred_cost [
    a crm:E97_Monetary_Amount ;
    rdfs:comment "First cost: Total £50,114 (hull £22,338, machinery £18,458, fitting £9,418)"@en ;
    crm:P90_has_value "50114.0"^^xsd:decimal
  ] ;
  crm:P21_had_general_purpose :CombatCapabilityInvestment .

myData:presence_PSL_0022_01 a crm:E93_Presence ;
  rdfs:label "Under fitting after launch, engine fitted at Liverpool, completed at Devonport"@en ;
  crm:P195i_had_presence myData:PSL_0022 ;
  :has_operational_status :UnderFitting ;
  crm:P167_was_within myData:place_liverpool, myData:place_devonport ;
  crm:P164_is_temporally_specified_by [ a crm:E52_Time-Span ;
    crm:P182i_starts_after_or_with_the_end_of myData:event_PSL_0022_01 ;
    crm:P182_ends_before_or_with_the_start_of myData:event_PSL_0022_02 ] .

# First Commission (1846-1855)
myData:event_PSL_0022_02 a :Commissioning ;
  rdfs:label "Commissioned 10.6.1846 under Cmdr John Cochrane Hoseason"@en ;
  crm:P4_has_time-span [ a crm:E52_Time-Span ; crm:P82_at_some_time_within "1846-06-10"^^xsd:date ] .

myData:presence_PSL_0022_02 a crm:E93_Presence ;
  rdfs:label "In commission for East Indies, China, New Zealand, Channel Fleet, Mediterranean and Black Sea"@en ;
  crm:P195i_had_presence myData:PSL_0022 ;
  :has_operational_status :InCommission ;
  crm:P167_was_within myData:place_east_indies, myData:place_china, myData:place_new_zealand, myData:place_channel, myData:place_mediterranean, myData:place_black_sea ;
  crm:P164_is_temporally_specified_by [ a crm:E52_Time-Span ;
    crm:P182i_starts_after_or_with_the_end_of myData:event_PSL_0022_02 ;
    crm:P182_ends_before_or_with_the_start_of myData:event_PSL_0022_03 ] .

myData:event_PSL_0022_03 a :Decommissioning ;
  rdfs:label "Paid off 15.8.1855"@en ;
  crm:P4_has_time-span [ a crm:E52_Time-Span ; crm:P82_at_some_time_within "1855-08-15"^^xsd:date ] .

# In Ordinary (1855-1856)
myData:presence_PSL_0022_03 a crm:E93_Presence ;
  rdfs:label "Paid off between commissions"@en ;
  crm:P195i_had_presence myData:PSL_0022 ;
  :has_operational_status :PaidOff ;
  crm:P164_is_temporally_specified_by [ a crm:E52_Time-Span ;
    crm:P182i_starts_after_or_with_the_end_of myData:event_PSL_0022_03 ;
    crm:P182_ends_before_or_with_the_start_of myData:event_PSL_0022_04 ] .

# Second Commission (1856-1861)
myData:event_PSL_0022_04 a :Recommissioning ;
  rdfs:label "Recommissioned 28.7.1856 under Cmdr John Corbett"@en ;
  crm:P4_has_time-span [ a crm:E52_Time-Span ; crm:P82_at_some_time_within "1856-07-28"^^xsd:date ] .

myData:presence_PSL_0022_04 a crm:E93_Presence ;
  rdfs:label "In commission for East Indies and China"@en ;
  crm:P195i_had_presence myData:PSL_0022 ;
  :has_operational_status :InCommission ;
  crm:P167_was_within myData:place_east_indies, myData:place_china ;
  crm:P164_is_temporally_specified_by [ a crm:E52_Time-Span ;
    crm:P182i_starts_after_or_with_the_end_of myData:event_PSL_0022_04 ;
    crm:P182_ends_before_or_with_the_start_of myData:event_PSL_0022_05 ] .

myData:event_PSL_0022_05 a :Decommissioning ;
  rdfs:label "Paid off 27.4.1861"@en ;
  crm:P4_has_time-span [ a crm:E52_Time-Span ; crm:P82_at_some_time_within "1861-04-27"^^xsd:date ] .

# Final Period and Destruction (1861-1864)
myData:presence_PSL_0022_05 a crm:E93_Presence ;
  rdfs:label "Laid up until sold"@en ;
  crm:P195i_had_presence myData:PSL_0022 ;
  :has_operational_status :PaidOff ;
  crm:P167_was_within myData:place_portsmouth ;
  crm:P164_is_temporally_specified_by [ a crm:E52_Time-Span ;
    crm:P182i_starts_after_or_with_the_end_of myData:event_PSL_0022_05 ;
    crm:P182_ends_before_or_with_the_start_of myData:event_PSL_0022_06 ] .

myData:event_PSL_0022_06 a crm:E6_Destruction ;
  rdfs:label "Sold to Castle & Beech 7.1864 and towed from Portsmouth 8.9.1864 to be broken up at Charlton."@en ;
  crm:P13_destroyed myData:PSL_0022 ;
  crm:P7_took_place_at myData:place_charlton ;
  crm:P4_has_time-span [
    a crm:E52_Time-Span ;
    crm:P79_beginning_is_qualified_by "1864-07"^^xsd:gYearMonth
  ] .

# --- Data from file: PSL_0033.ttl ---


### Places
myData:place_portsmouth a crm:E53_Place ; rdfs:label "Portsmouth"@en .
myData:place_woolwich a crm:E53_Place ; rdfs:label "Woolwich"@en .
myData:place_blackwall a crm:E53_Place ; rdfs:label "Blackwall"@en .
myData:place_deptford a crm:E53_Place ; rdfs:label "Deptford"@en .
myData:place_devonport a crm:E53_Place ; rdfs:label "Devonport"@en .
myData:place_plymouth a crm:E53_Place ; rdfs:label "Plymouth"@en .
myData:place_sheerness a crm:E53_Place ; rdfs:label "Sheerness"@en .
myData:place_chatham a crm:E53_Place ; rdfs:label "Chatham"@en .
myData:place_west_coast_of_africa a crm:E53_Place ; rdfs:label "West coast of Africa"@en .
myData:place_north_america_and_west_indies a crm:E53_Place ; rdfs:label "North America and the West Indies"@en .
myData:place_east_indies_and_china a crm:E53_Place ; rdfs:label "East Indies and China"@en .

### Ship
myData:PSL_0033 a sealit:Ship ;
  rdfs:label "HMS Argus"@en ;
  :has_propulsion_type :PaddleWheel ;
  :has_ship_type :PaddleSloop ;
  dcterms:source "Winfield, Rif. British Warships in the Age of Sail, 1817-1863. Seaforth Publishing, 2014."@en .

### Construction and First Commissioning
myData:event_PSL_0033_01 a crm:E12_Production ;
  rdfs:label "Construction of HMS Argus"@en ;
  rdfs:comment "As built: 190ft 2½in, 168ft 2¼in x 33ft 5½in oa (33ft 1¼in for tonnage) x 20ft 11in. 98037;94bm."@en ;
  crm:P7_took_place_at myData:place_portsmouth ;
  crm:P4_has_time-span [
    a crm:E52_Time-Span ;
    crm:P79_beginning_is_qualified_by "1847-04-25"^^xsd:date ; # Ord
    crm:P80_end_is_qualified_by "1849-12-15"^^xsd:date   # L
  ] ;
  :incurred_cost [
    a crm:E97_Monetary_Amount ;
    rdfs:comment "First cost: £49,188 total"@en ;
    crm:P90_has_value "49188.0"^^xsd:decimal
  ] .

myData:presence_PSL_0033_01 a crm:E93_Presence ;
  rdfs:label "Under fitting after launch"@en ;
  crm:P195i_had_presence myData:PSL_0033 ;
  :has_operational_status :UnderFitting ;
  :has_propulsion_type :PaddleWheel ;
  :has_ship_type :PaddleSloop ;
  crm:P164_is_temporally_specified_by [
    a crm:E52_Time-Span ;
    crm:P182i_starts_after_or_with_the_end_of myData:event_PSL_0033_01 ;
    crm:P182_ends_before_or_with_the_start_of myData:event_PSL_0033_02
  ] .

myData:event_PSL_0033_02 a :Commissioning ;
  rdfs:label "Commissioned 20.12.1852"@en ;
  crm:P4_has_time-span [
    a crm:E52_Time-Span ;
    crm:P79_beginning_is_qualified_by "1852-12-20"^^xsd:date ;
    crm:P80_end_is_qualified_by "1853-05-02"^^xsd:date # C
  ] .

### First Service Period
myData:presence_PSL_0033_02 a crm:E93_Presence ;
  rdfs:label "In Commission (1852-1856) for North America and the West Indies"@en ;
  crm:P195i_had_presence myData:PSL_0033 ;
  :has_operational_status :InCommission ;
  :has_propulsion_type :PaddleWheel ;
  :has_ship_type :PaddleSloop ;
  crm:P167_was_within myData:place_north_america_and_west_indies ;
  crm:P164_is_temporally_specified_by [
    a crm:E52_Time-Span ;
    crm:P182i_starts_after_or_with_the_end_of myData:event_PSL_0033_02 ;
    crm:P182_ends_before_or_with_the_start_of myData:event_PSL_0033_03
  ] .

myData:event_PSL_0033_03 a :Decommissioning ;
  rdfs:label "Paid off 26.8.1856 at Sheerness"@en ;
  crm:P7_took_place_at myData:place_sheerness ;
  crm:P4_has_time-span [ a crm:E52_Time-Span ; crm:P82_at_some_time_within "1856-08-26"^^xsd:date ] .

### Refit and Second Service Period
myData:presence_PSL_0033_03 a crm:E93_Presence ;
  rdfs:label "Paid off at Sheerness before refit"@en ;
  crm:P195i_had_presence myData:PSL_0033 ;
  :has_operational_status :PaidOff ;
  :has_propulsion_type :PaddleWheel ;
  :has_ship_type :PaddleSloop ;
  crm:P167_was_within myData:place_sheerness ;
  crm:P164_is_temporally_specified_by [
    a crm:E52_Time-Span ;
    crm:P182i_starts_after_or_with_the_end_of myData:event_PSL_0033_03 ;
    crm:P182_ends_before_or_with_the_start_of myData:event_PSL_0033_04
  ] .

myData:event_PSL_0033_04 a :Refit ;
  rdfs:label "Refitted for sea at Sheerness (1858)"@en ;
  :modifies_ship myData:PSL_0033 ;
  crm:P7_took_place_at myData:place_sheerness ;
  crm:P4_has_time-span [ a crm:E52_Time-Span ; crm:P82_at_some_time_within "1858"^^xsd:gYear ] ;
  :incurred_cost [
    a crm:E97_Monetary_Amount ;
    rdfs:comment "£6,684"@en ;
    crm:P90_has_value "6684.0"^^xsd:decimal
  ] ;
  crm:P21_had_general_purpose :CombatCapabilityInvestment .

myData:presence_PSL_0033_04 a crm:E93_Presence ;
  rdfs:label "Under repair at Sheerness"@en ;
  crm:P195i_had_presence myData:PSL_0033 ;
  :has_operational_status :UnderRepair ;
  :has_propulsion_type :PaddleWheel ;
  :has_ship_type :PaddleSloop ;
  crm:P167_was_within myData:place_sheerness ;
  crm:P164_is_temporally_specified_by [
    a crm:E52_Time-Span ;
    crm:P82_at_some_time_within "1858"^^xsd:gYear
  ] .

myData:event_PSL_0033_05 a :Recommissioning ;
  rdfs:label "Recommissioned 3.6.1858"@en ;
  crm:P4_has_time-span [ a crm:E52_Time-Span ; crm:P82_at_some_time_within "1858-06-03"^^xsd:date ] .

myData:presence_PSL_0033_05 a crm:E93_Presence ;
  rdfs:label "In Commission (1858-1861) for the Channel, then to the Mediterranean"@en ;
  crm:P195i_had_presence myData:PSL_0033 ;
  :has_operational_status :InCommission ;
  :has_propulsion_type :PaddleWheel ;
  :has_ship_type :PaddleSloop ;
  crm:P164_is_temporally_specified_by [
    a crm:E52_Time-Span ;
    crm:P182i_starts_after_or_with_the_end_of myData:event_PSL_0033_05 ;
    crm:P182_ends_before_or_with_the_start_of myData:event_PSL_0033_06
  ] .

myData:event_PSL_0033_06 a :Decommissioning ;
  rdfs:label "Paid off 6.1861 at Sheerness"@en ;
  crm:P7_took_place_at myData:place_sheerness ;
  crm:P4_has_time-span [ a crm:E52_Time-Span ; crm:P82_at_some_time_within "1861-06"^^xsd:gYearMonth ] .

### Third Service Period
myData:presence_PSL_0033_06 a crm:E93_Presence ;
  rdfs:label "Paid off at Sheerness"@en ;
  crm:P195i_had_presence myData:PSL_0033 ;
  :has_operational_status :PaidOff ;
  :has_propulsion_type :PaddleWheel ;
  :has_ship_type :PaddleSloop ;
  crm:P167_was_within myData:place_sheerness ;
  crm:P164_is_temporally_specified_by [
    a crm:E52_Time-Span ;
    crm:P182i_starts_after_or_with_the_end_of myData:event_PSL_0033_06 ;
    crm:P182_ends_before_or_with_the_start_of myData:event_PSL_0033_07
  ] .

myData:event_PSL_0033_07 a :Recommissioning ;
  rdfs:label "Recommissioned 7.8.1862"@en ;
  crm:P4_has_time-span [ a crm:E52_Time-Span ; crm:P82_at_some_time_within "1862-08-07"^^xsd:date ] .

myData:presence_PSL_0033_07 a crm:E93_Presence ;
  rdfs:label "In Commission (1862-1869) for the East Indies and China"@en ;
  rdfs:comment "At bombardment of Kagoshima 15.8.1863; at bombardment of Shimonoseki 5-6.9.1864; in Abyssinian War 1868."@en ;
  crm:P195i_had_presence myData:PSL_0033 ;
  :has_operational_status :InCommission ;
  :has_propulsion_type :PaddleWheel ;
  :has_ship_type :PaddleSloop ;
  crm:P167_was_within myData:place_east_indies_and_china ;
  crm:P164_is_temporally_specified_by [
    a crm:E52_Time-Span ;
    crm:P182i_starts_after_or_with_the_end_of myData:event_PSL_0033_07 ;
    crm:P182_ends_before_or_with_the_start_of myData:event_PSL_0033_08
  ] .

myData:event_PSL_0033_08 a :Decommissioning ;
  rdfs:label "Paid off 3.12.1869"@en ;
  crm:P4_has_time-span [ a crm:E52_Time-Span ; crm:P82_at_some_time_within "1869-12-03"^^xsd:date ] .

### Fourth Service Period
myData:presence_PSL_0033_08 a crm:E93_Presence ;
  rdfs:label "Paid off"@en ;
  crm:P195i_had_presence myData:PSL_0033 ;
  :has_operational_status :PaidOff ;
  :has_propulsion_type :PaddleWheel ;
  :has_ship_type :PaddleSloop ;
  crm:P164_is_temporally_specified_by [
    a crm:E52_Time-Span ;
    crm:P182i_starts_after_or_with_the_end_of myData:event_PSL_0033_08 ;
    crm:P182_ends_before_or_with_the_start_of myData:event_PSL_0033_09
  ] .

myData:event_PSL_0033_09 a :Recommissioning ;
  rdfs:label "Recommissioned 26.3.1873"@en ;
  crm:P4_has_time-span [ a crm:E52_Time-Span ; crm:P82_at_some_time_within "1873-03-26"^^xsd:date ] .

myData:presence_PSL_0033_09 a crm:E93_Presence ;
  rdfs:label "In Commission (1873-1879) for west coast of Africa and North America/West Indies"@en ;
  rdfs:comment "In Ashanti War 1873."@en ;
  crm:P195i_had_presence myData:PSL_0033 ;
  :has_operational_status :InCommission ;
  :has_propulsion_type :PaddleWheel ;
  :has_ship_type :PaddleSloop ;
  crm:P167_was_within myData:place_west_coast_of_africa, myData:place_north_america_and_west_indies ;
  crm:P164_is_temporally_specified_by [
    a crm:E52_Time-Span ;
    crm:P182i_starts_after_or_with_the_end_of myData:event_PSL_0033_09 ;
    crm:P182_ends_before_or_with_the_start_of myData:event_PSL_0033_10
  ] .

myData:event_PSL_0033_10 a :Decommissioning ;
  rdfs:label "Paid off 12.12.1879 at Chatham"@en ;
  crm:P7_took_place_at myData:place_chatham ;
  crm:P4_has_time-span [ a crm:E52_Time-Span ; crm:P82_at_some_time_within "1879-12-12"^^xsd:date ] .

### Final Period and Destruction
myData:presence_PSL_0033_10 a crm:E93_Presence ;
  rdfs:label "Paid off at Chatham"@en ;
  crm:P195i_had_presence myData:PSL_0033 ;
  :has_operational_status :PaidOff ;
  :has_propulsion_type :PaddleWheel ;
  :has_ship_type :PaddleSloop ;
  crm:P167_was_within myData:place_chatham ;
  crm:P164_is_temporally_specified_by [
    a crm:E52_Time-Span ;
    crm:P182i_starts_after_or_with_the_end_of myData:event_PSL_0033_10 ;
    crm:P182_ends_before_or_with_the_start_of myData:event_PSL_0033_11
  ] .

myData:event_PSL_0033_11 a crm:E6_Destruction ;
  rdfs:label "Broken up (BU) at Chatham"@en ;
  crm:P13_destroyed myData:PSL_0033 ;
  crm:P7_took_place_at myData:place_chatham ;
  crm:P4_has_time-span [
    a crm:E52_Time-Span ;
    crm:P79_beginning_is_qualified_by "1881-09-10"^^xsd:date ;
    crm:P80_end_is_qualified_by "1881-10"^^xsd:gYearMonth
  ] .

myData:presence_PSL_0033_11 a crm:E93_Presence ;
  rdfs:label "Being broken up at Chatham"@en ;
  crm:P195i_had_presence myData:PSL_0033 ;
  :has_operational_status :BeingBrokenUp ;
  :has_propulsion_type :PaddleWheel ;
  :has_ship_type :PaddleSloop ;
  crm:P167_was_within myData:place_chatham ;
  crm:P164_is_temporally_specified_by [
    a crm:E52_Time-Span ;
    crm:P79_beginning_is_qualified_by "1881-09-10"^^xsd:date ;
    crm:P80_end_is_qualified_by "1881-10"^^xsd:gYearMonth
  ] .

# --- Data from file: PSPV_0001.ttl ---


### Places
myData:place_deptford a crm:E53_Place ; rdfs:label "Deptford"@en .
myData:place_woolwich a crm:E53_Place ; rdfs:label "Woolwich"@en .
myData:place_spain_portugal_coasts a crm:E53_Place ; rdfs:label "Coasts of Spain and Portugal"@en .
myData:place_ireland_coast a crm:E53_Place ; rdfs:label "Coast of Ireland"@en .
myData:place_scotland_west_coast a crm:E53_Place ; rdfs:label "West coast of Scotland"@en .
myData:place_cork a crm:E53_Place ; rdfs:label "Cork"@en .
myData:place_portsmouth a crm:E53_Place ; rdfs:label "Portsmouth"@en .

### Ship
myData:PSPV_0001 a sealit:Ship ;
  rdfs:label "HMS Comet"@en ;
  :has_propulsion_type :PaddleWheel ;
  :has_ship_type :SteamPaddleVessel ;
  dcterms:source "Winfield, Rif. British Warships in the Age of Sail, 1817-1863. Seaforth Publishing, 2014."@en .

### Career Events and Presences
myData:event_PSPV_0001_01 a crm:E12_Production ;
  rdfs:label "Construction of HMS Comet"@en ;
  crm:P7_took_place_at myData:place_deptford ;
  crm:P4_has_time-span [
    a crm:E52_Time-Span ;
    crm:P79_beginning_is_qualified_by "1819-11-10"^^xsd:date ; # Ord
    crm:P80_end_is_qualified_by "1822-05-23"^^xsd:date   # L
  ] ;
  :incurred_cost [
    a crm:E97_Monetary_Amount ;
    rdfs:comment "First cost: hull £8,052, fitting £1,313, machinery £5,050"@en ;
    crm:P90_has_value "14415.0"^^xsd:decimal
  ] .

myData:event_PSPV_0001_02 a :Commissioning ;
  rdfs:label "Completed for sea"@en ;
  crm:P4_has_time-span [ a crm:E52_Time-Span ; crm:P82_at_some_time_within "1822-07-13"^^xsd:date ] .

myData:presence_PSPV_0001_01 a crm:E93_Presence ;
  rdfs:label "At Deptford and Woolwich (1822-1836)"@en ;
  crm:P195i_had_presence myData:PSPV_0001 ;
  :has_operational_status :InOrdinary ;
  :has_propulsion_type :PaddleWheel ;
  :has_ship_type :SteamPaddleVessel ;
  crm:P167_was_within myData:place_deptford, myData:place_woolwich ;
  crm:P164_is_temporally_specified_by [
    a crm:E52_Time-Span ;
    crm:P182i_starts_after_or_with_the_end_of myData:event_PSPV_0001_02 ;
    crm:P182_ends_before_or_with_the_start_of myData:event_PSPV_0001_03
  ] .

myData:event_PSPV_0001_03 a :Recommissioning ;
  rdfs:label "Recommissioned under Lieut Robert Otway"@en ;
  crm:P4_has_time-span [ a crm:E52_Time-Span ; crm:P82_at_some_time_within "1836-04-23"^^xsd:date ] .

myData:presence_PSPV_0001_02 a crm:E93_Presence ;
  rdfs:label "Service off the coasts of Spain and Portugal (1836-1842)"@en ;
  crm:P195i_had_presence myData:PSPV_0001 ;
  :has_operational_status :InCommission ;
  :has_propulsion_type :PaddleWheel ;
  :has_ship_type :SteamPaddleVessel ;
  crm:P167_was_within myData:place_spain_portugal_coasts ;
  crm:P164_is_temporally_specified_by [
    a crm:E52_Time-Span ;
    crm:P182i_starts_after_or_with_the_end_of myData:event_PSPV_0001_03 ;
    crm:P182_ends_before_or_with_the_start_of myData:event_PSPV_0001_04
  ] .

myData:event_PSPV_0001_04 a :Refit ;
  rdfs:label "Refitted as a Surveying vessel at Deptford (for £3,195)"@en ;
  :modifies_ship myData:PSPV_0001 ;
  crm:P7_took_place_at myData:place_deptford ;
  crm:P4_has_time-span [ a crm:E52_Time-Span ; crm:P82_at_some_time_within "1842"^^xsd:gYear ] ;
  :incurred_cost [
    a crm:E97_Monetary_Amount ;
    rdfs:comment "£3,195"@en ;
    crm:P90_has_value "3195.0"^^xsd:decimal
  ] ;
  crm:P21_had_general_purpose :NonCombatDutyInvestment .

myData:presence_PSPV_0001_03 a crm:E93_Presence ;
  rdfs:label "Under refit at Deptford (1842)"@en ;
  crm:P195i_had_presence myData:PSPV_0001 ;
  :has_operational_status :UnderRepair ;
  :has_propulsion_type :PaddleWheel ;
  :has_ship_type :SteamPaddleVessel ;
  crm:P167_was_within myData:place_deptford ;
  crm:P164_is_temporally_specified_by [
    a crm:E52_Time-Span ;
    crm:P182i_starts_after_or_with_the_end_of myData:event_PSPV_0001_04 ;
    crm:P182_ends_before_or_with_the_start_of myData:event_PSPV_0001_05
  ] .

myData:event_PSPV_0001_05 a :Recommissioning ;
  rdfs:label "Recommissioned under Cmdr George Alexander Frazer for survey duty"@en ;
  crm:P4_has_time-span [ a crm:E52_Time-Span ; crm:P82_at_some_time_within "1842-07-15"^^xsd:date ] .

myData:presence_PSPV_0001_04 a crm:E93_Presence ;
  rdfs:label "Surveying on the coast of Ireland and west coast of Scotland (1842-1853)"@en ;
  crm:P195i_had_presence myData:PSPV_0001 ;
  :has_operational_status :InNonCombatDuty ;
  :has_propulsion_type :PaddleWheel ;
  :has_ship_role :SurveyingVessel ;
  crm:P167_was_within myData:place_ireland_coast, myData:place_scotland_west_coast, myData:place_cork ;
  crm:P164_is_temporally_specified_by [
    a crm:E52_Time-Span ;
    crm:P182i_starts_after_or_with_the_end_of myData:event_PSPV_0001_05 ;
    crm:P182_ends_before_or_with_the_start_of myData:event_PSPV_0001_06
  ] .

myData:event_PSPV_0001_06 a :Fitting ;
  rdfs:label "Fitted as a tug at Portsmouth"@en ;
  :modifies_ship myData:PSPV_0001 ;
  crm:P7_took_place_at myData:place_portsmouth ;
  crm:P4_has_time-span [ a crm:E52_Time-Span ; crm:P82_at_some_time_within "1854"^^xsd:gYear ] ;
  crm:P21_had_general_purpose :NonCombatDutyInvestment .

myData:presence_PSPV_0001_05 a crm:E93_Presence ;
  rdfs:label "Under fitting at Portsmouth (1854)"@en ;
  crm:P195i_had_presence myData:PSPV_0001 ;
  :has_operational_status :UnderFitting ;
  :has_propulsion_type :PaddleWheel ;
  :has_ship_type :SteamPaddleVessel ;
  crm:P167_was_within myData:place_portsmouth ;
  crm:P164_is_temporally_specified_by [ a crm:E52_Time-Span ; crm:P82_at_some_time_within "1854"^^xsd:gYear ] .

myData:presence_PSPV_0001_06 a crm:E93_Presence ;
  rdfs:label "Service as a tug at Portsmouth (1854-1868)"@en ;
  crm:P195i_had_presence myData:PSPV_0001 ;
  :has_operational_status :InNonCombatDuty ;
  :has_propulsion_type :PaddleWheel ;
  :has_ship_role :Tug ;
  crm:P167_was_within myData:place_portsmouth ;
  crm:P164_is_temporally_specified_by [
    a crm:E52_Time-Span ;
    crm:P182i_starts_after_or_with_the_end_of [ a crm:E52_Time-Span ; crm:P82_at_some_time_within "1854"^^xsd:gYear ] ;
    crm:P182_ends_before_or_with_the_start_of myData:event_PSPV_0001_07
  ] .

myData:event_PSPV_0001_07 a crm:E6_Destruction ;
  rdfs:label "Broken up (BU) at Portsmouth Dyd"@en ;
  crm:P13_destroyed myData:PSPV_0001 ;
  crm:P7_took_place_at myData:place_portsmouth ;
  crm:P4_has_time-span [
    a crm:E52_Time-Span ;
    crm:P79_beginning_is_qualified_by "1868-12-10"^^xsd:date
  ] .

myData:presence_PSPV_0001_07 a crm:E93_Presence ;
  rdfs:label "Being broken up at Portsmouth"@en ;
  crm:P195i_had_presence myData:PSPV_0001 ;
  :has_operational_status :BeingBrokenUp ;
  :has_propulsion_type :PaddleWheel ;
  :has_ship_type :SteamPaddleVessel ;
  crm:P167_was_within myData:place_portsmouth ;
  crm:P164_is_temporally_specified_by [
    a crm:E52_Time-Span ;
    crm:P182i_starts_after_or_with_the_end_of myData:event_PSPV_0001_07
  ] .

# --- Data from file: PSPV_0005.ttl ---


### Places
myData:place_deptford a crm:E53_Place ; rdfs:label "Deptford"@en .
myData:place_woolwich a crm:E53_Place ; rdfs:label "Woolwich"@en .
myData:place_mediterranean a crm:E53_Place ; rdfs:label "Mediterranean"@en .
myData:place_west_indies a crm:E53_Place ; rdfs:label "West Indies"@en .
myData:place_angostura a crm:E53_Place ; rdfs:label "Angostura"@en .
myData:place_chatham a crm:E53_Place ; rdfs:label "Chatham"@en .
myData:place_portsmouth a crm:E53_Place ; rdfs:label "Portsmouth"@en .
myData:place_north_america a crm:E53_Place ; rdfs:label "North America"@en .
myData:place_jamaica a crm:E53_Place ; rdfs:label "Jamaica"@en .
myData:place_baltic a crm:E53_Place ; rdfs:label "Baltic"@en .
myData:place_sheerness a crm:E53_Place ; rdfs:label "Sheerness"@en .

### Ship Roles
:Tender a :ShipRole ; rdfs:label "Tender"@en .
:TransportShip a :ShipRole ; rdfs:label "Transport Ship"@en .
:SurveyVessel a :ShipRole ; rdfs:label "Survey Vessel"@en .

### Ship
myData:PSPV_0005 a sealit:Ship ;
  rdfs:label "HMS Alban"@en ;
  :has_propulsion_type :PaddleWheel ;
  :has_ship_type :SteamPaddleVessel ;
  dcterms:source "Winfield, Rif. British Warships in the Age of Sail, 1817-1863. Seaforth Publishing, 2014."@en .

### Career Events and Presences

# Construction
myData:event_PSPV_0005_01 a crm:E12_Production ;
  rdfs:label "Built at Deptford Dockyard / Boulton & Watt engine"@en ;
  crm:P4_has_time-span [
    a crm:E52_Time-Span ;
    crm:P79_beginning_is_qualified_by "1824-05"^^xsd:gYearMonth ; # Ord
    crm:P80_end_is_qualified_by "1826-12-27"^^xsd:date # L
  ] ;
  :incurred_cost [
    a crm:E97_Monetary_Amount ;
    rdfs:comment "First cost: £12,293, +£4,950 for engine"@en ;
    crm:P90_has_value "17243.0"^^xsd:decimal
  ] ;
  crm:P21_had_general_purpose :CombatCapabilityInvestment .

# Completion and first service as Tender (1827-1831)
myData:event_PSPV_0005_02 a :Commissioning ;
  rdfs:label "Completed 6.5.1827"@en ;
  crm:P4_has_time-span [ a crm:E52_Time-Span ; crm:P82_at_some_time_within "1827-05-06"^^xsd:date ] .

myData:presence_PSPV_0005_01 a crm:E93_Presence ;
  rdfs:label "Tender at Deptford for towing and transport duties"@en ;
  crm:P195i_had_presence myData:PSPV_0005 ;
  :has_operational_status :InNonCombatDuty ;
  :has_ship_role :Tender, :TransportShip ;
  crm:P167_was_within myData:place_deptford ;
  crm:P164_is_temporally_specified_by [ a crm:E52_Time-Span ;
    crm:P182i_starts_after_or_with_the_end_of myData:event_PSPV_0005_02 ;
    crm:P182_ends_before_or_with_the_start_of myData:event_PSPV_0005_03 ] .

myData:event_PSPV_0005_03 a :ReEngining ;
  rdfs:label "Re-engined at Woolwich with new B&W 100nhp engine"@en ;
  :modifies_ship myData:PSPV_0005 ;
  crm:P7_took_place_at myData:place_woolwich ;
  crm:P4_has_time-span [
    a crm:E52_Time-Span ;
    crm:P79_beginning_is_qualified_by "1831-03"^^xsd:gYearMonth ;
    crm:P80_end_is_qualified_by "1831-04"^^xsd:gYearMonth
  ] ;
  :incurred_cost [
    a crm:E97_Monetary_Amount ;
    rdfs:comment "£4,403"@en ;
    crm:P90_has_value "4403.0"^^xsd:decimal
  ] ;
  crm:P21_had_general_purpose :CombatCapabilityInvestment .

myData:presence_PSPV_0005_02 a crm:E93_Presence ;
  rdfs:label "At Woolwich before re-engining"@en ;
  crm:P195i_had_presence myData:PSPV_0005 ;
  :has_operational_status :InCommission ;
  crm:P167_was_within myData:place_woolwich ;
  crm:P164_is_temporally_specified_by [ a crm:E52_Time-Span ;
    crm:P79_beginning_is_qualified_by "1830-06-11"^^xsd:date ;
    crm:P182_ends_before_or_with_the_start_of myData:event_PSPV_0005_03 ] .

myData:presence_PSPV_0005_03 a crm:E93_Presence ;
  rdfs:label "Under repair for re-engining at Woolwich"@en ;
  crm:P195i_had_presence myData:PSPV_0005 ;
  :has_operational_status :UnderRepair ;
  crm:P167_was_within myData:place_woolwich ;
  crm:P164_is_temporally_specified_by [ a crm:E52_Time-Span ;
    crm:P182i_starts_after_or_with_the_end_of myData:event_PSPV_0005_03 ;
    crm:P182_ends_before_or_with_the_start_of myData:event_PSPV_0005_04 ] .

# Service in Mediterranean and West Indies (1831-1839)
myData:event_PSPV_0005_04 a :Commissioning ;
  rdfs:label "Commissioned for the Mediterranean and West Indies"@en ;
  crm:P4_has_time-span [ a crm:E52_Time-Span ; crm:P82_at_some_time_within "1831-08-29"^^xsd:date ] .

myData:presence_PSPV_0005_04 a crm:E93_Presence ;
  rdfs:label "Service in the Mediterranean, West Indies, North America"@en ;
  crm:P195i_had_presence myData:PSPV_0005 ;
  :has_operational_status :InCommission ;
  crm:P167_was_within myData:place_mediterranean, myData:place_west_indies, myData:place_angostura, myData:place_north_america ;
  crm:P164_is_temporally_specified_by [ a crm:E52_Time-Span ;
    crm:P182i_starts_after_or_with_the_end_of myData:event_PSPV_0005_04 ;
    crm:P182_ends_before_or_with_the_start_of myData:event_PSPV_0005_05 ] .

myData:event_PSPV_0005_05 a :Decommissioning ;
  rdfs:label "Paid off 25.6.1839"@en ;
  crm:P4_has_time-span [ a crm:E52_Time-Span ; crm:P82_at_some_time_within "1839-06-25"^^xsd:date ] .

# Rebuilding and fitting for trooping (1839-1840)
myData:presence_PSPV_0005_05 a crm:E93_Presence ;
  rdfs:label "Paid off before rebuilding"@en ;
  crm:P195i_had_presence myData:PSPV_0005 ;
  :has_operational_status :PaidOff ;
  crm:P164_is_temporally_specified_by [ a crm:E52_Time-Span ;
    crm:P182i_starts_after_or_with_the_end_of myData:event_PSPV_0005_05 ;
    crm:P182_ends_before_or_with_the_start_of myData:event_PSPV_0005_06 ] .

myData:event_PSPV_0005_06 a :Rebuild ;
  rdfs:label "Rebuilt at Chatham, lengthened"@en ;
  :modifies_ship myData:PSPV_0005 ;
  crm:P7_took_place_at myData:place_chatham ;
  crm:P4_has_time-span [ a crm:E52_Time-Span ; crm:P79_beginning_is_qualified_by "1839"^^xsd:gYear ; crm:P80_end_is_qualified_by "1840"^^xsd:gYear ] ;
  :incurred_cost [ a crm:E97_Monetary_Amount ; rdfs:comment "£6,908"@en ; crm:P90_has_value "6908.0"^^xsd:decimal ] ;
  crm:P21_had_general_purpose :CombatCapabilityInvestment .

myData:event_PSPV_0005_07 a :Fitting ;
  rdfs:label "Fitted with Carron's engine and new boilers at Woolwich"@en ;
  :modifies_ship myData:PSPV_0005 ;
  crm:P7_took_place_at myData:place_woolwich ;
  crm:P4_has_time-span [ a crm:E52_Time-Span ; crm:P82_at_some_time_within "1840"^^xsd:gYear ] ;
  :incurred_cost [ a crm:E97_Monetary_Amount ; rdfs:comment "£8,319"@en ; crm:P90_has_value "8319.0"^^xsd:decimal ] ;
  crm:P21_had_general_purpose :CombatCapabilityInvestment .

myData:event_PSPV_0005_08 a :Fitting ;
  rdfs:label "Fitted for trooping at Chatham"@en ;
  :modifies_ship myData:PSPV_0005 ;
  crm:P7_took_place_at myData:place_chatham ;
  crm:P4_has_time-span [ a crm:E52_Time-Span ; crm:P82_at_some_time_within "1840"^^xsd:gYear ] ;
  :incurred_cost [ a crm:E97_Monetary_Amount ; rdfs:comment "£1,127"@en ; crm:P90_has_value "1127.0"^^xsd:decimal ] ;
  crm:P21_had_general_purpose :NonCombatDutyInvestment .

myData:presence_PSPV_0005_06 a crm:E93_Presence ;
  rdfs:label "Under rebuilding and fitting"@en ;
  crm:P195i_had_presence myData:PSPV_0005 ;
  :has_operational_status :UnderRepair ;
  crm:P167_was_within myData:place_chatham, myData:place_woolwich ;
  crm:P164_is_temporally_specified_by [ a crm:E52_Time-Span ;
    crm:P182i_starts_after_or_with_the_end_of myData:event_PSPV_0005_06 ;
    crm:P182_ends_before_or_with_the_start_of myData:event_PSPV_0005_09 ] .

# Service as transport and trooping (1840-1849)
myData:event_PSPV_0005_09 a :Commissioning ;
  rdfs:label "Commissioned as transport at Portsmouth"@en ;
  crm:P4_has_time-span [ a crm:E52_Time-Span ; crm:P82_at_some_time_within "1840-06-01"^^xsd:date ] .

myData:presence_PSPV_0005_07 a crm:E93_Presence ;
  rdfs:label "Service as transport and for trooping"@en ;
  crm:P195i_had_presence myData:PSPV_0005 ;
  :has_operational_status :InNonCombatDuty ;
  :has_ship_role :TransportShip ;
  crm:P164_is_temporally_specified_by [ a crm:E52_Time-Span ;
    crm:P182i_starts_after_or_with_the_end_of myData:event_PSPV_0005_09 ;
    crm:P182_ends_before_or_with_the_start_of myData:event_PSPV_0005_10 ] .

myData:event_PSPV_0005_10 a :Decommissioning ;
  rdfs:label "Paid off at Woolwich"@en ;
  crm:P7_took_place_at myData:place_woolwich ;
  crm:P4_has_time-span [ a crm:E52_Time-Span ; crm:P82_at_some_time_within "1849-02-16"^^xsd:date ] .

# Service in Jamaica and refit (1850-1854)
myData:presence_PSPV_0005_08 a crm:E93_Presence ;
  rdfs:label "Paid off at Woolwich"@en ;
  crm:P195i_had_presence myData:PSPV_0005 ;
  :has_operational_status :PaidOff ;
  crm:P167_was_within myData:place_woolwich ;
  crm:P164_is_temporally_specified_by [ a crm:E52_Time-Span ;
    crm:P182i_starts_after_or_with_the_end_of myData:event_PSPV_0005_10 ;
    crm:P80_end_is_qualified_by "1850-08"^^xsd:gYearMonth ] .

myData:presence_PSPV_0005_09 a crm:E93_Presence ;
  rdfs:label "Tender to Imaum at Jamaica"@en ;
  crm:P195i_had_presence myData:PSPV_0005 ;
  :has_operational_status :InNonCombatDuty ;
  :has_ship_role :Tender ;
  crm:P167_was_within myData:place_jamaica ;
  crm:P164_is_temporally_specified_by [ a crm:E52_Time-Span ;
    crm:P79_beginning_is_qualified_by "1850-08"^^xsd:gYearMonth ;
    crm:P182_ends_before_or_with_the_start_of myData:event_PSPV_0005_11 ] .

myData:event_PSPV_0005_11 a :Decommissioning ;
  rdfs:label "Returned to Woolwich and paid off"@en ;
  crm:P7_took_place_at myData:place_woolwich ;
  crm:P4_has_time-span [ a crm:E52_Time-Span ; crm:P82_at_some_time_within "1853-08-13"^^xsd:date ] .

myData:presence_PSPV_0005_10 a crm:E93_Presence ;
  rdfs:label "Paid off before refit"@en ;
  crm:P195i_had_presence myData:PSPV_0005 ;
  :has_operational_status :PaidOff ;
  crm:P167_was_within myData:place_woolwich ;
  crm:P164_is_temporally_specified_by [ a crm:E52_Time-Span ;
    crm:P182i_starts_after_or_with_the_end_of myData:event_PSPV_0005_11 ;
    crm:P182_ends_before_or_with_the_start_of myData:event_PSPV_0005_12 ] .

myData:event_PSPV_0005_12 a :Refit ;
  rdfs:label "Refitted and re-coppered"@en ;
  :modifies_ship myData:PSPV_0005 ;
  crm:P4_has_time-span [ a crm:E52_Time-Span ; crm:P79_beginning_is_qualified_by "1853-09"^^xsd:gYearMonth ; crm:P80_end_is_qualified_by "1854-03"^^xsd:gYearMonth ] .

myData:presence_PSPV_0005_11 a crm:E93_Presence ;
  rdfs:label "Under refit and re-coppering"@en ;
  crm:P195i_had_presence myData:PSPV_0005 ;
  :has_operational_status :UnderRepair ;
  crm:P164_is_temporally_specified_by [ a crm:E52_Time-Span ;
    crm:P182i_starts_after_or_with_the_end_of myData:event_PSPV_0005_12 ;
    crm:P182_ends_before_or_with_the_start_of myData:event_PSPV_0005_13 ] .

# Final service period and destruction (1854-1860)
myData:event_PSPV_0005_13 a :Recommissioning ;
  rdfs:label "Recommissioned 6.3.1854"@en ;
  crm:P4_has_time-span [ a crm:E52_Time-Span ; crm:P82_at_some_time_within "1854-03-06"^^xsd:date ] .

myData:presence_PSPV_0005_12 a crm:E93_Presence ;
  rdfs:label "Surveying in the Baltic"@en ;
  crm:P195i_had_presence myData:PSPV_0005 ;
  :has_operational_status :InNonCombatDuty ;
  :has_ship_role :SurveyVessel ;
  crm:P167_was_within myData:place_baltic, myData:place_woolwich, myData:place_sheerness ;
  crm:P164_is_temporally_specified_by [ a crm:E52_Time-Span ;
    crm:P182i_starts_after_or_with_the_end_of myData:event_PSPV_0005_13 ;
    crm:P182_ends_before_or_with_the_start_of myData:event_PSPV_0005_14 ] .

myData:event_PSPV_0005_14 a sealit:ShipRepair ;
  rdfs:label "Repairs at Sheerness following ice damage"@en ;
